,ID,Gene,Sequence,Description,Organism,Category,Class,x_coords,y_coords
57,P25485,E7,M H G N R P S L K D I T L I L D E I P E I V D L H C D E Q F D S S E E E N N H Q L T E P D V Q A Y G V V T T C C K C G R T V R L V V E C G Q A D L R E L E Q L F L K T L T L V C P H C A,Protein E7,Human papillomavirus type 2a,Disease,Oncogene,-0.938348114490509,-5.681434631347656
58,Q80921,E7,M R G D K A T I P D I E L E E L V L P A N L I S D E S L S P D A T A E E E F C P Y R I D S K C H N C G C R I R V T V A A T E F G I R C F E Q L L L K E L C L F C P A C S R Q L P R N G R S,Protein E7,Human papillomavirus type 48,Disease,Oncogene,4.660512924194336,-3.186586618423462
59,P27231,E7,M R G E T P T L K D I V L F D I P T C E T P I D L Y C Y E Q L D S S D E D D Q A K Q D I Q R Y R I L C V C T Q C Y K S V K L V V Q C T E A D I R N L Q Q M L L G T L D I V C P L C A R V E,Protein E7,Human papillomavirus 42,Disease,Oncogene,2.695983648300171,-3.8150293827056885
60,Q80928,E7,M R G D K P T I P D I V L E E L V L P V N L L S D E S I E T D D I A E S E R S P F K I D S T C K H C H C R V R L C C V A T D A A I R V F E C L L Q S E F S F L C L K C S K E L L R N G R T,Protein E7,Human papillomavirus type 50,Disease,Oncogene,6.089405059814453,-4.162408351898193
61,P06465,E7,M V G E M P A L K D L V L Q L E P S V L D L D L Y C Y E E V P P D D I E E E L V S P Q Q P Y A V V A S C A Y C E K L V R L T V L A D H S A I R Q L E E L L L R S L N I V C P L C T L Q R Q,Protein E7,Human papillomavirus type 1,Disease,Oncogene,4.22785758972168,-4.638130187988281
62,P36820,E7,M I G K E A T I P D I V L E L Q E L V Q P T D L H C Y E E L S E E E T E E E P R F I P Y K I V V P C C F C D S K L R L I V V A T P F G I R S Q Q D L L L E E V K L V C P G C R E K L R H V,Protein E7,Human papillomavirus 15,Disease,Oncogene,6.641618728637695,7.565598964691162
63,P36817,E7,M I G K E A T I P E V V L E L Q E L V Q P T A D L H C Y E E L T E E P A E E E Q C L T P Y K I V A G C G C G A R L R L Y V L A T N L G I R A Q Q E L L L G D I Q L V C P E C R G R L R H E,Protein E7,Human papillomavirus 9,Disease,Oncogene,5.237194538116455,-4.54743766784668
64,P51895,E7,M I G R T P K L S E L V L G E T A E A L S L H C D E A L E N L S D D D E E D H Q D R Q V H R E R P Y A V S V P C K R C R Q T I S F V C V C D P E A I R T L N R L L S A S L S L V C P E C C N,Protein E7,Cottontail rabbit papillomavirus (strain Washington B),Disease,Oncogene,0.2612971067428589,-6.305191993713379
65,P03130,E7,M I G R T P K L S E L V L G E T A E A L S L H C D E A L E N L S D D D E E D H Q D R Q V F I E R P Y A V S V P C K R C R Q T I S F V C V C A P E A I R T L N R L L S A S L S L V C P E C C N,Protein E7,Cottontail rabbit papillomavirus (strain Kansas),Disease,Oncogene,0.26730966567993164,-6.294248580932617
66,Q80901,E7,M I G K E A T I P E I V L E L Q E L V Q P T A D L H C Y E E L S E E E T E E E R P H I P Y K I V A P C C F C G S K L R L I V V A T P I G I R S Q E E L L L G E V Q L V C P N C R G K L R H D,Protein E7,Human papillomavirus 37,Disease,Oncogene,5.088743209838867,-4.241721153259277
67,P36821,E7,M I G K E A T I P D I V L E L Q Q L V Q P T D L H C Y E E L S E E E T E T E E E P R R I P Y K I V A P C C F C G S K L R L I V L A T H A G I R S Q E E L L L G E V Q L V C P N C R E K L R H D,Protein E7,Human papillomavirus 17,Disease,Oncogene,4.662671089172363,-3.277401924133301
68,Q80949,E7,M H G Q V A T I K D I V L E E R P E V V D L H C N E Q L L D S S E S E E E D S V R E Q L V E Q A Q Q A Y R V V T T C G I C K C P V R L V V Q C G D A D L K V L H E L L L G D L S I V C P G C A,Protein E7,Human papillomavirus type 61,Disease,Oncogene,-1.023869276046753,-4.098360061645508
69,Q81019,E7,M H G N V A T I E D I V L D L K P E P F D L Y C R E Q L E D S D A E D E T A V T Q P D K Q A F K V L S Q C G G V C C K T V R L C V Y S T H T G I R V L Q E L L H Q D A L Q I V C P T C A S R L,Protein E7,Human papillomavirus type 54,Disease,Oncogene,2.606790781021118,-3.756962776184082
70,P50782,E7,M I G K E V T L Q D I V L E L T E P Q T V D L H C E E E L P E Q D T E V E P E R R A Y K I I L C C G G G C G T R L R L F V A A T Q F G I R G L Q D L L L E E V V I L C P D C R N S D L Q H G G Q,Protein E7,Human papillomavirus 24,Disease,Oncogene,6.705685138702393,-2.1457221508026123
71,Q80942,E7,M I G N Q P N V N N L D V N L E E L V L P V S L L A D E E L S P D G D P E E E E H Y P Y T I D T C C K P C G A G V R F T I I A T P S A V I T L R Q L L L Q E V F L T C L R C S R S L F R H G R S,Protein E7,Human papillomavirus type 60,Disease,Oncogene,6.374556541442871,-4.549475193023682
72,Q89759,E7,M I G Q C A T L L D I V L T E Q P E P I D L Q C Y E Q L P S S D E E E E E E E P T E K N V Y R I E A A C G F C G K G V R F F C L S Q K E D L R V L Q V T L L S L S L V C T T C V Q T A K L D H G G,Protein E7,Canine oral papillomavirus (strain Y62),Disease,Oncogene,6.434094429016113,-1.6635854244232178
73,Q80914,E7,M H G N Y T T L K E I V L Q L E P P D P V G L H C N E Q L D S S E D E V D E L A T Q A T Q D V T Q P Y Q I V T T C G T C S R K V R L V V Q C T G T D I H H L H T L L L G S L D I L C P V C A P K T,Protein E7,Human papillomavirus 44,Disease,Oncogene,1.628517746925354,-5.64810037612915
74,P50781,E7,M I G K Q A T L R D I V L E E L V Q P I D L H C H E E L T E E V E E A V V E E E P E Y T P Y K I I V V C G G C E T Q L K L Y V L A T D F G I R S F Q A S L L E N V K L V C P A C R E D I R N G R R,Protein E7,Human papillomavirus 23,Disease,Oncogene,6.0910162925720215,-3.7058677673339844
75,P06429,E7,M R G H K P T L K E Y V L D L Y P E P T D L Y C Y E Q L S D S S D E D E G L D R P D G Q A Q P A T A D Y Y I V T C C H T C N T T V R L C V N S T A S D L R T I Q Q L L M G T V N I V C P T C A Q Q,Protein E7,Human papillomavirus 33,Disease,Oncogene,1.337662696838379,-6.426817417144775
76,P36828,E7,M H G K K P S V Q D I V L D L K P T T E T D L T C Y E S L D N S E D E D E T D S H L E R Q A E Q A W Y R I V T D C S R C Q S T V C L T I E S T H A D L L V L E D L L M G A L K I V C P N C S R R L,Protein E7,Human papillomavirus type 34,Disease,Oncogene,1.239974021911621,-4.985164642333984
77,Q80935,E7,M H G N Y P T L K E I V L E L D P P D P V G L H C N E Q L D S S E D E V D E L A T Q A T Q D V T Q P Y Q I V T T C G T C N R N V R L V V Q C T G T D I C Q L H T L L L G S L E I L C P V C A P K N,Protein E7,Human papillomavirus type 55,Disease,Oncogene,1.6404294967651367,-5.7819976806640625
78,P26557,E7,M R G N N P T L R E Y I L D L H P E P T D L F C Y E Q L C D S S D E D E I G L D G P D G Q A Q P A T A N Y Y I V T C C Y T C G T T V R L C I N S T T T D V R T L Q Q L L M G T C T I V C P S C A Q Q,Protein E7,Human papillomavirus 58,Disease,Oncogene,1.2053059339523315,-3.5780763626098633
79,Q07859,E7,M R G A A P R V A D L N L E L N D L V L P I N L L S E E V L Q P S D D E S E A P E E E L F P F R I D T C C Y R C E V N V R I T L F A V E F G L R A L E Q L I V D G K L T F C C T T C A R T L R N G R,Protein E7,Human papillomavirus 65,Disease,Oncogene,4.96070671081543,-3.751490354537964
80,P08350,E7,M K G Q N V T L Q D I A I E L E D T I S P I N L H C E E E I E T E E V D T P N P F A I T A T C Y A C E Q V L R L A V V T S T E G I H Q L Q Q L L F D N L F L L C A A C S K Q V F C N R R P E R N G P,Protein E7,Bos taurus papillomavirus 4,Disease,Oncogene,8.3663969039917,3.607790231704712
81,P06464,E7,M H G R H V T L K D I V L D L Q P P D P V G L H C Y E Q L V D S S E D E V D E V D G Q D S Q P L K Q H F Q I V T C C C G C D S N V R L V V Q C T E T D I R E V Q Q L L L G T L N I V C P I C A P K T,Protein E7,Human papillomavirus type 6b,Disease,Oncogene,2.901845932006836,-5.546197414398193
82,P17387,E7,M R G E T P T L Q D Y V L D L Q P E A T D L H C Y E Q L P D S S D E E D V I D S P A G Q A E P D T S N Y N I V T F C C Q C K S T L R L C V Q S T Q V D I R I L Q E L L M G S F G I V C P N C S T R L,Protein E7,Human papillomavirus 31,Disease,Oncogene,1.439626693725586,-4.809523582458496
83,P04020,E7,M H G R L V T L K D I V L D L Q P P D P V G L H C Y E Q L E D S S E D E V D K V D K Q D A Q P L T Q H Y Q I L T C C C G C D S N V R L V V E C T D G D I R Q L Q D L L L G T L N I V C P I C A P K P,Protein E7,Human papillomavirus 11,Disease,Oncogene,2.56500506401062,-5.665422439575195
84,Q8BDD8,E7,M K G Q D V T L K N V A V E L E D V V S P I I L D C E E E I E T E E V D C P A P Y A V E A V C Y V C E N P L R L A L V S S P D G I H Q L H Q L L L D C I S L L C A N C S R E V Y S N R R P Q R N G P,Protein E7,Bovine papillomavirus type 3,Disease,Oncogene,8.229056358337402,4.6212358474731445
85,P03129,E7,M H G D T P T L H E Y M L D L Q P E T T D L Y C Y E Q L N D S S E E E D E I D G P A G Q A E P D R A H Y N I V T F C C K C D S T L R L C V Q S T H V D I R T L E D L L M G T L G I V C P I C S Q K P,Protein E7,Human papillomavirus type 16,Disease,Oncogene,4.614017486572266,4.763480186462402
86,Q84292,E7,M H G R H V T L K D I V L D L Q P P D P V G L H C Y E Q L V D S S E D E V D E V D G Q D S Q P L K Q H F Q I V T C C C G C D S N V R L V V Q C T E T D I R E V Q Q L L L G T L D I V C P I C A P K T,Protein E7,Human papillomavirus type 6a,Disease,Oncogene,2.8296265602111816,-5.556844234466553
87,Q02272,E7,M H G K Y T T L K D I V L D L S P D P V G L H C N E Q L D S S E E D E V D E Q A T Q A T Q A T F T Q H Y Q I V T C C G Q C D S N V R L V V D C T G S D I Q H L H K L L L G S L N I V C P L C A P Q T,Protein E7,Pygmy chimpanzee papillomavirus type 1,Disease,Oncogene,2.1198782920837402,-5.868664264678955
88,P36831,E7,M R G D K A T I K D Y I L D L Q P E T T D L H C Y E Q L G D S S D E E D T D G V D R P D G Q A E Q A T S N Y Y I V T Y C H S C D S T L R L C I H S T A T D L R T L Q Q M L L G T L Q V V C P G C A R L,Protein E7,Human papillomavirus 52,Disease,Oncogene,2.2756030559539795,-3.8111844062805176
89,Q705F5,E7,M K G Q S M I L K D L A A E L E E V V S P I N L D C E E E I E T E E V D C P A P F A V E A V C H V C E Q V L R L A V V A S P D G I L Q L Q Q L L L T D S L S F L C T S C S R E A F C N R R P Q R N G S,Protein E7,Bos taurus papillomavirus 6,Disease,Oncogene,9.472431182861328,4.6842756271362305
90,P27230,E7,M H G E I T T L Q D Y V L D L E P E A T D L Y C Y E Q L C D S S E E E E D T I D G P A G Q A K P D T S N Y N I V T S C C K C E A T L R L C V Q S T H I D I R K L E D L L M G T F G I V C P G C S Q R A,Protein E7,Human papillomavirus 35,Disease,Oncogene,1.0583099126815796,-4.948113441467285
91,P50780,E7,M I G K Q A T L C D I V L E E L V L P I D L H C H E E L P E L P E E L E E S V V E E E P E Y T P Y K I V V Y C G G C D T K L K L Y I L A T L S G I R D F Q T S L L G P V K L L C P T C R E E I R N G R R,Protein E7,Human papillomavirus 22,Disease,Oncogene,6.060915946960449,-2.868046998977661
92,Q07857,E7,M R G A A P T V A D L N L E L N D L V L P A N L L S E E V L Q S S D D E Y E I T E E E S V V P F R I D T C C Y R C E V A V R I T L Y A A E L G L R T L E Q L L V E G K L T F C C T A C A R S L N R N G R,Protein E7,Human papillomavirus 4,Disease,Oncogene,5.842815399169922,-3.595316171646118
93,Q80908,E7,M I G K Q A T L R D I V L E E L V Q P I D L H C H E E L P D L P E D I E A S V V E E E P A Y T P Y K I I V L C G G C E V R L K L Y V W A T D A G I R N L Q D C L L G D V R L L C P T C R E D I R N G G R,Protein E7,Human papillomavirus 38,Disease,Oncogene,6.152839660644531,-3.1722562313079834
94,P26558,E7,M R G N V P Q L K D V V L H L T P Q T E I D L Q C Y E Q F D S S E E E D E V D N M R D Q L P E R R A G Q A T C Y R I E A P C C R C S S V V Q L A V E S S G D T L R V V Q Q M L M G E L S L V C P C C A N N,Protein E7,Human papillomavirus 51,Disease,Oncogene,1.175373911857605,-6.956925392150879
95,Q02271,E7,M H G K Y P T L K D I V L E L T P D P V G L H C N E Q L D S S E D E V D E Q A T Q A T Q A T Q H S T L L Q C Y Q I L T S C S K C C S N V R L V V E C T G P D I H D L H D L L L G T L N I V C P L C A P K S,Protein E7,Human papillomavirus 13,Disease,Oncogene,2.3892862796783447,-5.034389972686768
96,P50779,E7,M I G K E V T L Q D I V L E L N E L Q P E V Q P V D L F C E E E L P S E Q Q E T E E E L P E R T A Y K V V T P C G C C K V K L R I F V N A T Q F A I R T F Q N L L F E E L Q L L C P E C R G N C K H G G S,Protein E7,Human papillomavirus 21,Disease,Oncogene,6.434512138366699,-3.1373252868652344
97,P36822,E7,M I G K E V I L Q D I V L E L S E L Q P E V Q P V D L F C E E E L P T E Q Q E T E E E P A I E R S A Y K V V V L C G C C K V K L R I F V K A T Q F G I R T L Q D I L I E E L Q L L C P E C R G N C N H G G V,Protein E7,Human papillomavirus 19,Disease,Oncogene,5.442223072052002,-3.1245646476745605
98,Q9P2X7,DELEC1,M T M N V L E A G K W K S I V P A P G E G L L A V L H M M V F T D A L H R E R S V K W Q A G V C Y N G G K D F A V S L A R P K A A E G I A D,Deleted in esophageal cancer 1,Homo sapiens,Disease,Tumor suppressor,8.52622127532959,4.542158126831055
99,O43261,DLEU1,M R P C I W I H V H L K P P C R L V E L L P F S S A L Q G L S H L S L G T T L P V I L P E R N E E Q N L Q E L S H N A D K Y Q M G D C C K E E I D D S I F Y,Leukemia associated protein 1,Homo sapiens,Disease,Tumor suppressor,7.6585540771484375,4.63552713394165
100,Q9HBF5,ST20,M A R S R L T A T S V S Q V Q E N G F V K K L E P K S G W M T F L E V T G K I C E M L F C P E A I L L T R K D T P Y C E T G L I F L T L T K T I A N T Y F Y F,Suppressor of tumorigenicity 20 protein,Homo sapiens,Disease,Tumor suppressor,7.581646919250488,4.764559745788574
101,Q6UWK7,GPR15L,M R L L V L S S L L C I L L L C F S I F S T E G K R R P A K A W S G R R T R L C C H R V P S P N S T N L K G H H V R L C K P C K L E P E P R L W V V P G A L P Q V,Protein GPR15L,Homo sapiens,Disease,Tumor suppressor,8.437721252441406,5.161952495574951
102,A1L1L1,Cenpw,M V L S T T V C R R I R R K A P C A F L K R T L K Q K K P R L S L E K R C D L L I H L N C L L F V Q K L A E E S R T N A C E S K S G V I K K D H V Q A A A K V I L K K S R G,Centromere protein W,Rattus norvegicus,Disease,Tumor suppressor,-0.594841718673706,2.6838197708129883
103,Q3URR0,Cenpw,M A P S T T V T R R V K R K A P R A F L K R T L K Q K K P H L G L G R C C D L L I H L N C L L F I Q R L A E E S R T N A C E S K S R V I K K D H V L A A G K V I L K K S R G,Centromere protein W,Mus musculus,Disease,Tumor suppressor,5.954092025756836,3.19553804397583
104,O75896,TUSC2,M G A S G S K A R G L W P F A S A A G G G G S E A A G A E Q A L V R P R G R A V P P F V F T R R G S M F Y D E D G D L A H E F Y E E T I V T K N G Q K R A K L R R V H K N L I P Q G I V K L D H P R I H V D F P V I L Y E V,Tumor suppressor candidate 2,Homo sapiens,Disease,Tumor suppressor,4.283270359039307,2.5435502529144287
105,O35207,Cdk2ap1,M S Y K P N L T A H M P A A A L N A G S V H S P S T S M A T S S Q Y R Q L L S D Y G P P S L G Y T Q G T G N S Q V P Q S K Y A E L L A I I E E L G K E I R P T Y A G S K S A M E R L K R G I I H A R S L V R E C L A E T E R N A R S,Cyclin dependent kinase 2 associated protein 1,Mus musculus,Disease,Tumor suppressor,1.369204044342041,3.302157402038574
106,P49119,CDK2AP1,M S Y K P N L T A H M P A A A L N A G S V H S P S T S M A T S S Q Y R Q L L S D Y G P P S L G Y T Q G T G N S Q V P Q S K Y A E L L A I I E E L G K E I R P T Y A G S K S A M E R L K R G I I H A R S L V R E C L A E T E R N A R S,Cyclin dependent kinase 2 associated protein 1,Mesocricetus auratus,Disease,Tumor suppressor,1.366432785987854,3.305643320083618
107,O14519,CDK2AP1,M S Y K P N L A A H M P A A A L N A A G S V H S P S T S M A T S S Q Y R Q L L S D Y G P P S L G Y T Q G T G N S Q V P Q S K Y A E L L A I I E E L G K E I R P T Y A G S K S A M E R L K R G I I H A R G L V R E C L A E T E R N A R S,Cyclin dependent kinase 2 associated protein 1,Homo sapiens,Disease,Tumor suppressor,1.42634117603302,3.405708074569702
108,O60519,CREBL2,M D D S K V V G G K V K K P G K R G R K P A K I D L K A K L E R S R Q S A R E C R A R K K L R Y Q Y L E E L V S S R E R A I C A L R E E L E M Y K Q W C M A M D Q G K I P S E I K A L L T G E E Q N K S Q Q N S S R H T K A G K T D A N S N S W,cAMP responsive element binding protein like 2,Homo sapiens,Disease,Tumor suppressor,1.734494686126709,2.7987823486328125
109,Q8JHJ1,rpl35,M A K I K A R D L R G K K K E E L L K Q L D D L K V E L S Q L R V A K V T G G A A S K L S K I R V V R K S I A R V L T V I N Q T Q K E N L R K F Y K G K K Y K P L D L R P K K T R A I R R Q L T K H E E N L M T K K M Q R K S R L Y S I R K F A V K A,60S ribosomal protein L35,Danio rerio,Disease,Tumor suppressor,2.822829008102417,5.547909736633301
110,Q5PQT7,Phlda3,M T A A A T V L K E G V L E K R S G G L L Q L W K R K R C V L T E R G L Q L F E A K G T G G R P K E L S F S R I K A V E C V E S T G R H I Y F T L V T E G G G E I D F R C P L E D P G W N A Q I T L G L V K F K N Q Q A I Q T V R A R Q S L G T G T L V S,Pleckstrin homology like domain family A member 3,Rattus norvegicus,Disease,Tumor suppressor,6.4999799728393555,3.982619524002075
111,Q9WV95,Phlda3,M T A A A T V L K E G V L E K R S G G L L Q L W K R K R C V L T E R G L Q L F E A K G T G G R P K E L S F A R I K A V E C V E S T G R H I Y F T L V T E G G G E I D F R C P L E D P G W N A Q I T L G L V K F K N Q Q A I Q T V R A R Q S L G T G T L V S,Pleckstrin homology like domain family A member 3,Mus musculus,Disease,Tumor suppressor,6.484445095062256,3.914560556411743
112,Q8AW35,phlda3,M N Q C K V M N D G Y L E K R S N G L L Q L W K K K R C V L S D E G L R L Y G C K G D S G K E M R F E Q M T T L D C V E Y K R G L V Y F T I V M N D G K E V D F R C Q Q E G T A W N A E I A L A L V R F K N R V A V Q T G R N R H L S H L G S C G E G D V E L,Pleckstrin homology like domain family A member 3,Danio rerio,Disease,Tumor suppressor,6.915768146514893,4.570136547088623
113,Q9Y5J5,PHLDA3,M T A A A T A T V L K E G V L E K R S G G L L Q L W K R K R C V L T E R G L Q L F E A K G T G G R P K E L S F A R I K A V E C V E S T G R H I Y F T L V T E G G G E I D F R C P L E D P G W N A Q I T L G L V K F K N Q Q A I Q T V R A R Q S L G T G T L V S,Pleckstrin homology like domain family A member 3,Homo sapiens,Disease,Tumor suppressor,6.502281188964844,3.867457151412964
114,P55272,Cdkn2b,M L G G G S D A G L A T A A A R G Q V E T V R Q L L E A G A D P N A V N R F G R R P I Q V M M M G S A Q V A E L L L L H G A E P N C A D P A T L T R P V H D A A R E G F L D T L M V L H K A G A R L D V C D A W G R L P V D L A E E Q G H R D I A R Y L H A A T G D,Cyclin dependent kinase 4 inhibitor B,Rattus norvegicus,Disease,Tumor suppressor,-3.599208354949951,-2.9369585514068604
115,P55271,Cdkn2b,M L G G S S D A G L A T A A A R G Q V E T V R Q L L E A G A D P N A L N R F G R R P I Q V M M M G S A Q V A E L L L L H G A E P N C A D P A T L T R P V H D A A R E G F L D T L V V L H R A G A R L D V C D A W G R L P V D L A E E Q G H R D I A R Y L H A A T G D,Cyclin dependent kinase 4 inhibitor B,Mus musculus,Disease,Tumor suppressor,-3.6434972286224365,-2.9051921367645264
116,Q2KJD8,CDKN2B,M L S G G G G D A D L A N A A A R G Q V E A V R Q L L E A G V D P N R L N R F G R R P I Q V M M M G S A R V A E L L L L H G A D P N C A D P A T L T R P V H D A A R E G F L D T L V A L H R A G G R L D V R D A W G R L P V D L A E E R G H R D V A R Y L R A T A G D,Cyclin dependent kinase 4 inhibitor B,Bos taurus,Disease,Tumor suppressor,-3.631861925125122,-2.9141881465911865
117,Q8N726,CDKN2A,M V R R F L V T L R I R R A C G P P R V R V F V V H I P R L T G E W A A P G A P A A V A L V L M L L R S Q R L G Q Q P L P R R P G H D D G Q R P S G G A A A A P R R G A Q L R R P R H S H P T R A R R C P G G L P G H A G G A A P G R G A A G R A R C L G P S A R G P G,Tumor suppressor ARF,Homo sapiens,Disease,Tumor suppressor,7.557501316070557,3.974001884460449
118,P42772,CDKN2B,M R E E N K G M P S G G G S D E G L A S A A A R G L V E K V R Q L L E A G A D P N G V N R F G R R A I Q V M M M G S A R V A E L L L L H G A E P N C A D P A T L T R P V H D A A R E G F L D T L V V L H R A G A R L D V R D A W G R L P V D L A E E R G H R D V A G Y L R T A T G D,Cyclin dependent kinase 4 inhibitor B,Homo sapiens,Disease,Tumor suppressor,-3.6757678985595703,-2.9003281593322754
119,P49789,FHIT,M S F R F G Q H L I K P S V V F L K T E L S F A L V N R K P V V P G H V L V C P L R P V E R F H D L R P D E V A D L F Q T T Q R V G T V V E K H F H G T S L T F S M Q D G P E A G Q T V K H V H V H V L P R K A G D F H R N D S I Y E E L Q K H D K E D F P A S W R S E E E M A A E A A A L R V Y F Q,Bis 5 adenosyl triphosphatase,Homo sapiens,Disease,Tumor suppressor,2.350843667984009,8.209038734436035
120,O77618,CDKN2A,M I R R V R V T V R V S R A C R P H H V R I F V A K I V Q A L C R A S A S I N Q G T P F Q V L L I V R K K R H R G R S G H D D G Q C T P G S N P V A V R G G T Q H P R P D N P H P A S P R R C P G G L P G H S D A A P S G R G A A G C Q G L L G S P A C G P R R G T R T P P R G R I P A R G G E G R L N D T V Q E A Q,Tumor suppressor ARF,Monodelphis domestica,Disease,Tumor suppressor,8.164000511169434,3.944781541824341
121,P42771,CDKN2A,M E P A A G S S M E P S A D W L A T A A A R G R V E E V R A L L E A G A L P N A P N S Y G R R P I Q V M M M G S A R V A E L L L L H G A E P N C A D P A T L T R P V H D A A R E G F L D T L V V L H R A G A R L D V R D A W G R L P V D L A E E L G H R D V A R Y L R A A A G G T R G S N H A R I D A A E G P S D I P D,Cyclin dependent kinase inhibitor 2A,Homo sapiens,Disease,Tumor suppressor,7.411304473876953,3.669562339782715
122,Q9R0Z3,Cdkn2a,M E S S A D R L A R A A A L G R E H E V R A L L E A G A S P N A P N T F G R T P I Q V M M M G N V K V A A L L L S Y G A D S N C E D P T T L S R P V H D A A R E G F L D T L V V L H Q A G A R L D V R D A W G R L P L D L A L E R G H H D V V R Y L R Y L L S S A G N V S R V T D R H N F C S S T P R C L G L R G Q P P K Q R,Cyclin dependent kinase inhibitor 2A,Rattus norvegicus,Disease,Tumor suppressor,7.956813335418701,4.271622657775879
123,Q8QZZ9,Cdkn2a,M G R R F V V T V R I R R T G R S P Q V R V F L V Q F L G S S R P R S A N G T R G F V A L V L R P E R I A R R G P Q P H P G P G D D D G Q R Q S G S S P A L L W C R F E L R G P H H P L P T G A R R S A G G L P R H S G S T A P G R G A A G C A R C L G S P A A R P G P R A G T S R R R A V F A V S T L L R W E R F P G H R Q A,Tumor suppressor ARF,Rattus norvegicus,Disease,Tumor suppressor,8.312314987182617,5.6492180824279785
124,Q29RV0,CDKN2D,M L L E E V H A G D R L S G A A A R G D V Q E V R R L L H S E L V H P D V L N R F G K T A L Q V M M F G S P T I A L E L L K Q G A S P N V Q D A S G T T P A H D A A R T G F L D T L K V L V E H G A D V N A P D G T G A L P I H L A V R E G H T S V V S F L A T E S D L H H R D A T G L T P L E L A R G R G A Q E L M D I L Q R H T V A P L,Cyclin dependent kinase 4 inhibitor D,Bos taurus,Disease,Tumor suppressor,2.026695966720581,-0.7682297825813293
125,Q60773,Cdkn2d,M L L E E V C V G D R L S G A A A R G D V Q E V R R L L H R E L V H P D A L N R F G K T A L Q V M M F G S P A V A L E L L K Q G A S P N V Q D A S G T S P V H D A A R T G F L D T L K V L V E H G A D V N A L D S T G S L P I H L A I R E G H S S V V S F L A P E S D L H H R D A S G L T P L E L A R Q R G A Q N L M D I L Q G H M M I P M,Cyclin dependent kinase 4 inhibitor D,Mus musculus,Disease,Tumor suppressor,6.736613750457764,1.8087079524993896
126,P55273,CDKN2D,M L L E E V R A G D R L S G A A A R G D V Q E V R R L L H R E L V H P D A L N R F G K T A L Q V M M F G S T A I A L E L L K Q G A S P N V Q D T S G T S P V H D A A R T G F L D T L K V L V E H G A D V N V P D G T G A L P I H L A V Q E G H T A V V S F L A A E S D L H R R D A R G L T P L E L A L Q R G A Q D L V D I L Q G H M V A P L,Cyclin dependent kinase 4 inhibitor D,Homo sapiens,Disease,Tumor suppressor,2.0254549980163574,-0.7528911232948303
127,O08692,Ngp,M A G L W K T F V L V V A L A V V S C E A L R Q L R Y E E I V D R A I E A Y N Q G R Q G R P L F R L L S A T P P S S Q N P A T N I P L Q F R I K E T E C T S T Q E R Q P K D C D F L E D G E E R N C T G K F F R R R Q S T S L T L T C D R D C S R E D T Q E T S F N D K Q D V S E K E K F E D V P P H I R N I Y E D A K Y D I I G N I L K N F,Neutrophilic granule protein,Mus musculus,Disease,Tumor suppressor,7.554866313934326,3.1151022911071777
128,P51480,Cdkn2a,M E S A A D R L A R A A A Q G R V H D V R A L L E A G V S P N A P N S F G R T P I Q V M M M G N V H V A A L L L N Y G A D S N C E D P T T F S R P V H D A A R E G F L D T L V V L H G S G A R L D V R D A W G R L P L D L A Q E R G H Q D I V R Y L R S A G C S L C S A G W S L C T A G N V A Q T D G H S F S S S T P R A L E L R G Q S Q E Q S,Cyclin dependent kinase inhibitor 2A,Mus musculus,Disease,Tumor suppressor,8.980780601501465,4.1173224449157715
129,Q64364,Cdkn2a,M G R R F L V T V R I Q R A G R P L Q E R V F L V K F V R S R R P R T A S C A L A F V N M L L R L E R I L R R G P H R N P G P G D D D G Q R S R S S S S A Q L R C R F E L R G P H Y L L P P G A R R S A G R L P G H A G G A A R V R G S A G C A R C L G S P A A R L G P R A G T S R H R A I F A F R W V L F V F R W V V F V Y R W E R R P D R R A,Tumor suppressor ARF,Mus musculus,Disease,Tumor suppressor,8.755365371704102,4.984383583068848
130,O77617,CDKN2A,M G I V E K K E G G L E R N R A L F N S E G S C E G A K C G K E A S M H T K H E S E E S F S G E K L T E A A A R G R T E V V T E L L E L G T N P N A V N R F G R S A I Q V M M M G N V R L A A I L L Q Y G A E P N T P D P T T L T L P V H D A A R E G F L D T L M L L H R A G A R L D V R D S W G R L P V D L A E E Q G H H L V V A Y L R E V V R D A,Cyclin dependent kinase inhibitor 2A,Monodelphis domestica,Disease,Tumor suppressor,3.878851890563965,-6.014608860015869
131,O73753,nbl1,M T I W F L I G F L L P V A I F A A P P P I N R L A L F P D K S A W C E A K N I T Q I V G H S G C E S K S I Q N R A C L G Q C F S Y S V P N T F P Q S T E S L V H C D S C M P I D S V W D V V T L E C P G N E E F P R V D K L V E K I L Q C S C Q A C G K E L S Q E G A M F N V Y L N T A E D S P A E S L G H H Q H R P P A R E D D S P A Q S H R E G E S E E,Neuroblastoma suppressor of tumorigenicity 1,Xenopus laevis,Disease,Tumor suppressor,9.69806957244873,1.240373134613037
