,ID,Gene,Sequence,Description,Organism,Category,Class,x_coords,y_coords
0,Q156A1,ATXN8,M Q Q Q Q Q Q Q Q Q Q Q Q Q Q Q Q Q Q Q Q Q Q Q Q Q Q Q Q Q Q Q Q Q Q Q Q Q Q Q Q Q Q Q Q Q Q Q Q Q Q Q Q Q Q Q Q Q Q Q Q Q Q Q Q Q Q Q Q Q Q Q Q Q Q Q Q Q Q Q,Ataxin 8,Homo sapiens,Disease,Neurodegeneration,10.36776065826416,3.422945022583008
1,P04080,CSTB,M M C G A P S A T Q P A T A E T Q H I A D Q V R S Q L E E K E N K K F P V F K A V S F K S Q V V A G T N Y F I K V H V G D E D F V H L R V F Q S L P H E N K P L T L S N Y Q T N K A K H D E L T Y F,Cystatin B,Homo sapiens,Disease,Neurodegeneration,5.473429203033447,4.436985492706299
2,P12074,COX6A1,M A V V G V S S V S R L L G R S R P Q L G R P M S S G A H G E E G S A R M W K T L T F F V A L P G V A V S M L N V Y L K S H H G E H E R P E F I A Y P H L R I R T K P F P W G D G N H T L F H N P H V N P L P T G Y E D E,Cytochrome c oxidase subunit 6A1 mitochondrial,Homo sapiens,Disease,Neurodegeneration,0.9500441551208496,4.33970308303833
3,P23763,VAMP1,M S A P A Q P P A E G T E G T A P G G G P P G P P P N M T S N R R L Q Q T Q A Q V E E V V D I I R V N V D K V L E R D Q K L S E L D D R A D A L Q A G A S Q F E S S A A K L K R K Y W W K N C K M M I M L G A I C A I I V V V I V I Y F F T,Vesicle associated membrane protein 1,Homo sapiens,Disease,Neurodegeneration,1.4787406921386719,7.867434978485107
4,Q96A57,TMEM230,M M P S R T N L A T G I P S S K V K Y S R L S S T D D G Y I D L Q F K K T P P K I P Y K A I A L A T V L F L I G A F L I I I G S L L L S G Y I S K G G A D R A V P V L I I G I L V F L P G F Y H L R I A Y Y A S K G Y R G Y S Y D D I P D F D D,Transmembrane protein 230,Homo sapiens,Disease,Neurodegeneration,5.440385341644287,5.158437252044678
5,P02689,PMP2,M S N K F L G T W K L V S S E N F D D Y M K A L G V G L A T R K L G N L A K P T V I I S K K G D I I T I R T E S T F K N T E I S F K L G Q E F E E T T A D N R K T K S I V T L Q R G S L N Q V Q R W D G K E T T I K R K L V N G K M V A E C K M K G V V C T R I Y E K V,Myelin P2 protein,Homo sapiens,Disease,Neurodegeneration,-1.8591539859771729,4.0854878425598145
6,P37840,SNCA,M D V F M K G L S K A K E G V V A A A E K T K Q G V A E A A G K T K E G V L Y V G S K T K E G V V H G V A T V A E K T K E Q V T N V G G A V V T G V T A V A Q K T V E G A G S I A A A T G F V K K D Q L G K N E E G A P Q E G I L E D M P V D P D N E A Y E M P S E E G Y Q D Y E P E A,Alpha synuclein,Homo sapiens,Disease,Neurodegeneration,4.657224178314209,2.464714527130127
7,P07737,PFN1,M A G W N A Y I D N L M A D G T C Q D A A I V G Y K D S P S V W A A V P G K T F V N I T P A E V G V L V G K D R S S F Y V N G L T L G G Q K C S V I R D S L L Q D G E F S M D L R T K S T G G A P T F N V T V T K T D K T L V L L M G K E G V H G G L I N K K C Y E M A S H L R R S Q Y,Profilin 1,Homo sapiens,Disease,Neurodegeneration,-1.33601713180542,2.445488691329956
8,Q8WYQ3,CHCHD10,M P R G S R S A A S R P A S R P A A P S A H P P A H P P P S A A A P A P A P S G Q P G L M A Q M A T T A A G V A V G S A V G H V M G S A L T G A F S G G S S E P S Q P A V Q Q A P T P A A P Q P L Q M G P C A Y E I R Q F L D C S T T Q S D L S L C E G F S E A L K Q C K Y Y H G L S S L P,Coiled coil helix coiled coil helix domain containing protein 10 mitochondrial,Homo sapiens,Disease,Neurodegeneration,6.792038917541504,5.15565824508667
9,Q9Y587,AP4S1,M I K F F L M V N K Q G Q T R L S K Y Y E H V D I N K R T L L E T E V I K S C L S R S N E Q C S F I E Y K D F K L I Y R Q Y A A L F I V V G V N D T E N E M A I Y E F I H N F V E V L D E Y F S R V S E L D I M F N L D K V H I I L D E M V L N G C I V E T N R A R I L A P L L I L D K M S E S,AP 4 complex subunit sigma 1,Homo sapiens,Disease,Neurodegeneration,1.8944951295852661,3.99177885055542
10,P03950,ANG,M V M G L G V L L L V F V L G L G L T P P T L A Q D N S R Y T H F L T Q H Y D A K P Q G R D D R Y C E S I M R R R G L T S P C K D I N T F I H G N K R S I K A I C E N K N G N P H R E N L R I S K S S F Q V T T C K L H G G S P W P P C Q Y R A T A G F R N V V V A C E N G L P V H L D Q S I F R R P,Angiogenin,Homo sapiens,Disease,Neurodegeneration,6.216607570648193,1.7178288698196411
11,Q12988,HSPB3,M A K I I L R H L I E I P V R Y Q E E F E A R G L E D C R L D H A L Y A L P G P T I V D L R K T R A A Q S P P V D S A A E T P P R E G K S H F Q I L L D V V Q F L P E D I I I Q T F E G W L L I K A Q H G T R M D E H G F I S R S F T R Q Y K L P D G V E I K D L S A V L C H D G I L V V E V K D P V G T K,Heat shock protein beta 3,Homo sapiens,Disease,Neurodegeneration,5.520541191101074,4.119351387023926
12,Q9Y6H1,CHCHD2,M P R G S R S R T S R M A P P A S R A P Q M R A A P R P A P V A Q P P A A A P P S A V G S S A A A P R Q P G L M A Q M A T T A A G V A V G S A V G H T L G H A I T G G F S G G S N A E P A R P D I T Y Q E P Q G T Q P A Q Q Q Q P C L Y E I K Q F L E C A Q N Q G D I K L C E G F N E V L K Q C R L A N G L A,Coiled coil helix coiled coil helix domain containing protein 2,Homo sapiens,Disease,Neurodegeneration,3.2677388191223145,6.4446234703063965
13,Q9NSK7,C19orf12,M E R L K S H K P A T M T I M V E D I M K L L C S L S G E R K M K A A V K H S G K G A L V T G A M A F V G G L V G G P P G L A V G G A V G G L L G A W M T S G Q F K P V P Q I L M E L P P A E Q Q R L F N E A A A I I R H L E W T D A V Q L T A L V M G S E A L Q Q Q L L A M L V N Y V T K E L R A E I Q Y D D,Protein C19orf12,Homo sapiens,Disease,Neurodegeneration,2.6350653171539307,4.56342077255249
14,P00441,SOD1,M A T K A V C V L K G D G P V Q G I I N F E Q K E S N G P V K V W G S I K G L T E G L H G F H V H E F G D N T A G C T S A G P H F N P L S R K H G G P K D E E R H V G D L G N V T A D K D G V A D V S I E D S V I S L S G D H C I I G R T L V V H E K A D D L G K G G N E E S T K T G N A G S R L A C G V I G I A Q,Superoxide dismutase Cu Zn,Homo sapiens,Disease,Neurodegeneration,-2.273817300796509,3.8869540691375732
15,Q15649,ZNHIT3,M A S L K C S T V V C V I C L E K P K Y R C P A C R V P Y C S V V C F R K H K E Q C N P E T R P V E K K I R S A L P T K T V K P V E N K D D D D S I A D F L N S D E E E D R V S L Q N L K N L G E S A T L R S L L L N P H L R Q L M V N L D Q G E D K A K L M R A Y M Q E P L F V E F A D C C L G I V E P S Q N E E S,Zinc finger HIT domain containing protein 3,Homo sapiens,Disease,Neurodegeneration,2.435105085372925,2.8420283794403076
16,Q01453,PMP22,M L L L L L S I I V L H V A V L V L L F V S T I V S Q W I V G N G H A T D L W Q N C S T S S S G N V H H C F S S S P N E W L Q S V Q A T M I L S I I F S I L S L F L F F C Q L F T L T K G G R F Y I T G I F Q I L A G L C V M S A A A I Y T V R H P E W H L N S D Y S Y G F A Y I L A W V A F P L A L L S G V I Y V I L R K R E,Peripheral myelin protein 22,Homo sapiens,Disease,Neurodegeneration,2.1202447414398193,6.590261459350586
17,Q99732,LITAF,M S V P G P Y Q A A T G P S S A P S A P P S Y E E T V A V N S Y Y P T P P A P M P G P T T G L V T G P D G K G M N P P S Y Y T Q P A P I P N N N P I T V Q T V Y V Q H P I T F L D R P I Q M C C P S C N K M I V S Q L S Y N A G A L T W L S C G S L C L L G C I A G C C F I P F C V D A L Q D V D H Y C P N C R A L L G T Y K R L,Lipopolysaccharide induced tumor necrosis factor alpha factor,Homo sapiens,Disease,Neurodegeneration,2.5379910469055176,5.323090076446533
18,Q9H3J6,MTRFR,M S T V G L F H F P T P L T R I C P A P W G L R L W E K L T L L S P G I A V T P V Q M A G K K D Y P A L L S L D E N E L E E Q F V K G H G P G G Q A T N K T S N C V V L K H I P S G I V V K C H Q T R S V D Q N R K L A R K I L Q E K V D V F Y N G E N S P V H K E K R E A A K K K Q E R K K R A K E T L E K K K L L K E L W E S S K K V H,Mitochondrial translation release factor in rescue,Homo sapiens,Disease,Neurodegeneration,7.088220119476318,-5.348713397979736
19,Q99757,TXN2,M A Q R L L L R R F L A S V I S R K P S Q G Q W P P L T S R A L Q T P Q C S P G G L T V T P N P A R T I Y T T R I S L T T F N I Q D G P D F Q D R V V N S E T P V V V D F H A Q W C G P C K I L G P R L E K M V A K Q H G K V V M A K V D I D D H T D L A I E Y E V S A V P T V L A M K N G D V V D K F V G I K D E D Q L E A F L K K L I G,Thioredoxin mitochondrial,Homo sapiens,Disease,Neurodegeneration,-0.9522045850753784,5.242825508117676
20,Q5T5A4,C1orf194,M P P T R D P F Q Q P T L D N D D S Y L G E L R A S K K L P Y K N P T H L A Q Q Q E P W S R L N S T P T I T S M R R D A Y Y F D P E I P K D D L D F R L A A L Y N H H T G T F K N K S E I L L N Q K T T Q D T Y R T K I Q F P G E F L T P P T P P I T F L A N I R H W I N P K K E S I H S I Q G S I V S P H T A A T N G G Y S R K K D G G F F S T,Protein C1orf194,Homo sapiens,Disease,Neurodegeneration,7.240511894226074,5.328370094299316
21,Q5SV17,TMEM240,M S M S A N T M I F M I L G A S V V M A I A C L M D M N A L L D R F H N Y I L P H L R G E D R V C H C N C G R H H I H Y V I P Y D G D Q S V V D A S E N Y F V T D S V T K Q E I D L M L G L L L G F C I S W F L V W M D G V L H C A V R A W R A G R R Y D G S W T W L P K L C S L R E L G R R P H R P F E E A A G N M V H V K Q K L Y H N G H P S P R H L,Transmembrane protein 240,Homo sapiens,Disease,Neurodegeneration,8.499600410461426,4.1553192138671875
22,P02792,FTL,M S S Q I R Q N Y S T D V E A A V N S L V N L Y L Q A S Y T Y L S L G F Y F D R D D V A L E G V S H F F R E L A E E K R E G Y E R L L K M Q N Q R G G R A L F Q D I K K P A E D E W G K T P D A M K A A M A L E K K L N Q A L L D L H A L G S A R T D P H L C D F L E T H F L D E E V K L I K K M G D H L T N L H R L G G P E A G L G E Y L F E R L T L K H D,Ferritin light chain,Homo sapiens,Disease,Neurodegeneration,4.554224491119385,8.387361526489258
23,P39210,MPV17,M A L W R A Y Q R A L A A H P W K V Q V L T A G S L M G L G D I I S Q Q L V E R R G L Q E H Q R G R T L T M V S L G C G F V G P V V G G W Y K V L D R F I P G T T K V D A L K K M L L D Q G G F A P C F L G C F L P L V G A L N G L S A Q D N W A K L Q R D Y P D A L I T N Y Y L W P A V Q L A N F Y L V P L H Y R L A V V Q C V A V I W N S Y L S W K A H R L,Protein Mpv17,Homo sapiens,Disease,Neurodegeneration,3.3784072399139404,6.8200297355651855
24,Q99497,PARK7,M A S K R A L V I L A K G A E E M E T V I P V D V M R R A G I K V T V A G L A G K D P V Q C S R D V V I C P D A S L E D A K K E G P Y D V V V L P G G N L G A Q N L S E S A A V K E I L K E Q E N R K G L I A A I C A G P T A L L A H E I G F G S K V T T H P L A K D K M M N G G H Y T Y S E N R V E K D G L I L T S R G P G T S F E F A L A I V E A L N G K E V A A Q V K A P L V L K D,Parkinson disease protein 7,Homo sapiens,Disease,Neurodegeneration,3.3093042373657227,7.273403167724609
25,Q99653,CHP1,M G S R A S T L L R D E E L E E I K K E T G F S H S Q I T R L Y S R F T S L D K G E N G T L S R E D F Q R I P E L A I N P L G D R I I N A F F P E G E D Q V N F R G F M R T L A H F R P I E D N E K S K D V N G P E P L N S R S N K L H F A F R L Y D L D K D E K I S R D E L L Q V L R M M V G V N I S D E Q L G S I A D R T I Q E A D Q D G D S A I S F T E F V K V L E K V D V E Q K M S I R F L H,Calcineurin B homologous protein 1,Homo sapiens,Disease,Neurodegeneration,0.2881946563720703,5.842011451721191
26,Q9UJY1,HSPB8,M A D G Q M P F S C H Y P S R L R R D P F R D S P L S S R L L D D G F G M D P F P D D L T A S W P D W A L P R L S S A W P G T L R S G M V P R G P T A T A R F G V P A E G R T P P P F P G E P W K V C V N V H S F K P E E L M V K T K D G Y V E V S G K H E E K Q Q E G G I V S K N F T K K I Q L P A E V D P V T V F A S L S P E G L L I I E A P Q V P P Y S T F G E S S F N N E L P Q D S Q E V T C T,Heat shock protein beta 8,Homo sapiens,Disease,Neurodegeneration,1.4977407455444336,0.4970758855342865
27,Q9HD42,CHMP1A,M D D T L F Q L K F T A K Q L E K L A K K A E K D S K A E Q A K V K K A L L Q K N V E C A R V Y A E N A I R K K N E G V N W L R M A S R V D A V A S K V Q T A V T M K G V T K N M A Q V T K A L D K A L S T M D L Q K V S S V M D R F E Q Q V Q N L D V H T S V M E D S M S S A T T L T T P Q E Q V D S L I M Q I A E E N G L E V L D Q L S Q L P E G A S A V G E S S V R S Q E D Q L S R R L A A L R N,Charged multivesicular body protein 1a,Homo sapiens,Disease,Neurodegeneration,1.161256194114685,5.268500328063965
28,Q9H3Z4,DNAJC5,M A D Q R Q R S L S T S G E S L Y H V L G L D K N A T S D D I K K S Y R K L A L K Y H P D K N P D N P E A A D K F K E I N N A H A I L T D A T K R N I Y D K Y G S L G L Y V A E Q F G E E N V N T Y F V L S S W W A K A L F V F C G L L T C C Y C C C C L C C C F N C C C G K C K P K A P E G E E T E F Y V S P E D L E A Q L Q S D E R E A T D T P I V I Q P A S A T E T T Q L T A D S H P S Y H T D G F N,DnaJ homolog subfamily C member 5,Homo sapiens,Disease,Neurodegeneration,-0.08668003976345062,4.603523254394531
29,P61026,RAB10,M A K K T Y D L L F K L L L I G D S G V G K T C V L F R F S D D A F N T T F I S T I G I D F K I K T V E L Q G K K I K L Q I W D T A G Q E R F H T I T T S Y Y R G A M G I M L V Y D I T N G K S F E N I S K W L R N I D E H A N E D V E R M L L G N K C D M D D K R V V P K G K G E Q I A R E H G I R F F E T S A K A N I N I E K A F L T L A E D I L R K T P V K E P N S E N V D I S S G G G V T G W K S K C C,Ras related protein Rab 10,Homo sapiens,Disease,Neurodegeneration,-1.6301956176757812,7.490514755249023
30,Q9H902,REEP1,M V S W I I S R L V V L I F G T L Y P A Y Y S Y K A V K S K D I K E Y V K W M M Y W I I F A L F T T A E T F T D I F L C W F P F Y Y E L K I A F V A W L L S P Y T K G S S L L Y R K F V H P T L S S K E K E I D D C L V Q A K D R S Y D A L V H F G K R G L N V A A T A A V M A A S K G Q G A L S E R L R S F S M Q D L T T I R G D G A P A P S G P P P P G S G R A S G K H G Q P K M S R S A S E S A S S S G T A,Receptor expression enhancing protein 1,Homo sapiens,Disease,Neurodegeneration,-0.09287488460540771,8.586267471313477
31,Q15041,ARL6IP1,M A E G D N R S T N L L A A E T A S L E E Q L Q G W G E V M L M A D K V L R W E R A W F P P A I M G V V S L V F L I I Y Y L D P S V L S G V S C F V M F L C L A D Y L V P I L A P R I F G S N K W T T E Q Q Q R F H E I C S N L V K T R R R A V G W W K R L F T L K E E K P K M Y F M T M I V S L A A V A W V G Q Q V H N L L L T Y L I V T S L L L L P G L N Q H G I I L K Y I G M A K R E I N K L L K Q K E K K N E,ADP ribosylation factor like protein 6 interacting protein 1,Homo sapiens,Disease,Neurodegeneration,4.797314643859863,3.4383950233459473
32,P04792,HSPB1,M T E R R V P F S L L R G P S W D P F R D W Y P H S R L F D Q A F G L P R L P E E W S Q W L G G S S W P G Y V R P L P P A A I E S P A V A A P A Y S R A L S R Q L S S G V S E I R H T A D R W R V S L D V N H F A P D E L T V K T K D G V V E I T G K H E E R Q D E H G Y I S R C F T R K Y T L P P G V D P T Q V S S S L S P E G T L T V E A P M P K L A T Q S N E I T I P V T F E S R A Q L G G P E A A K S D E T A A K,Heat shock protein beta 1,Homo sapiens,Disease,Neurodegeneration,1.0879231691360474,1.6712327003479004
33,P51149,RAB7A,M T S R K K V L L K V I I L G D S G V G K T S L M N Q Y V N K K F S N Q Y K A T I G A D F L T K E V M V D D R L V T M Q I W D T A G Q E R F Q S L G V A F Y R G A D C C V L V F D V T A P N T F K T L D S W R D E F L I Q A S P R D P E N F P F V V L G N K I D L E N R Q V A T K R A Q A W C Y S K N N I P Y F E T S A K E A I N V E Q A F Q T I A R N A L K Q E T E V E L Y N E F P E P I K L D K N D R A K A S A E S C S C,Ras related protein Rab 7a,Homo sapiens,Disease,Neurodegeneration,5.336515426635742,5.928771495819092
34,O14653,GOSR2,M D P L F Q Q T H K Q V H E I Q S C M G R L E T A D K Q S V H I V E N E I Q A S I D Q I F S R L E R L E I L S S K E P P N K R Q N A R L R V D Q L K Y D V Q H L Q T A L R N F Q H R R H A R E Q Q E R Q R E E L L S R T F T T N D S D T T I P M D E S L Q F N S S L Q K V H N G M D D L I L D G H N I L D G L R T Q R L T L K G T Q K K I L D I A N M L G L S N T V M R L I E K R A F Q D K Y F M I G G M L L T C V V M F L V V Q Y L T,Golgi SNAP receptor complex member 2,Homo sapiens,Disease,Neurodegeneration,2.083442211151123,7.160053253173828
35,Q9UQN3,CHMP2B,M A S L F K K K T V D D V I K E Q N R E L R G T Q R A I I R D R A A L E K Q E K Q L E L E I K K M A K I G N K E A C K V L A K Q L V H L R K Q K T R T F A V S S K V T S M S T Q T K V M N S Q M K M A G A M S T T A K T M Q A V N K K M D P Q K T L Q T M Q N F Q K E N M K M E M T E E M I N D T L D D I F D G S D D E E E S Q D I V N Q V L D E I G I E I S G K M A K A P S A A R S L P S A S T S K A T I S D E E I E R Q L K A L G V D,Charged multivesicular body protein 2b,Homo sapiens,Disease,Neurodegeneration,1.034292221069336,5.538863182067871
36,Q96F25,ALG14,M V C V L V L A A A A G A V A V F L I L R I W V V L R S M D V T P R E S L S I L V V A G S G G H T T E I L R L L G S L S N A Y S P R H Y V I A D T D E M S A N K I N S F E L D R A D R D P S N M Y T K Y Y I H R I P R S R E V Q Q S W P S T V F T T L H S M W L S F P L I H R V K P D L V L C N G P G T C V P I C V S A L L L G I L G I K K V I I V Y V E S I C R V E T L S M S G K I L F H L S D Y F I V Q W P A L K E K Y P K S V Y L G R I V,UDP N acetylglucosamine transferase subunit ALG14 homolog,Homo sapiens,Disease,Neurodegeneration,-0.9618162512779236,-2.4111921787261963
37,Q99720,SIGMAR1,M Q W A V G R R W A W A A L L L A V A A V L T Q V V W L W L G T Q S F V F Q R E E I A Q L A R Q Y A G L D H E L A F S R L I V E L R R L H P G H V L P D E E L Q W V F V N A G G W M G A M C L L H A S L S E Y V L L F G T A L G S R G H S G R Y W A E I S D T I I S G T F H Q W R E G T T K S E V F Y P G E T V V H G P G E A T A V E W G P N T W M V E Y G R G V I P S T L A F A L A D T V F S T Q D F L T L F Y T L R S Y A R G L R L E L T T Y L F G Q D P,Sigma non opioid intracellular receptor 1,Homo sapiens,Disease,Neurodegeneration,3.7681667804718018,4.565861225128174
38,P09936,UCHL1,M Q L K P M E I N P E M L N K V L S R L G V A G Q W R F V D V L G L E E E S L G S V P A P A C A L L L L F P L T A Q H E N F R K K Q I E E L K G Q E V S P K V Y F M K Q T I G N S C G T I G L I H A V A N N Q D K L G F E D G S V L K Q F L S E T E K M S P E D R A K C F E K N E A I Q A A H D A V A Q E G Q C R V D D K V N F H F I L F N N V D G H L Y E L D G R M P F P V N H G A S S E D T L L K D A A K V C R E F T E R E Q G E V R F S A V A L C K A A,Ubiquitin carboxyl terminal hydrolase isozyme L1,Homo sapiens,Disease,Neurodegeneration,-2.2497317790985107,2.9520037174224854
39,Q9NZC2,TREM2,M E P L R L L I L L F V T E L S G A H N T T V F Q G V A G Q S L Q V S C P Y D S M K H W G R R K A W C R Q L G E K G P C Q R V V S T H N L W L L S F L R R W N G S T A I T D D T L G G T L T I T L R N L Q P H D A G L Y Q C Q S L H G S E A D T L R K V L V E V L A D P L D H R D A G D L W F P G E S E S F E D A H V E H S I S R S L L E G E I P F P P T S I L L L L A C I F L I K I L A A S A L W A A A W H G Q K P G T H P P S E L D C G H D P G Y Q L Q T L P G L R D T,Triggering receptor expressed on myeloid cells 2,Homo sapiens,Disease,Neurodegeneration,7.916563987731934,3.299833297729492
40,Q96BR5,COA7,M A G M V D F Q D E E Q V K S F L E N M E V E C N Y H C Y H E K D P D G C Y R L V D Y L E G I R K N F D E A A K V L K F N C E E N Q H S D S C Y K L G A Y Y V T G K G G L T Q D L K A A A R C F L M A C E K P G K K S I A A C H N V G L L A H D G Q V N E D G Q P D L G K A R D Y Y T R A C D G G Y T S S C F N L S A M F L Q G A P G F P K D M D L A C K Y S M K A C D L G H I W A C A N A S R M Y K L G D G V D K D E A K A E V L K N R A Q Q L H K E Q Q K G V Q P L T F G,Cytochrome c oxidase assembly factor 7,Homo sapiens,Disease,Neurodegeneration,-0.6579705476760864,0.8817117810249329
41,P0DPK4,NOTCH2NLC,M C V T Y H N G T G Y C K C P E G F L G E Y C Q H R D P C E K N R C Q N G G T C V A Q A M L G K A T C R C A S G F T G E D C Q Y S T S H P C F V S R P C L N G G T C H M L S R D T Y E C T C Q V G F T G K E C Q W T D A C L S H P C A N G S T C T T V A N Q F S C K C L T G F T G Q K C E T D V N E C D I P G H C Q H G G T C L N L P G S Y Q C Q C L Q G F T G Q Y C D S L Y V P C A P S P C V N G G T C R Q T G D F T F E C N C L P E T V R R G T E L W E R D R E V W N G K E H D E N,Notch homolog 2 N terminal like protein C,Homo sapiens,Disease,Neurodegeneration,7.616727828979492,4.342164516448975
42,P01138,NGF,M S M L F Y T L I T A F L I G I Q A E P H S E S N V P A G H T I P Q A H W T K L Q H S L D T A L R R A R S A P A A A I A A R V A G Q T R N I T V D P R L F K K R R L R S P R V L F S T Q P P R E A A D T Q D L D F E V G G A A P F N R T H R S K R S S S H P I F H R G E F S V C D S V S V W V G D K T T A T D I K G K E V M V L G E V N I N N S V F K Q Y F F E T K C R D P N P V D S G C R G I D S K H W N S Y C T T T H T F V K A L T M D G K Q A A W R F I R I D T A C V C V L S R K A V R R A,Beta nerve growth factor,Homo sapiens,Disease,Neurodegeneration,-2.4339935779571533,-3.75744366645813
43,O95292,VAPB,M A K V E Q V L S L E P Q H E L K F R G P F T D V V T T N L K L G N P T D R N V C F K V K T T A P R R Y C V R P N S G I I D A G A S I N V S V M L Q P F D Y D P N E K S K H K F M V Q S M F A P T D T S D M E A V W K E A K P E D L M D S K L R C V F E L P A E N D K P H D V E I N K I I S T T A S K T E T P I V S K S L S S S L D D T E V K K V M E E C K R L Q G E V Q R L R E E N K Q F K E E D G L R M R K T V Q S N S P I S A L A P T G K E E G L S T R L L A L V V L F F I V G V I I G K I A L,Vesicle associated membrane protein associated protein B C,Homo sapiens,Disease,Neurodegeneration,1.1564819812774658,7.023591041564941
44,Q92915,FGF14,M A A A I A S G L I R Q K R Q A R E Q H W D R P S A S R R R S S P S K N R G L C N G N L V D I F S K V R I F G L K K R R L R R Q D P Q L K G I V T R L Y C R Q G Y Y L Q M H P D G A L D G T K D D S T N S T L F N L I P V G L R V V A I Q G V K T G L Y I A M N G E G Y L Y P S E L F T P E C K F K E S V F E N Y Y V I Y S S M L Y R Q Q E S G R A W F L G L N K E G Q A M K G N R V K K T K P A A H F L P K P L E V A M Y R E P S L H D V G E T V P K P G V T P S K S T S A S A I M N G G K P V N K S K T T,Fibroblast growth factor 14,Homo sapiens,Disease,Neurodegeneration,0.21358266472816467,4.233201503753662
45,P25189,MPZ,M A P G A P S S S P S P I L A V L L F S S L V L S P A Q A I V V Y T D R E V H G A V G S R V T L H C S F W S S E W V S D D I S F T W R Y Q P E G G R D A I S I F H Y A K G Q P Y I D E V G T F K E R I Q W V G D P R W K D G S I V I H N L D Y S D N G T F T C D V K N P P D I V G K T S Q V T L Y V F E K V P T R Y G V V L G A V I G G V L G V V L L L L L L F Y V V R Y C W L R R Q A A L Q R R L S A M E K G K L H K P G K D A S K R G R Q T P V L Y A M L D H S R S T K A V S E K K A K G L G E S R K D K K,Myelin protein P0,Homo sapiens,Disease,Neurodegeneration,-0.07179883122444153,3.220424175262451
46,Q9BRK0,REEP2,M V S W I I S R L V V L I F G T L Y P A Y S S Y K A V K T K N V K E Y V K W M M Y W I V F A F F T T A E T L T D I V L S W F P F Y F E L K I A F V I W L L S P Y T K G S S V L Y R K F V H P T L S N K E K E I D E Y I T Q A R D K S Y E T M M R V G K R G L N L A A N A A V T A A A K G V L S E K L R S F S M Q D L T L I R D E D A L P L Q R P D G R L R P S P G S L L D T I E D L G D D P A L S L R S S T N P A D S R T E A S E D D M G D K A P K R A K P I K K A P K A E P L A S K T L K T R P K K K T S G G G D S A,Receptor expression enhancing protein 2,Homo sapiens,Disease,Neurodegeneration,1.0160000324249268,2.067025661468506
47,P01213,PDYN,M A W Q G L V L A A C L L M F P S T T A D C L S R C S L C A V K T Q D G P K P I N P L I C S L Q C Q A A L L P S E E W E R C Q S F L S F F T P S T L G L N D K E D L G S K S V G E G P Y S E L A K L S G S F L K E L E K S K F L P S I S T K E N T L S K S L E E K L R G L S D G F R E G A E S E L M R D A Q L N D G A M E T G T L Y L A E E D P K E Q V K R Y G G F L R K Y P K R S S E V A G E G D G D S M G H E D L Y K R Y G G F L R R I R P K L K W D N Q K R Y G G F L R R Q F K V V T R S Q E D P N A Y S G E L F D A,Proenkephalin B,Homo sapiens,Disease,Neurodegeneration,3.8102850914001465,2.887427568435669
48,P0CK45,E5,M P N L W F L L F L G L V A A M Q L L L L L F L L L F F L V Y W D H F E C S C T G L P F,Protein E5,Bovine papillomavirus type 1,Disease,Oncogene,7.84548807144165,5.21283483505249
49,P0CK46,E5,M P N L W F L L F L G L V A A M Q L L L L L F L L L F F L V Y W D H F E C S C T G L P F,Protein E5,Bos taurus papillomavirus 2,Disease,Oncogene,7.845579147338867,5.213028430938721
50,P36818,E7,M H G P H P T V K D I E L S L A P E D I P V C N V Q L D E E D Y T D A V E P A Q Q A Y R V V T E C T K C S L P L R L V V E C S H A D I R A L E Q L L L G T L K L V C P R C V,Protein E7,Human papillomavirus type 10,Disease,Oncogene,-0.6976409554481506,-4.789545059204102
51,Q705D1,E7,M H G P H P T V K D I E L S L A P E D I P V V C N V Q L D E E D Y T D V V E P A Q Q A Y R V V T V C P K C S L P L R L V V E C S H A D I R A L E R L L L G T L K L V C P R C V,Protein E7,Human papillomavirus type 94,Disease,Oncogene,-0.5572466850280762,-4.985222816467285
52,P50783,E7,M H G P H P T V K D I E L S L A P E D V P V Q C N V Q L D E E D Y T N V E E P A Q Q A Y R V V T L C P K C S S P L R L V V E C S H A D I R A L E Q L L L G T L T V V C P R C V,Protein E7,Human papillomavirus 28,Disease,Oncogene,-0.6902357935905457,-4.780974388122559
53,Q07858,E7,M V G E Q P N I G D L V S Q E E P S V L D L N C Y E D I P A E E E E S E Y P Y A I V L P C G L C D Q L L R L T C V S D L S T L T R L E E L L L G S L R I V C P L C A I R H Q R H,Protein E7,Human papillomavirus type 63,Disease,Oncogene,5.761346340179443,-2.4978628158569336
54,P50784,E7,M H G P K P T V K D I E L D L A P E A V P L V C N E Q L D S S D E E D C I D V V E P A Q Q A Y R V V T L C T K C S T T L R L V V E S S E A D I R A F Q E L L L R T L K I V C P R C A,Protein E7,Human papillomavirus 29,Disease,Oncogene,-0.9534723162651062,-5.017868518829346
55,P22160,E7,M H G E R P S L E D I T L I L E E I P E I V D L H C D E Q F D N S E E D T N Y Q L T E P A V Q A Y G V V T T C C K C H S T V R L V V E C G A A D I R H L E Q L F L N T L T I V C P R C V,Protein E7,Human papillomavirus 57,Disease,Oncogene,-0.7781806588172913,-5.751743316650391
56,P36825,E7,M H G T R P S L A D I T L I L E E I P E I I D L H C D E Q F D S S E E E N N H Q L T E P A V Q A Y G V V T T C C K C G R A V R L V V E C G P E D I R D L E Q L F L K T L N L V C P H C A,Protein E7,Human papillomavirus 27,Disease,Oncogene,-0.9932530522346497,-5.669968605041504
