,ID,Gene,Sequence,Description,Organism,Category,Class,x_coords,y_coords
132,Q6DF53,nbl1,M T V W L L I G F L L P V A I F A A P P I N R L A L F P D K S A W C E A K N I T Q I V G H S G C E S K S I Q N R A C L G Q C F S Y S V P N T F P Q S T E S L V H C D S C M P I D S V W D V V T L E C P G N E E F P R V D K L V E K I L Q C S C Q A C G K E L S Q E G A M F N V Y L N T A E E T L S P A E T L G H H H H R P P A R E E D S P A Q S Q R E G E S E E,Neuroblastoma suppressor of tumorigenicity 1,Xenopus tropicalis,Disease,Tumor suppressor,9.710539817810059,1.219628095626831
133,Q90YC9,NBL1,M L W F V V G A L F P A L L L A A P P P I N K L A L F P D K S A W C E A K N I T Q I V G H S G C E S K S I Q N R A C L G Q C F S Y S V P N T F P Q S T E S L V H C D S C M P A Q S M W E I V T L D C P G N D E I P R V D K L V E K I L H C S C Q A C G K E P S H E G A L F N V Y L N A E E N M P A E G P G P H H Y A H H Q Q E V E E P P A S S H H H H E E E G D E,Neuroblastoma suppressor of tumorigenicity 1,Gallus gallus,Disease,Tumor suppressor,4.3978705406188965,1.6785962581634521
134,Q61477,Nbl1,M L W V L V G A V L P V M L L A A P P P I N K L A L F P D K S A W C E A K N I T Q I V G H S G C E A K S I Q N R A C L G Q C F S Y S V P N T F P Q S T E S L V H C D S C M P A Q S M W E I V T L E C P G H E E V P R V D K L V E K I V H C S C Q A C G K E P S H E G L N V Y V Q G E D S P G S Q P G P H S H A H P H P G G Q T P E P E E P P G A P Q V E E E G A E D,Neuroblastoma suppressor of tumorigenicity 1,Mus musculus,Disease,Tumor suppressor,4.423393726348877,0.4140736162662506
135,Q06880,Nbl1,M L W V L V G T V L P V M L L A A P P P I N K L A L F P D K S A W C E A K N I T Q I V G H S G C E A K S I Q N R A C L G Q C F S Y S V P N T F P Q S T E S L V H C D S C M P A Q S M W E I V T L E C P G H E E V P R V D K L V E K I V H C S C Q A C G K E P S H E G L N V Y M Q G E D G P G S Q P G S H S H S H P H P G C Q T P E P E E P P G A P Q V E E E G A E D,Neuroblastoma suppressor of tumorigenicity 1,Rattus norvegicus,Disease,Tumor suppressor,4.433761119842529,0.4349088668823242
136,P40338,Vhl,M P R K A A S P E E A A G E P G P E E M E A G R P R P V L R S V N S R E P S Q V I F C N R S P R V V L P L W L N F D G E P Q P Y P I L P P G T G R R I H S Y R G H L W L F R D A G T H D G L L V N Q T E L F V P S L N V D G Q P I F A N I T L P V Y T L K E R C L Q V V R S L V K P E N Y R R L D I V R S L Y E D L E D Y P S V R K D I Q R L S Q E H L E S Q H L E E E P,von Hippel Lindau disease tumor suppressor,Mus musculus,Disease,Tumor suppressor,8.995857238769531,-1.4584590196609497
137,P41271,NBL1,M M L R V L V G A V L P A M L L A A P P P I N K L A L F P D K S A W C E A K N I T Q I V G H S G C E A K S I Q N R A C L G Q C F S Y S V P N T F P Q S T E S L V H C D S C M P A Q S M W E I V T L E C P G H E E V P R V D K L V E K I L H C S C Q A C G K E P S H E G L S V Y V Q G E D G P G S Q P G T H P H P H P H P H P G G Q T P E P E D P P G A P H T E E E G A E D,Neuroblastoma suppressor of tumorigenicity 1,Homo sapiens,Disease,Tumor suppressor,4.256411075592041,0.3440439999103546
138,Q9ULC4,MCTS1,M F K K F D E K E N V S N C I Q L K T S V I K G I K N Q L I E Q F P G I E P W L N Q I M P K K D P V K I V R C H E H I E I L T V N G E L L F F R Q R E G P F Y P T L R L L H K Y P F I L P H Q Q V D K G A I K F V L S G A N I M C P G L T S P G A K L Y P A A V D T I V A I M A E G K Q H A L C V G V M K M S A E D I E K V N K G I G I E N I H Y L N D G L W H M K T Y K,Malignant T cell amplified sequence 1,Homo sapiens,Disease,Tumor suppressor,-2.8186726570129395,5.6935553550720215
139,Q2KIE4,MCTS1,M F K K F D E K E N V S N C I Q L K T S V I K G I K N Q L I E Q F P G I E P W L N Q I M P K K D P V K I V R C H E H I E I L T V N G E L L F F R Q R E G P F Y P T L R L L H K Y P F I L P H Q Q V D K G A I K F V L S G A N I M C P G L T S P G A K L Y P A A V D T I V A I M A E G K Q H A L C V G V M K M S A E D I E K V N K G I G I E N I H Y L N D G L W H M K T Y K,Malignant T cell amplified sequence 1,Bos taurus,Disease,Tumor suppressor,-2.8182246685028076,5.696406364440918
140,Q9DB27,Mcts1,M F K K F D E K E N V S N C I Q L K T S V I K G I K N Q L L E Q F P G I E P W L N Q I M P K K D P V K I V R C H E H I E I L T V N G E L L F F R Q R E G P F Y P T L R L L H K Y P F I L P H Q Q V D K G A I K F V L S G A N I M C P G L T S P G A K L Y P A A V D T I V A I M A E G K Q H A L C V G V M K M S A E D I E K V N K G I G I E N I H Y L N D G L W H M K T Y K,Malignant T cell amplified sequence 1,Mus musculus,Disease,Tumor suppressor,-2.604170560836792,5.812029838562012
141,Q4G009,Mcts1,M G K G R F D E K E N V S N C I Q L K T S V I K G I K N Q L L E Q F P G I E P W L N Q I M P K K D P V K I V R C H E H I E I L T V N G E L L F F R Q R E G P F Y P T L R L L H K Y P F I L P H Q Q V D K G A I K F V L S G A N I M C P G L T S P G A K L Y P A A V D T I V A I M A E G K Q H A L C V G V M K M S A E D I E K V N K G I G I E N I H Y L N D G L W H M K T Y K,Malignant T cell amplified sequence 1,Rattus norvegicus,Disease,Tumor suppressor,-2.6128101348876953,5.80674934387207
142,Q6NZ13,nbl1,M V M C V R A V L V C V L L E L S R A A P H A H I N R L A L F P D K S A W C E A K N I T Q I V G H T G C T P R S I Q N R A C L G Q C F S Y S V P N T F P Q S T E S L V H C D S C M P A Q T Q W E V V T L D C S G S D E A P R V D K L V E R I L H C S C Q S C S K E S S Q E G A L L Q L Y P H E G A Q D L P S L P D A T H T H P Q H A H M Q A D Q R D A D A H L D M H A P E A G,Neuroblastoma suppressor of tumorigenicity 1,Danio rerio,Disease,Tumor suppressor,8.864860534667969,2.9766032695770264
143,P62833,RAP1A,M R E Y K L V V L G S G G V G K S A L T V Q F V Q G I F V E K Y D P T I E D S Y R K Q V E V D C Q Q C M L E I L D T A G T E Q F T A M R D L Y M K N G Q G F A L V Y S I T A Q S T F N D L Q D L R E Q I L R V K D T E D V P M I L V G N K C D L E D E R V V G K E Q G Q N L A R Q W C N C A F L E S S A K S K I N V N E I F Y D L V R Q I N R K T P V E K K K P K K K S C L L L,Ras related protein Rap 1A,Bos taurus,Disease,Tumor suppressor,-0.6887179017066956,6.9421162605285645
144,P62835,Rap1a,M R E Y K L V V L G S G G V G K S A L T V Q F V Q G I F V E K Y D P T I E D S Y R K Q V E V D C Q Q C M L E I L D T A G T E Q F T A M R D L Y M K N G Q G F A L V Y S I T A Q S T F N D L Q D L R E Q I L R V K D T E D V P M I L V G N K C D L E D E R V V G K E Q G Q N L A R Q W C N C A F L E S S A K S K I N V N E I F Y D L V R Q I N R K T P V E K K K P K K K S C L L L,Ras related protein Rap 1A,Mus musculus,Disease,Tumor suppressor,-0.6879189014434814,6.941157817840576
145,P62834,RAP1A,M R E Y K L V V L G S G G V G K S A L T V Q F V Q G I F V E K Y D P T I E D S Y R K Q V E V D C Q Q C M L E I L D T A G T E Q F T A M R D L Y M K N G Q G F A L V Y S I T A Q S T F N D L Q D L R E Q I L R V K D T E D V P M I L V G N K C D L E D E R V V G K E Q G Q N L A R Q W C N C A F L E S S A K S K I N V N E I F Y D L V R Q I N R K T P V E K K K P K K K S C L L L,Ras related protein Rap 1A,Homo sapiens,Disease,Tumor suppressor,-0.6876713037490845,6.9396491050720215
146,P62836,Rap1a,M R E Y K L V V L G S G G V G K S A L T V Q F V Q G I F V E K Y D P T I E D S Y R K Q V E V D C Q Q C M L E I L D T A G T E Q F T A M R D L Y M K N G Q G F A L V Y S I T A Q S T F N D L Q D L R E Q I L R V K D T E D V P M I L V G N K C D L E D E R V V G K E Q G Q N L A R Q W C N C A F L E S S A K S K I N V N E I F Y D L V R Q I N R K T P V E K K K P K K K S C L L L,Ras related protein Rap 1A,Rattus norvegicus,Disease,Tumor suppressor,-0.6864108443260193,6.941287994384766
147,Q64259,Vhl,M P R K A A S P E E A E R M P G S E E I E A G R P R P V L R S V N S R E P S Q V I F C N R S P R V V L P L W L N F D G E P Q P Y P T L P P G T G R R I H S Y R G H L W L F R D A G T H D G L L V N Q T E L F V P S L N V D G Q P I F A N I T L P V Y T L K E R C L Q V V R S L V K P E N Y R R L D I V R S L Y E D L E D H P N V R K D I Q R L T Q E H L E N Q A L G E E P E G V H,von Hippel Lindau disease tumor suppressor,Rattus norvegicus,Disease,Tumor suppressor,9.011808395385742,-1.465323567390442
