,ID,Gene,Sequence,Description,Organism,Protein type,Class,x_coords,y_coords,Domain,Types
0,P81826,ENO3,A D A K S,Major pollen allergen Jun v 4 Fragment,Juniperus virginiana,Globular,Allergen,-5.3904523849487305,8.674761772155762,None,Real
1,P86909,ENO3,V A T V S L P R,Sarcoplasmic calcium binding protein Fragment,Chionoecetes opilio,Globular,Allergen,-7.0757317543029785,6.735741138458252,None,Real
2,P81010,ALDOA,T I M S H N V P,Allergen Fus s I3596 Fragment,Fusarium vanettenii,Globular,Allergen,-4.882445812225342,10.75501823425293,None,Real
3,C0HJG0,Os06g0662900,G P Q Q Q H R L,Allergen Act d 13 Fragment,Actinidia deliciosa,Globular,Allergen,-4.442389965057373,4.5687971115112305,None,Real
4,B3EWE5,atp16,A T F D I Q N N C,Thaumatin like protein 2 Fragment,Manilkara zapota,Globular,Allergen,-18.299236297607422,19.9954833984375,None,Real
5,P85444,DERP6,K F A D E N F Q L K H,Peptidyl prolyl cis trans isomerase Fragment,Penicillium glabrum,Globular,Allergen,-17.719532012939453,19.969175338745117,None,Real
6,B3A0L6,DERM1,S I T K I K A R E I L,Beta enolase Fragment,Gadus morhua,Globular,Allergen,-18.368865966796875,21.216552734375,None,Real
7,C0HJM6,ALDOA,E Q G G S Q A G G S L,Endochitinase Fragment,Triplochiton scleroxylon,Globular,Allergen,-18.514394760131836,12.028306007385254,None,Real
8,B3EWS0,OLE6,A T F D I V N Q C T F T,Thaumatin like protein 1a Fragment,Manilkara zapota,Globular,Allergen,-10.718578338623047,29.00082015991211,None,Real
9,C0HJB6,MELT,G V Q K S E V V I T S A,Pathogenesis related protein Fragment,Foeniculum vulgare,Globular,Allergen,-11.838181495666504,8.947975158691406,None,Real
10,P85412,MELT,E I Q N A G L Y A I L R,Beta galactosidase Fragment,Phoenix dactylifera,Globular,Allergen,-17.685802459716797,24.666351318359375,None,Real
11,P86898,MELT,G R R E D D Y D N L Q L,Major 28 kDa allergen Fragment,Vigna mungo,Globular,Allergen,-15.421265602111816,5.924432277679443,None,Real
12,P86978,MELT,S I T K I K A R E I L D,Beta enolase Fragment,Thunnus albacares,Globular,Allergen,-14.985193252563477,17.096149444580078,None,Real
13,B3EWP9,MELT,A I T X G Q V T S K L G,Non specific lipid transfer protein Fragment,Foeniculum vulgare,Globular,Allergen,-6.26127815246582,5.375528812408447,None,Real
14,C0HJF9,MELT,N R Q P S K Y G L E E T I,Allergen Act d 12 Fragments,Actinidia deliciosa,Globular,Allergen,-11.027838706970215,19.42478370666504,None,Real
15,P83885,MELT,G M L G G S S D V D X N X P,Allergen Ani s 4 Fragment,Anisakis simplex,Globular,Allergen,-3.6265928745269775,2.256251811981201,None,Real
16,P86910,None,K G F M T P E R A A E F N F R,Troponin I Fragments,Chionoecetes opilio,Globular,Allergen,-12.924345970153809,32.64533233642578,None,Real
17,P86980,None,P H A Y P F L S P E Q K K E L,Fructose bisphosphate aldolase A Fragment,Gadus morhua,Globular,Allergen,-13.305455207824707,32.107852935791016,None,Real
18,P83466,None,T E V T F K V G E G S S G K S,Pollen allergen Ory s 2 A Fragment,Oryza sativa subsp. japonica,Globular,Allergen,-21.875751495361328,15.107905387878418,None,Real
19,P83507,None,S E I N G D W N T I A L S A D,Major urinary protein Fragment,Cavia porcellus,Globular,Allergen,-17.321393966674805,17.946985244750977,None,Real
20,P86417,None,A T C S A S Q L S P C L G A I,Non specific lipid transfer protein Fragment,Solanum lycopersicum,Globular,Allergen,-17.014921188354492,12.226215362548828,None,Real
21,P86703,None,E G F Q L M D R G T F D E I G R,Myosin light chain Fragments,Penaeus monodon,Globular,Allergen,-17.51966094970703,16.156898498535156,None,Real
22,P85445,None,K I A N G S G S E Q D I A E A K I,ATP synthase subunit delta mitochondrial Fragment,Penicillium glabrum,Globular,Allergen,-13.83614730834961,31.504976272583008,None,Real
23,P82947,None,A N P T F G F T P L G L S S D A N,Major Gly 50 kDa allergen Fragment,Glycine max,Globular,Allergen,-4.67653226852417,6.646931171417236,None,Real
24,P83340,None,A D G I V A V E L D T Y R G S F X K,Major allergen Epi p 1 Fragments,Epicoccum nigrum,Globular,Allergen,-17.89421272277832,15.672346115112305,None,Real
25,P81217,None,X Q D P Q S E T D Y S Q L S G E W N T,Dander allergen Equ c 2 0102 Fragment,Equus caballus,Globular,Allergen,-11.895866394042969,14.197257995605469,None,Real
26,C0HKC0,None,G S S F C D S K C A V R C S K A G V Q D,Pommaclein Fragment,Punica granatum,Globular,Allergen,-10.801559448242188,8.029837608337402,None,Real
27,P85983,None,V Q G M V Y C D T C R S A N A L G F M R,Pollen allergen Beta v 1 Fragments,Beta vulgaris,Globular,Allergen,-4.319180965423584,17.920387268066406,None,Real
28,P82258,None,F D K N Q P W G V I R D L N V V N F K R,Allergen Asp fl 2 Fragment,Aspergillus flavus,Globular,Allergen,-6.204509735107422,2.6059865951538086,None,Real
29,P49277,None,A I G X Q P A A E A E A P F Q I S L M K,Mite allergen Der p 6 Fragment,Dermatophagoides pteronyssinus,Globular,Allergen,-18.675960540771484,12.38680362701416,None,Real
30,P86838,None,K C G V S I P Y K I S P S T D C S S V K,Non specific lipid transfer protein Fragment,Cannabis sativa,Globular,Allergen,-4.616109371185303,11.719253540039062,None,Real
31,P85293,None,G P P K V A P G K X I S A S F G G E W L,Expansin B Fragment,Paspalum notatum,Globular,Allergen,-1.0842570066452026,9.859260559082031,None,Real
32,P84161,None,I T X G Q V T G S L A P X I A F L R T K,Non specific lipid transfer protein Fragment,Citrus sinensis,Globular,Allergen,-1.9637788534164429,6.760758876800537,None,Real
33,P84160,None,I T C G Q V T G S L A P X I P F L R T G,Non specific lipid transfer protein Fragment,Citrus limon,Globular,Allergen,-10.535416603088379,13.102741241455078,None,Real
34,P0CH88,None,V V G G K P A K L G A W P W M V A L G F,Venom protease Fragment,Bombus terrestris,Globular,Allergen,-10.818904876708984,12.009123802185059,None,Real
35,P81430,None,A P S Q S T V T A L L T S C V S Y I D D Q,Pollen allergen Ole e 7 Fragment,Olea europaea,Globular,Allergen,-15.69607162475586,6.160229682922363,None,Real
36,P0DMB6,None,G L L P K V K L V P E Q I S F I L S T R E N R,Phospholipase A1 verutoxin 1 Fragment,Vespa velutina,Globular,Allergen,-14.307994842529297,13.719771385192871,None,Real
37,P0C023,None,L I G L V S K G T C V L V K T V C K K V L K Q,M myrmeciitoxin Mp2b,Myrmecia pilosula,Globular,Allergen,-15.671565055847168,8.9485502243042,None,Real
38,P85984,None,Y M V I Q G E P G A V I R L G D Y L I D Q G L,Profilin Fragments,Beta vulgaris,Globular,Allergen,-19.705642700195312,4.886653900146484,None,Real
39,P80741,None,A F A N T G V E I V S I D T Y L F S L Y D E D K,Major pollen allergen Ole e 4 Fragments,Olea europaea,Globular,Allergen,-12.66695499420166,17.049869537353516,None,Real
40,P86712,None,A V L D T A L S G I D K V L H G S I D A H K A D,Allergen Lip b 1 Fragments,Liposcelis bostrychophila,Globular,Allergen,3.8552803993225098,-8.72327709197998,None,Real
41,P86254,None,F N A G G H I N H S L F W Q N L A P A S S N E A K,Superoxide dismutase Mn mitochondrial Fragment,Alternaria alternata,Globular,Allergen,-21.26236915588379,16.120637893676758,None,Real
42,P0DMB8,None,F N P C P Y S D D T V K M I I L T R E N K K H D F,Phospholipase A1 verutoxin 2b Fragment,Vespa velutina,Globular,Allergen,-14.705238342285156,20.667465209960938,None,Real
43,P84159,None,T D P G H L Q D V X V A I N D P K X G V F V N R K,Germin like protein Fragment,Citrus sinensis,Globular,Allergen,-5.483565807342529,3.000011920928955,None,Real
44,P0DMB7,None,F N P C P Y S D D T V K M I I L T R E N K K H D F,Phospholipase A1 verutoxin 2a Fragment,Vespa velutina,Globular,Allergen,-14.70559310913086,20.66570281982422,None,Real
45,P80514,None,F T P E D F I S A P R R G E A I P D P K G E L A V F,83 kDa hypersensitivity protein Fragment,Trichophyton tonsurans,Globular,Allergen,-12.463569641113281,33.55024337768555,None,Real
46,P81496,None,S F R E Q C V P G R E I T Y E C L N A C A E Y A V R Q,Allergen C C Fragment,Triticum aestivum,Globular,Allergen,-0.07122461497783661,3.0274927616119385,None,Real
47,P82944,None,V T X E E G X Y S I S D Q S K V G E Q X I R S P D R E M,Seed allergenic protein 1 Fragments,Prunus dulcis,Globular,Allergen,-6.694455623626709,12.13587760925293,None,Real
48,P81216,None,S Q X P Q S E T D Y S Q L S G E W N T I Y G A A S N I X K,Dander allergen Equ c 2 0101 Fragment,Equus caballus,Globular,Allergen,-5.523219585418701,3.879080057144165,None,Real
49,P16312,None,T Q A C R I N S G N V P S E L D L R S L R T V T P I R M Q G,Peptidase 1 Fragment,Dermatophagoides microceras,Globular,Allergen,-15.50107192993164,18.8388729095459,None,Real
50,P80740,None,M V K A V T V L N S S E G P H G I V Y F A Q E G D G P T T V,Superoxide dismutase Cu Zn 1 Fragment,Olea europaea,Globular,Allergen,-2.4566280841827393,8.30099868774414,None,Real
51,P0CH89,None,D R C I W P K E G F S I Y W N I P T H F C H N F G V Y F K E L,Hyaluronidase Fragment,Vespula maculifrons,Globular,Allergen,-2.2324092388153076,26.440881729125977,None,Real
52,C0HLL6,None,A Q I D C D K E C N R R C S K A Y C G I C C E K C H C V P P G T,Cypmaclein Fragments,Cupressus sempervirens,Globular,Allergen,1.0724440813064575,6.634122371673584,None,Real
53,P82259,None,D S G G L T P P H A D C V P G K X Q X N G N Y G A V P N K K Q Q,Allergen Asp fl 3 Fragment,Aspergillus flavus,Globular,Allergen,-0.6440788507461548,-3.1129684448242188,None,Real
54,P82257,None,T P S Q C T A A Q A N K C C T G L T N G I L N L N V L P A L N P,Allergen Asp fl 1 Fragment,Aspergillus flavus,Globular,Allergen,-3.5988874435424805,7.074705123901367,None,Real
55,P85063,None,F T D G L M K N G N F E L A P K P E D M X G T V R V E S L K A V K Y X D,Allergen Act d 3 Fragments,Actinidia deliciosa,Globular,Allergen,-4.240108966827393,2.544940948486328,None,Real
56,Q09095,None,P S E Q Y Q P Y P E Q Q Q P F L Q Q Q P L E L Q Q Q Q X X L V L F L Q K,Avenin A Fragment,Avena sativa,Globular,Allergen,-13.884303092956543,1.5765893459320068,None,Real
57,Q41183,None,E A P V T F T V E K G S D E K N L A L S I K Y N K E G D S M A E V E L K,Pollen allergen Dac g 2 Fragment,Dactylis glomerata,Globular,Allergen,6.211370944976807,-5.555286884307861,None,Real
58,P86979,None,P H A F P F L T P E Q K K E L S D I A H K I V A P G K G I L A A D E S T G,Fructose bisphosphate aldolase A Fragment,Thunnus albacares,Globular,Allergen,-1.638382077217102,9.344762802124023,None,Real
59,P0C088,None,A L T C S D V S N K I S P C L S Y L K Q G G E V P A D C C A G V K G L N D,Non specific lipid transfer protein Fragment,Artemisia vulgaris,Globular,Allergen,4.293892860412598,-0.030927974730730057,None,Real
60,P83834,None,D F V D A H N A A R A Q V G V G P V H W T V D A Y A R Q Y A N D R N L V H S A T R,Pathogenesis related protein Fragments,Cucumis melo,Globular,Allergen,-5.261354923248291,0.6009826064109802,None,Real
61,P83542,None,G I T P D C T F N E K D I E L H V Y S R D K R N G I I L K K E I L K N Y D L F K E S,Phospholipase A1 Fragment,Polistes gallicus,Globular,Allergen,-21.779144287109375,21.006813049316406,None,Real
62,P81531,None,D F T A G N G T G G E S I Y G A K D X X X X X X X T G P G I L S M A N A G P G T N G,Peptidyl prolyl cis trans isomerase Fragments,Betula pendula,Globular,Allergen,-21.837175369262695,15.163164138793945,None,Real
63,P83181,None,P T I T I G G P E Y R T I F F D A Y L G T S Y V I V I K E P A E E F T T I S D A V K,Pollen allergen Sal k 1 Fragments,Kali turgidum,Globular,Allergen,-17.12839698791504,16.949121475219727,None,Real
64,C0HJX6,None,A I L G Q D G S V W A Q G L H L G G A K Y V I A G E P G A V I R L G D Y L L D Q G L,Profilin Fragments,Plantago lanceolata,Globular,Allergen,-19.674819946289062,4.887558460235596,None,Real
65,Q09097,None,T T T V Q Y D P S E Q Y Q P Y P E Q Q E P F V Q Q Q P P F V Q Q Q Q P F V Q Q Q E P F,Avenin F Fragment,Avena sativa,Globular,Allergen,2.5423085689544678,-4.116769790649414,None,Real
66,P02878,None,L V P C A W A G N V C G E K R A Y C C S D P G R Y C P W Q V V C Y E S S E I C S K K C G K,Pollen allergen Amb a 5,Ambrosia artemisiifolia var. elatior,Globular,Allergen,2.3817591667175293,3.8726766109466553,None,Real
67,P85126,None,G V F T H E S Q E T S V I A P A R L F K A L F L D S D N L I Q K V L P Q A I K S T E I I E G N G G P,Major pollen allergen Que a 1 Fragment,Quercus alba,Globular,Allergen,-10.396991729736328,16.711647033691406,None,Real
68,O24172,None,D E A Q F K E C Y D T C H K E C S D K G N G F T F C E M K C D T D C S V K D V K E K L E N Y K P K N,Major pollen allergen Ole e 6,Olea europaea,Globular,Allergen,-13.017884254455566,23.173023223876953,None,Real
69,P82946,None,D I Y N Y M E P Y V S K V D P T D Y F G N E Q A R T A W V D S G A Q L G E L S Y G V L F N I Q Y V N Y W F A P,Major pollen allergen Dac g 4 Fragments,Dactylis glomerata,Globular,Allergen,-12.957144737243652,37.78778076171875,None,Real
70,P83908,None,R Q S L G V P P Q V K G P F Q V V R P P L R T S V N S Y T L P I L Q Y I R A L P L E V I T N A F Q I S L E E A R,Cruciferin Fragments,Sinapis alba,Globular,Allergen,-16.08014678955078,15.677957534790039,None,Real
71,P86777,None,A F A G V L A D A D I K A A L A G C A A A E S F N Y K T F F K F F A I I D Q D H S G F I E E E E L K A L S D A E T K,Parvalbumin beta 3 Fragments,Merluccius senegalensis,Globular,Allergen,4.611972808837891,-9.511214256286621,None,Real
72,P86755,None,A F A G V L A D A D I K A A L A G C A A A E S F N Y K T F F K F F A I I D Q D H S G F I E E E E L K A L S D A E T K,Parvalbumin beta 3 Fragments,Merluccius capensis,Globular,Allergen,4.6114726066589355,-9.51147174835205,None,Real
73,P85413,None,T I K V P E G F D Y E L Y N R N D I N R Y V D A V L T I P K V I C D H L G L G V K T G L P Y I W H S K A S N P F V N L K,Probable UDP arabinopyranose mutase 1 Fragments,Phoenix dactylifera,Globular,Allergen,-4.639222145080566,11.605003356933594,None,Real
74,C0HLQ0,None,A Q I D C D K E C N R R C S K A S A H D R C L K Y C G I C C K K C H C V P P G T A G N E D V C P C Y A N L K N S K G G H K C P,Cypmaclein,Juniperus ashei,Globular,Allergen,-12.056747436523438,-8.013825416564941,None,Real
75,C0HLQ1,None,A H I D C D K E C N R R C S K A S A H D R C L K Y C G I C C E K C N C V P P G T Y G N E D S C P C Y A N L K N S K G G H K C P,Cypmaclein,Cryptomeria japonica,Globular,Allergen,-12.098838806152344,-8.120159149169922,None,Real
76,C0HLQ2,None,A Q I D C D K E C N R R C S K A S A H D R C L K Y C G I C C E K C H C V P P G T A G N E D V C P C Y A N L K N S K G G H K C P,Cypmaclein,Cupressus sempervirens,Globular,Allergen,-12.055209159851074,-8.040340423583984,None,Real
77,P86888,None,G S S F C D S K C G V R C S K A G Y Q E R C L K Y C G I C C E K C H C V P S G T Y G N K D E C P C Y R D L K N S K G N P K C P,Peamaclein,Prunus persica,Globular,Allergen,-12.368220329284668,-8.842574119567871,None,Real
78,O76821,None,Q I N G S Y K L E K S D N F D A F L K E L G L N F V T R N L A K S A T P T V E V S V N G D S Y T I K T A S T L K N T E I S F K L,Fatty acid binding protein Fragment,Acarus siro,Globular,Allergen,6.203752517700195,-5.5158371925354,None,Real
79,P86809,None,A T C S A V Q L S P C L A A I T K N T P P S A A C C N K L K E Q K P C L C G Y L K D P N L K N Y V N S P G A R K T A S S C G V A L K C,Non specific lipid transfer protein 2,Apium graveolens var. rapaceum,Globular,Allergen,5.284714221954346,-3.4135472774505615,None,Real
80,P86746,None,A F A G V L A D A D I K A A L A G C A A A D S F N Y K T F F K F F A I I D Q D H S G F I E E E E L K L F L Q T F S A G A R A L S D A E T K,Parvalbumin beta 4 Fragments,Merluccius australis australis,Globular,Allergen,5.334211349487305,-13.102663040161133,None,Real
81,P86772,None,A F A G V L A D A D I K A A L A G C A A A E S F N Y K T F F K F F A I I D Q D H S G F I E E E E L K L F L Q T F S A G A R A L S D A E T K,Parvalbumin beta 3 Fragments,Merluccius polli,Globular,Allergen,5.322664260864258,-13.073458671569824,None,Real
82,P86767,None,A F A G V L A D A D I K A A L A G C A A A E S F N Y K T F F K F F A I I D Q D H S G F I E E E E L K L F L Q T F S A G A R A L S D A E T K,Parvalbumin beta 4 Fragments,Merluccius merluccius,Globular,Allergen,5.32254695892334,-13.073442459106445,None,Real
83,P59262,None,M K F L V N V A L V F M V V Y I S Y I Y A A P E P E P A P E P E A E A D A E A D P E A G I G A V L K V L T T G L P A L I S W I K R K R Q Q G,Melittin,Vespula maculifrons,Globular,Allergen,-11.351414680480957,-2.449000597000122,None,Real
84,P0DPR9,None,M K F L V N V A L V F M V V Y I S Y I Y A A P E P E P A P E P E A E A D A E A D P E A G I G A V L K V L T T G L P A L I N W I K R K R Q Q G,Melittin N,Apis cerana,Globular,Allergen,-11.375600814819336,-2.0649912357330322,None,Real
85,P68407,None,M K F L V N V A L V F M V V Y I S F I Y A A P E P E P A P E A E A E A D A E A D P E A G I G A V L K V L T T G L P A L I S W I K R K R Q Q G,Melittin,Apis cerana cerana,Globular,Allergen,-10.965804100036621,-2.2107369899749756,None,Real
86,P68409,None,M K F L V N V A L V F M V V Y I S F I Y A A P E P E P A P E A E A E A D A E A D P E A G I G A V L K V L T T G L P A L I S W I K R K R Q Q G,Melittin,Vespa velutina nigrithorax,Globular,Allergen,-10.96601676940918,-2.215573310852051,None,Real
87,P68408,None,M K F L V N V A L V F M V V Y I S F I Y A A P E P E P A P E A E A E A D A E A D P E A G I G A V L K V L T T G L P A L I S W I K R K R Q Q G,Melittin,Vespa magnifica,Globular,Allergen,-11.032805442810059,-2.4869110584259033,None,Real
88,P01501,None,M K F L V N V A L V F M V V Y I S Y I Y A A P E P E P A P E P E A E A D A E A D P E A G I G A V L K V L T T G L P A L I S W I K R K R Q Q G,Melittin,Apis mellifera,Globular,Allergen,-11.35358715057373,-2.440021514892578,None,Real
89,B3EWP3,None,K T V A G F C I F F L V L F L A Q E G V V K T E A K L C N H L A D T Y R G P C F T N A S C D D H C K N K E H F V S G T C M K M A C W C A H N C,Defensin 1 Fragment,Arachis hypogaea,Globular,Allergen,4.177074432373047,1.0728670358657837,None,Real
90,Q7M1G9,None,X E T Y G E P G N T P D D Y V H A H N N I R R V L G M X P K X Q G A I D G S S X V Q L X L D E X L D Y D Y N X N K X I K P P G N V V G Q L P Y,Allergen Art v 2 Fragments,Artemisia vulgaris,Globular,Allergen,-6.184440612792969,12.775854110717773,None,Real
91,C0HJZ1,None,M E K K M A G F C I F F L V L F L A Q E Y G V E G K V C L N L S D K F K G P C L G T K N C D H H C R D I E H L L S G V C R D D F R C W C N R N C,Defensin 3,Arachis hypogaea,Globular,Allergen,4.755624294281006,1.0972684621810913,None,Real
92,P10414,None,M K N I F M L T L F I L I I T S T I K A I G S T N E V D E I K Q E D D G L C Y E G T N C G K V G K Y C C S P I G K Y C V C Y D S K A I C N K N C T,Pollen allergen Amb t 5,Ambrosia trifida,Globular,Allergen,2.9019527435302734,2.817087411880493,None,Real
93,P86740,None,T F F K S N D D V K K A F F V I D Q D K S G F I E E D E L K L F L Q N F S A G A R A L T A G E T K T F L A A G D S D G D G M I G V D E F Q A L V K A,Parvalbumin beta 3 Fragments,Macruronus magellanicus,Globular,Allergen,5.130983829498291,-11.953011512756348,None,Real
94,Q26464,None,M K L S C L L L T L A I I F V L T I V H A P N V E A K A L A D P E S D A V G F A D A V G E A D P I D W K K V D W K K V S K K T C K V M L K A C K F L G,M myrmeciitoxin Mp2a,Myrmecia pilosula,Globular,Allergen,-9.537123680114746,-2.364104747772217,None,Real
95,P86758,None,A F S G I L A E A D I A A A L K A C E A A D S F N Y K A F F A K K A F F V I D Q D K S G F I E E D E L K L F L Q V F S A G A R A L T D A E T K A F L K,Parvalbumin beta 3 Fragments,Merluccius gayi,Globular,Allergen,4.552435398101807,-12.589326858520508,None,Real
96,P86751,None,A F A G V L A D A D I K A A L A G C A A A D S F N Y K T F F K S P E E V K K F F A I I D Q D H S G F I E E E E L K L F L Q T F S A G A R A L S D A E T K,Parvalbumin beta 3 Fragments,Merluccius australis polylepis,Globular,Allergen,4.498361587524414,-13.06664752960205,None,Real
97,P43174,None,M N N E K N V S F E F I G S T D E V D E I K L L P C A W A G N V C G E K R A Y C C S D P G R Y C P W Q V V C Y E S S E I C S Q K C G K M R M N V T K N T I,Pollen allergen Amb p 5a,Ambrosia psilostachya,Globular,Allergen,-3.7586936950683594,16.28152847290039,None,Real
98,Q8LW54,None,M K F L V N V A L V F Y G R V H F L H L C V H F L H L W A P E P E P A P E A E A E A D A E A D P E A G I G A V L K V L T T G L P A L I S W I K R K R Q Q G,Melittin,Apis cerana,Globular,Allergen,-12.354742050170898,-2.133298397064209,None,Real
99,P43175,None,M N N E K N V S F E F I G S T N E V D E I K V M A C Y A A G S I C G E K R G Y C S S D P G R Y C P W Q V V C Y E S R K I C A K N A A K M R M N V T K N T I,Pollen allergen Amb p 5b,Ambrosia psilostachya,Globular,Allergen,-3.1139848232269287,16.24461555480957,None,Real
100,Q8LE92,PSY2,M S F G T R L L L F L I L T L P L V T S S S P N T L H V S G I V K T G T T S R F L M M T I E D Y D D P S A N T R H D P S V P T N A K A D T T P,Protein PSY2,Arabidopsis thaliana,Globular,Immunoglobin,-1.4643690586090088,26.20397186279297,None,Real
101,Q8S8P7,PSY3,M G Y S S S S R I G L C L F L F F T F A L L S S A R I S L S F S E N E M T V V P E R S L M V S T N D Y S D P T A N G R H D P P R G G R G R R R,Protein PSY3,Arabidopsis thaliana,Globular,Immunoglobin,2.784425735473633,11.509188652038574,None,Real
102,O64466,RALFL11,M K A W L I C L L V I C A A V I A E P V E S R N Y I E Y G A I N K C A G P N P P P G C N P P G A E Q K N P T P V N E Y S R G C S K I H R C R R D,Protein RALF like 11,Arabidopsis thaliana,Globular,Immunoglobin,7.226461410522461,4.561586856842041,None,Real
103,A8MR00,At2g32885,M G I S K K T V V Q S F A L I I I I S I V M S T T E A N S I G A P A M R E D L P K G C A P G S S A G C K M Q P A N P Y K P G C E A S Q R C R G G,Protein RALF like 36,Arabidopsis thaliana,Globular,Immunoglobin,5.805175304412842,7.652825355529785,None,Real
104,F4ISE2,RALFL13,M K A W V I C L L V I C A A V I A E P V E S R N Y I E Y G A I N K C A G P N P P P G C N P P G A E Q K N P N P V N E Y S R G C S K I H R C R R D,Protein RALF like 13,Arabidopsis thaliana,Globular,Immunoglobin,7.481870651245117,4.960742473602295,None,Real
105,A8MQL7,RALFL20,M V L S K K T I M Q S F A L M I I L S I V M S T T E A K T I G N P A M R E D E P K G C P P G S P A S C K M Q P A N P Y K P G C E A S Q R C R G T,Protein RALF like 20,Arabidopsis thaliana,Globular,Immunoglobin,5.307979106903076,7.417694091796875,None,Real
106,F4ISE1,RALFL12,M K A W V I G L L V I C A V V I A E P V E S R N Y I E Y G A I N K C A G P N P P P G C N P P G T E Q K N P T P V N E Y S R G C S K I H R C R R D,Protein RALF like 12,Arabidopsis thaliana,Globular,Immunoglobin,7.124104976654053,4.440706729888916,None,Real
107,O65919,RALFL10,M K A L V I C L L V I F A A V I A V P V E S R R K H L D Y G V I T K C A G P N P P P G C Y P P G A Q Q K N P T P A N E Y R R G C S K I T R C K R D,Protein RALF like 10,Arabidopsis thaliana,Globular,Immunoglobin,6.450964450836182,4.336509704589844,None,Real
108,Q9LSG0,RALFL25,M K T F M I I L L V I C S I L I V G R V E A N D N K R K Y L L L D P C L R P N A P P G C H R Q P Y K P R T P V N V Y S R G C T T I N R C R R V Q N P,Protein RALF like 25,Arabidopsis thaliana,Globular,Immunoglobin,4.782547950744629,9.972369194030762,None,Real
109,Q941C7,PSY1,M T F V V R L L V C L L L T L T I T S S L A R N P V S V S G G F E N S G F Q R S L L M V N V E D Y G D P S A N P K H D P G V P P S A T G Q R V V G R G,Protein PSY1,Arabidopsis thaliana,Globular,Immunoglobin,-1.0263142585754395,28.2862491607666,None,Real
110,Q3ECL0,RALFL9,M G M S K S I K V I L S L A L V V F L A L A A T K V E A T R Y I T Y P A I D R G D H A V H C D K A H P N T C K K K E A N P Y Q R G C E K I N R C R G G,Protein RALF like 9,Arabidopsis thaliana,Globular,Immunoglobin,5.426711559295654,7.441856384277344,None,Real
111,Q0V822,RALFL26,M K A W M I I L L V I C V A V V V E Q S E A R K G R K Y L N P G V L D R C R G P N P P A G C H P H N S H H K P R V P V H N Y S R G C S R I T R C R R D A,Protein RALF like 26,Arabidopsis thaliana,Globular,Immunoglobin,5.748623847961426,4.637966632843018,None,Real
112,A7REH2,RALFL30,M K A W V I C L M V I S I F M M I E P T L A A G G G K F L N P G V L D P C L R P N P P P E C Q A P G S A G K P R E R V N E Y K V G C S K L T R C D R V G,Protein RALF like 30,Arabidopsis thaliana,Globular,Immunoglobin,4.431883811950684,7.090188026428223,None,Real
113,P0DN96,CEP7,M A K C T L T S L I L L L I V L V L I Q E S H I V E G R P L K S S R I S N V S K K F A A G N S N L S S K L T T E D H S L D A F R P T N P G N S P G I G H,Precursor of CEP7,Arabidopsis thaliana,Globular,Immunoglobin,-6.554172039031982,-9.2908296585083,None,Real
114,Q8LAD7,IDA,M A P C R T M M V L L C F V L F L A A S S S C V A A A R I G A T M E M K K N I K R L T F K N S H I F G Y L P K G V P I P P S A P S K R H N S F V N S L P H,Protein IDA,Arabidopsis thaliana,Globular,Immunoglobin,-8.368762016296387,-8.404090881347656,None,Real
115,O48776,RALFL17,M A A S R E F I I C C F L T L L L C N F F M R V E S G A A A D V S R G G C G G G D G S L G D D N E R C V E A V K E D D D D D V D D V Y K V I N K M R I Y A,Protein RALF like 17,Arabidopsis thaliana,Globular,Immunoglobin,-14.104392051696777,21.10553741455078,None,Real
116,A8MQM7,RALFL15,M G M S K S I K V I V S L A L I L F L A L A A T K V E A T R Y I S Y R G M N H G D H A I H C D K A H P N T C K K Q V A N P Y R R G C G T I E R C R R D T G R K,Protein RALF like 15,Arabidopsis thaliana,Globular,Immunoglobin,4.514831066131592,10.100337028503418,None,Real
117,Q9FGF6,GLV2,M A I R V S H K S F L V A L L L I L F I S S P T Q A R S L R E V V R N R T L L V V E K S Q E S R K I R H E G G G S D V D G L M D M D Y N S A N K K R P I H N R,Protein GOLVEN 2,Arabidopsis thaliana,Globular,Immunoglobin,-8.00997543334961,-9.447582244873047,None,Real
118,A8MRK3,At1g60913,M A A H K M S L T S L F F V S I V I V L S L F S G F G E G R Y I K Y R A I A K D R V P D C T Q D P K N C V R V P V N Q Y H L P P G C Q N T T H C Y R E K Y H I,Protein RALF like 35,Arabidopsis thaliana,Globular,Immunoglobin,3.2104437351226807,11.489709854125977,None,Real
119,A8MRD4,RALFL7,M S A R K K N R I H V F F V S I M I I I S L V S G F G E G I K Q I N Y K D L I K D T I P G C T S K N P K E C V K V P A N T Y H R G C E I S T R C H R E Q H S S S G,Protein RALF like 7,Arabidopsis thaliana,Globular,Immunoglobin,-19.990896224975586,22.010522842407227,None,Real
