,ID,Gene,Sequence,Description,Organism,Protein type,Class,x_coords,y_coords,Domain,Types
165,P83253,None,M I Q V L L V T I C L A V F P Y Q G S S I I L E S G N V N D Y E I V Y P K K V T V L P T G A M N S G N P C C D P V T C K P R R G E H C V S G P C C R N C K F L N A G T I C N R A R G D D M N D Y C T G I S S D C P R N P Y K D,Disintegrin lebein 1 alpha,Macrovipera lebetina,Fibrous,Collagen,-20.64682960510254,4.6132049560546875,Eukaryota,Real
166,P01665,None,D I V L T Q S P A S L A V S L G Q R A T I S C K A S Q S V D Y D G D S Y M N W Y Q Q K P G Q P P K L L I Y A A S N L E S G I P A R F S G S G S G T D F T L N I H P V E E E D A A T Y Y C Q Q S N E D P F T F G S G T K L E I K,Ig kappa chain V III region PC 7043,Mus musculus,Fibrous,Collagen,18.262697219848633,-18.465595245361328,Eukaryota,Real
167,P86289,None,G A T G A P G I A G A P G F P G A R G P S G P Q G P S G A P G P K G V Q G P P G P Q G P R G L T G P I G P P G P A G A P G D K G E A G P S G P P G P T G A R G S A G P P G A T G F P G A A G R G E T G P A G P A G P P G P A G A R,Collagen alpha 1 I chain Fragments,Brachylophosaurus canadensis,Fibrous,Collagen,14.616575241088867,-17.942270278930664,Eukaryota,Real
168,P06702,None,M T C K M S Q L E R N I E T I I N T F H Q Y S V K L G H P D T L N Q G E F K E L V R K D L Q N F L K K E N K N E K V I E H I M E D L D T N A D K Q L S F E E F I M L M A R L T W A S H E K M H E G D E G P G H H H K P G L G E G T P,Protein S100 A9,Homo sapiens,Fibrous,Collagen,-13.494369506835938,-1.4056631326675415,Eukaryota,Real
169,Q99P87,None,M K N L S F P L L F L F F L V P E L L G S S M P L C P I D E A I D K K I K Q D F N S L F P N A I K N I G L N C W T V S S R G K L A S C P E G T A V L S C S C G S A C G S W D I R E E K V C H C Q C A R I D W T A A R C C K L Q V A S,Resistin,Mus musculus,Fibrous,Collagen,-10.969861030578613,18.000879287719727,Eukaryota,Real
170,O96614,None,G S S G S S G S S G S S G S S G S S G S S G S S G S S G S S G S S G S S G S S G S S G S S G S S G S S G S S G S S G S S G S S G S S G S S G S S G S S G S S G S S G S S S S S S S N G S G S S S G S S Q S S G S Q G G S S S T S S S N,Sericin 1 Fragment,Galleria mellonella,Fibrous,Collagen,-12.627923011779785,-8.292435646057129,Eukaryota,Real
171,Q800Y2,None,M R S L L Q F L A L S A A I A L C V C Y E S H E S S E S A E D L F V P P Q Q A N S F M T P Q R G N A Y S P P R G N G N N F N L M R T V K S P A E R R A E T C E D Y S P C R F Y A Y R H G F Q Q A Y Q R Y F G S G T H P Q Q R P A A A A R R Y,Matrix Gla protein,Argyrosomus regius,Fibrous,Collagen,-2.126066207885742,-5.226373195648193,Eukaryota,Real
172,P81237,None,N L Y Q F G G M I Q C A N K G A R S W L S Y V N Y G C Y C G W G G S G T P V D E L D R C C Q I H D N C Y G E A E K K R C G P K M T L Y S W E C A N D V P V C N S K S A C E G F V C D C D A A A A K C F A K A P Y N K N N I G I G S K T R C Q,Basic phospholipase A2 acanthin 2,Acanthophis antarcticus,Fibrous,Collagen,-17.290185928344727,-3.3842411041259766,Eukaryota,Real
173,P81236,None,D L F Q F G G M I G C A N K G A R S W L S Y V N Y G C Y C G W G G S G T P V D E L D R C C Q I H D N C Y G E A E K K Q C G P K M T S Y S W K C A N D V P V C N D S K S A C K G F V C D C D A A A A K C F A K A P Y N K N N I G I G S K T R C Q,Basic phospholipase A2 acanthin 1,Acanthophis antarcticus,Fibrous,Collagen,-17.265417098999023,-3.380967855453491,Eukaryota,Real
174,Q9CXL7,None,M A S C L A L R V A L L L I S G V L A P A V L T A E G P Q E P D P T L W N E P I E L P S G E G P L E S T S H N Q E F A V S G P P F P T S A P A P E D S T P P A R V D Q D G G S L G P G A I A A I V I A A L L A T C V V L A L V V V A L R K F S A S,Protein SNORC,Mus musculus,Fibrous,Collagen,23.01243019104004,-3.995624542236328,Eukaryota,Real
175,O97646,None,L H H Q I I P V L S Q Q Q T P T H A L Q P H H H I P V M A A Q Q P M Q P Q Q P M M P M P G Q P S V T P T Q H H Q S N L P Q P A Q Q P F Q P Q V P Q Q P P H Q P I Q P Q A P A H P M P P M P Q P P L P P M F P M Q P L P P L L P D L P L E Q W P A T,Amelogenin Fragment,Ornithorhynchus anatinus,Fibrous,Collagen,-4.029475688934326,11.933694839477539,Eukaryota,Real
176,O97647,None,L H H Q I I P V L S Q H Q T P T H A L Q S H H H I P V M A T Q Q P T Q P P Q P M M P M P G Q H S V T P T Q H H Q S N L P Q P G Q Q P F Q P Q F P Q K P T H R P I Q P Q A P V H P M P P M P Q P Q L P P M F P L Q P L P P L L P D L P L E P W P A S,Amelogenin Fragment,Tachyglossus aculeatus aculeatus,Fibrous,Collagen,-4.003792762756348,11.929950714111328,Eukaryota,Real
177,Q6UX34,None,M A S C L A L R M A L L L V S G V L A P A V L T D D V P Q E P V P T L W N E P A E L P S G E G P V E S T S P G R E P V D T G P P A P T V A P G P E D S T A Q E R L D Q G G G S L G P G A I A A I V I A A L L A T C V V L A L V V V A L R K F S A S,Protein SNORC,Homo sapiens,Fibrous,Collagen,22.989200592041016,-3.9701452255249023,Eukaryota,Real
178,P81615,None,M I Q R G R A T L L V A L L L L A Q L R P E S S Q W S P A A A A A T G V Q D P N L R W S P G V R N Q G G G V R A L L L L L A E R F P R R A G S E P A G E R Q R R D D P P L S I D L T F H L L R T L L E L A R T Q S Q R E R A E Q N R I I F D S V G K,Urocortin,Mus musculus,Fibrous,Collagen,19.324716567993164,-6.36870813369751,Eukaryota,Real
179,P55090,None,M R Q R G R A T L L V A L L L L V Q L R P E S S Q W S P A A A A A N V V Q D P N L R W N P G V R N Q G G G V R A L L L L L A E R F P R R A G S E P A G E R Q R R D D P P L S I D L T F H L L R T L L E L A R T Q S Q R E R A E Q N R I I F D S V G K,Urocortin,Rattus norvegicus,Fibrous,Collagen,19.324710845947266,-6.3687896728515625,Eukaryota,Real
180,P14420,None,N L F Q F A K M I N G K L G A F S V W N Y I S Y G C Y C G W G G Q G T P K D A T D R C C F V H D C C Y G R V R G C N P K L A I Y S Y S F K K G N I V C G K N N G C L R D I C E C D R V A A N C F H Q N K N T Y N K N Y K F L S S S R C R Q T S E Q C,Basic phospholipase A2 vipoxin B chain,Vipera ammodytes meridionalis,Fibrous,Collagen,-18.058059692382812,-3.6467878818511963,Eukaryota,Real
181,C9DPL5,None,N L W Q F G K L I M K I A G E S G V F K Y L S Y G C Y C G L G G Q G Q P T D A T D R C C F V H D C C Y G K V T G C D P K I D S Y T Y S K E N G D V V C G G D D P C K K Q I C E C D R V A A T C F R D N K D T Y D I K Y W F Y G A K N C Q E E S E P C,Acidic phospholipase A2 BpirPLA2 I,Bothrops pirajai,Fibrous,Collagen,-18.433908462524414,-3.921675443649292,Eukaryota,Real
182,Q9QZQ3,None,M D R V P F C C L L F I G L L N P L L S L P V T D T G E R T L Q L P V L E E D A L R A L E E L E R M A L L Q T L R Q T M G T E A G E S P G E A G P S T E T P T P R G S M R K A F A G Q N S N T V L S R L L A R T R K Q H K Q H G A A P E C F W K Y C I,Urotensin 2,Mus musculus,Fibrous,Collagen,2.1704323291778564,-6.341636657714844,Eukaryota,Real
183,Q9QZQ4,None,M D R V P F C C L L F V G L L N P L L S F P V T D T G E M S L Q L P V L E E N A L R A L E E L E R T A L L Q T L R Q T V G T E A E G S L G Q A D P S A E T P T P R G S L R K A L T G Q D S N T V L S R L L A R T R K Q R K Q H G T A P E C F W K Y C I,Urotensin 2,Rattus norvegicus,Fibrous,Collagen,2.1610398292541504,-6.338635444641113,Eukaryota,Real
184,P81114,None,D C P S D W S S Y E G H C Y R V F N E P Q N W A D A E K F C T Q Q H K G S H L V S F Q S S E E A D F V V Q M T R P I L N A N L V W I G L S N L W N Q C N S Q W S D G T X L D Y K X W R E Q F E C L V S R T T N N E W L S M D C S S T H S F V C E F Q A,Snaclec alboaggregin A subunit beta,Trimeresurus albolabris,Fibrous,Collagen,12.398110389709473,10.321250915527344,Eukaryota,Real
185,P81243,None,D L W Q F G Q M M N D V M R E Y V V F N Y L Y Y G C Y C G W G G I G K P R D A T D R C C F V H D C C Y G K V T G C N P K T D S Y T Y T Y S E E N G D V V C G G D D L C K K Q I C E C D R V A A T C F R D N K D T Y D T K Y W L Y G A K N C Q E E S E P C,Acidic phospholipase A2,Bothrops jararaca,Fibrous,Collagen,-15.153243064880371,9.689587593078613,Eukaryota,Real
186,P55089,None,M R Q A G R A A L L A A L L L L V Q L C P G S S Q R S P E A A G V Q D P S L R W S P G A R N Q G G G A R A L L L L L A E R F P R R A G P G R L G L G T A G E R P R R D N P S L S I D L T F H L L R T L L E L A R T Q S Q R E R A E Q N R I I F D S V G K,Urocortin,Homo sapiens,Fibrous,Collagen,19.343191146850586,-6.314441204071045,Eukaryota,Real
187,D2YW40,None,C P L H W S S Y N G Y C Y R V F S E L K T W E D A E S F C Y A Q H K G S R L A S I H S R E E E A F V G K L A S Q T L K Y T S M W L G L N N P W K E C K W E W S D D A K L D Y K V W L R R P Y C A V M V V K T D R I F W F N R G C E K T V S F V C K F Y S,Snaclec rhodocetin subunit delta,Calloselasma rhodostoma,Fibrous,Collagen,11.15144157409668,10.66488265991211,Eukaryota,Real
188,P81113,None,G F D C P F G W S S Y E G Y C Y K V Y N K K M N W E D A E S F C R E Q H K R S H L V S F H S S G E V D F V V S K T F P I L R Y D F V W M G L S D I W K E C T K E W S D G A R L D Y K A W S G K S Y C L V S K T T N N E W L S M D C S R T R Y P V C K F X G,Snaclec alboaggregin A subunit beta,Trimeresurus albolabris,Fibrous,Collagen,11.027287483215332,10.700125694274902,Eukaryota,Real
189,P0DJL5,None,D Q D C L P G W S Y F E K Y C Y K V F Q V K K N W E D A E K F C T E E V K D G H L I S L H S N E E V E F M T S L A F P I L K Y D I V W M G L R N F W R D C P W K W S D D A K L D Y K A W S D E P N C Y G A M T T D Y Q W L R W N C N D P R Y F V C K S P A,Snaclec VP12 subunit B,Daboia palaestinae,Fibrous,Collagen,11.379368782043457,10.618768692016602,Eukaryota,Real
190,P23582,None,M H L S Q L L A C A L L L T L L S L R P S E A K P G A P P K V P R T P P A E E L A E P Q A A G G G Q K K G D K A P G G G G A N L K G D R S R L L R D L R V D T K S R A A W A R L L Q E H P N A R K Y K G A N K K G L S K G C F G L K L D R I G S M S G L G C,C type natriuretic peptide,Homo sapiens,Fibrous,Collagen,17.023696899414062,-28.20441436767578,Eukaryota,Real
191,Q61839,None,M H L S Q L I A C A L L L A L L S L R P S E A K P G T P P K V P R T P P G E E L A D S Q A A G G N Q K K G D K T P G S G G A N L K G D R S R L L R D L R V D T K S R A A W A R L L H E H P N A R K Y K G G N K K G L S K G C F G L K L D R I G S M S G L G C,C type natriuretic peptide,Mus musculus,Fibrous,Collagen,17.0267276763916,-28.209701538085938,Eukaryota,Real
192,P55207,None,M H L S Q L I A C A L L L A L L S L R P S E A K P G T P P K V P R T P P G E E L A E P Q A A G G N Q K K G D K T P G G G G A N L K G D R S R L L R D L R V D T K S R A A W A R L L H E H P N A R K Y K G G N K K G L S K G C F G L K L D R I G S M S G L G C,C type natriuretic peptide,Rattus norvegicus,Fibrous,Collagen,17.028688430786133,-28.212514877319336,Eukaryota,Real
193,Q3BK13,None,M I Q V L L V T I C L A V F P F H G S S I I L E S G N V N D Y E V V Y P K K V T L L P T G A M N S A N P C C D P I T C K P R K G E H C V S G P C C R N C K F L N P G T I C K R T M L D G L N D Y C T G I T S D C P R N P W K S E E D E M K W S A T A K G S V L M,Disintegrin lebein 2 alpha,Macrovipera lebetina,Fibrous,Collagen,-13.059560775756836,16.79587745666504,Eukaryota,Real
194,P81398,None,D F R C P T T W S A S K L Y C Y K P F K E K K T W I E A E R F C A K Q A E N G H L V S I G S A A E A D F L D L V I V V N F D K Q R Y R A W T G L T E R N L K W T N G A S V S Y E N L Y E P Y I R K C F V V Q P W E G K S K W Y K A D C E E K N A F L C K F P K P H,Snaclec rhodocetin subunit beta,Calloselasma rhodostoma,Fibrous,Collagen,-12.429891586303711,4.876819610595703,Eukaryota,Real
195,P9WI86,mtp,M Y R F A C R T L M L A A C I L A T G V A G L G V G A Q S A A Q T A P V P D Y Y W C P G Q P F D P A W G P N W D P Y T C H D D F H R D S D G P D H S R D Y P G P I L E G P V L D D P G A A P P P P A A G G G A,Pilin,Mycobacterium tuberculosis (strain CDC 1551 / Oshkosh),Fibrous,Collagen,2.3526902198791504,6.681138515472412,Bacteria,Real
196,P9WI87,mtp,M Y R F A C R T L M L A A C I L A T G V A G L G V G A Q S A A Q T A P V P D Y Y W C P G Q P F D P A W G P N W D P Y T C H D D F H R D S D G P D H S R D Y P G P I L E G P V L D D P G A A P P P P A A G G G A,Pilin,Mycobacterium tuberculosis (strain ATCC 25618 / H37Rv),Fibrous,Collagen,2.352689027786255,6.681110858917236,Bacteria,Real
197,Q2G2U9,sarA,M A I T K I N D C F E L L S M V T Y A D K L K S L I K K E F S I S F E E F A V L T Y I S E N K E K E Y Y L K D I I N H L N Y K Q P Q V V K A V K I L S Q E D Y F D K K R N E H D E R T V L I L V N A Q Q R K K I E S L L S R V N K R I T E A N N E I E L,Transcriptional regulator SarA,Staphylococcus aureus (strain NCTC 8325 / PS 47),Fibrous,Collagen,29.329021453857422,-17.345767974853516,Bacteria,Real
198,A6QES8,sarA,M A I T K I N D C F E L L S M V T Y A D K L K S L I K K E F S I S F E E F A V L T Y I S E N K E K E Y Y L K D I I N H L N Y K Q P Q V V K A V K I L S Q E D Y F D K K R N E H D E R T V L I L V N A Q Q R K K I E S L L S R V N K R I T E A N N E I E L,Transcriptional regulator SarA,Staphylococcus aureus (strain Newman),Fibrous,Collagen,29.32904624938965,-17.346065521240234,Bacteria,Real
199,P0C1U6,sarA,M A I T K I N D C F E L L S M V T Y A D K L K S L I K K E F S I S F E E F A V L T Y I S E N K E K E Y Y L K D I I N H L N Y K Q P Q V V K A V K I L S Q E D Y F D K K R N E H D E R T V L I L V N A Q Q R K K I E S L L S R V N K R I T E A N N E I E L,Transcriptional regulator SarA,Staphylococcus aureus,Fibrous,Collagen,29.329044342041016,-17.34589385986328,Bacteria,Real
200,P23827,eco,M K T I L P A V L F A A F A T T S A W A A E S V Q P L E K I A P Y P Q A E K G M K R Q V I Q L T P Q E D E S T L K V E L L I G Q T L E V D C N L H R L G G K L E N K T L E G W G Y D Y Y V F D K V S S P V S T M M A C P D G K K E K K F V T A Y L G D A G M L R Y N S K L P I V V Y T P D N V D V K Y R V W K A E E K I D N A V V R,Ecotin,Escherichia coli (strain K12),Fibrous,Collagen,14.344412803649902,-15.930193901062012,Bacteria,Real
201,P45470,yhbO,M S K K I A V L I T D E F E D S E F T S P A D E F R K A G H E V I T I E K Q A G K T V K G K K G E A S V T I D K S I D E V T P A E F D A L L L P G G H S P D Y L R G D N R F V T F T R D F V N S G K P V F A I C H G P Q L L I S A D V I R G R K L T A V K P I I I D V K N A G A E F Y D Q E V V V D K D Q L V T S R T P D D L P A F N R E A L R L L G A,Protein nucleic acid deglycase 2,Escherichia coli (strain K12),Fibrous,Collagen,20.295734405517578,-16.720338821411133,Bacteria,Real
202,Q8X582,elfA,M I T M K K S V L T A F I T V V C A T S S V M A A D D N A I T D G S V T F N G K V I A P A C T L V A A T K D S V V T L P D V S A T K L Q T N G Q V S G V Q T D V P I E L K D C D T T V T K N A T F T F N G T A D T T Q I T A F A N Q A S S D A A T N V A L Q M Y M N D G T T A I K P D T E T G N I L L Q D G D Q T L T F K V D Y I A T G K A T S G N V N A V T N F H I N Y Y,Laminin binding fimbrial subunit ElfA,Escherichia coli O157:H7,Fibrous,Collagen,14.442683219909668,-15.697890281677246,Bacteria,Real
203,P0CL68,dbpB,M K I G K L N S I V I A L F F K L L V A C S I G L V E R T N A A L E S S S K D L K N K I L K I K K E A T G K G V L F E A F T G L K T G S K V T S G G L A L R E A K V Q A I V E T G K F L K I I E E E A L K L K E T G N S G Q F L A M F D L M L E V V E S L E D V G I I G L K A R V L E E S K N N P I N T A E R L L A A K A Q I E N Q L K V V K E K Q N I E N G G E K K N N K S K K K K,Decorin binding protein B,Borrelia burgdorferi (strain ATCC 35210 / B31 / CIP 102532 / DSM 4680),Fibrous,Collagen,-20.14333152770996,28.006450653076172,Bacteria,Real
204,C6C2E5,dbpB,M K I G K L N S I V M V L F F D L L V A C S I G L V E R T N A A L E S S S K D L K N K I L K I K K E A T G K G V L F E A F T G L K T G S K V T S G G L A L R E A K V Q A I V E T G K F L K I I E E E A L K L K E T G N S G Q F L A M F D L M L E V V E S L E D V G I I G L K A R V L E E S K N N P I N T A E R L L A A K A Q I E N Q L K V V K E K Q N I E N G G E K K N N K S K K K K,Decorin binding protein B,Borrelia burgdorferi (strain N40),Fibrous,Collagen,-20.143348693847656,28.006132125854492,Bacteria,Real
205,O50917,dbpA,M I K C N N K T F N N L L K L T I L V N L L I S C G L T G A T K I R L E R S A K D I T D E I D A I K K D A A L K G V N F D A F K D K K T G S G V S E N P F I L E A K V R A T T V A E K F V I A I E E E A T K L K E T G S S G E F S A M Y D L M F E V S K P L Q K L G I Q E M T K T V S D A A E E N P P T T A Q G V L E I A K K M R E K L Q R V H T K N Y C T L K K K E N S T F T D E K C K N N,Decorin binding protein A,Borrelia burgdorferi (strain ATCC 35210 / B31 / CIP 102532 / DSM 4680),Fibrous,Collagen,-12.490228652954102,28.054189682006836,Bacteria,Real
206,P55880,yajL,M S A Q A L V C L A P G S E E T E A V T T I D L L V R G G I H V T T A S V A S D G N L T I V C S R G V K L L A D A P L V E V A D G D Y D I I V L P G G I K G A E C F R D S P L L V E T V K Q F H R S G R I V A A I C A A A A T V L V P H D I F P I G N M T G F P A L K D K I P A E Q W L D K R V V W D A R V K L L T S Q G P G T A I D F G L K I I D L L A G R E K A H E V A S Q L V M A A G I Y N Y Y E,Protein nucleic acid deglycase YajL,Salmonella typhimurium (strain LT2 / SGSC1412 / ATCC 700720),Fibrous,Collagen,21.09013557434082,-17.93016815185547,Bacteria,Real
207,Q46948,yajL,M S A S A L V C L A P G S E E T E A V T T I D L L V R G G I K V T T A S V A S D G N L A I T C S R G V K L L A D A P L V E V A D G E Y D V I V L P G G I K G A E C F R D S T L L V E T V K Q F H R S G R I V A A I C A A P A T V L V P H D I F P I G N M T G F P T L K D K I P A E Q W L D K R V V W D A R V K L L T S Q G P G T A I D F G L K I I D L L V G R E K A H E V A S Q L V M A A G I Y N Y Y E,Protein nucleic acid deglycase 3,Escherichia coli (strain K12),Fibrous,Collagen,21.07444953918457,-17.90367317199707,Bacteria,Real
208,Q183R7,zmp1,M R P S K K L L I A I I S I F L I S S V P V S A H A D S T T I Q Q N K D T L S Q I V V F P T G N Y D K N E A N A M V N R L A N I D G K Y L N A L K Q N N L K I K L L S G K L T D E K E Y A Y L K G V V P K G W E G T G K T W D D V P G L G G S T V A L R I G F S N K G K G H D A I N L E L H E T A H A I D H I V L N D I S K S A Q F K Q I F A K E G R S L G N V N Y L G V Y P E E F F A E S F A Y Y Y L N Q D T N S K L K S A C P Q T Y S F L Q N L A K,Pro Pro endopeptidase,Clostridioides difficile (strain 630),Fibrous,Collagen,19.297325134277344,-13.487566947937012,Bacteria,Real
209,Q9UME9,ELN,G A C L G K A C G R K R K,Elastin Fragment,Homo sapiens,Fibrous,Elastin,-20.287155151367188,21.296497344970703,Eukaryota,Real
210,Q9UMK5,ELN,M A G L T A A A P R P G V L L L L L S I L H P S R P G,Elastin Fragment,Homo sapiens,Fibrous,Elastin,-0.5120100975036621,14.77617359161377,Eukaryota,Real
211,Q28569,EMILIN2A,N L A W G E S V G S E L E D W E L V G S E L S Q G L W A L E V C L Q L,Elastin Fragment,Ovis sp.,Fibrous,Elastin,0.7048190832138062,22.029142379760742,Eukaryota,Real
212,A0A1A8JNZ5,ELN,E T G S A C G G S K A S W P Q Q S L E K S S P H I T P S F C T H R R P K A,Elastin microfibril interfacer 2a Fragment,Nothobranchius kuhntae,Fibrous,Elastin,-13.697904586791992,12.844250679016113,Eukaryota,Real
213,A0A1A8G4R0,ELN,N H P T G Y G A Q L G A T Q D A L G E Q T G K Y D G V N A A L G N G Y K G,Elastin Fragment,Nothobranchius korthausae,Fibrous,Elastin,-2.708775043487549,14.253667831420898,Eukaryota,Real
214,Q28102,Q604_UNBC07415G0001,A T S L T L L T V A A G G L L S A P V G L G I A G L A L V P I I I A R T R V P A,Elastin Fragment,Bos taurus,Fibrous,Elastin,1.1681972742080688,13.889697074890137,Eukaryota,Real
215,H7C3K0,ELN,V T F P G A L V P G G V A D A A A A Y K A A K A G A G L G G V P G V G G L G V S A G A V V P Q P G A G V K P G K V P A L,Elastin Fragment,Homo sapiens,Fibrous,Elastin,-0.22258776426315308,8.053990364074707,Eukaryota,Real
216,W1Y7I0,elastin gene,P K A Q Q Q K R K S E S T Q S K P S T N K D K K A A T G A G I A G A A G V A G A A E T S K R H H N K K D K Q D S K H S N H E N D E K S,Putative elastin binding protein ebpS Fragment,human gut metagenome,Fibrous,Elastin,12.632511138916016,-23.076597213745117,Eukaryota,Real
217,E9PGX4,PANDA_008830,M A G L T A A A P R P G V L L L L L S I L H P S R P G G V P G A I P G G V P G G V F Y P G N V H E T S T H P G H A D D A D V H N R C T F,Elastin,Homo sapiens,Fibrous,Elastin,-11.675642013549805,16.15058708190918,Eukaryota,Real
218,Q13626,emilin3a,G P G P E S E L E A F L L T G L E L G A F P A L V S E S E V S L E S Q V S L V S E V F P E S E V S R E L A F P P K L S S T C A K A A K Y G,Elastin Fragment,Homo sapiens,Fibrous,Elastin,-9.606107711791992,18.21794891357422,Eukaryota,Real
219,D2HDP0,EMILIN2A,G A P D A A K A A A K A A A K A Q F R A A A G L P A G V P G F G V G A G I P G F G V G A G V P G L G V G A G V P G F G A G A G E G P S R A,Elastin Fragment,Ailuropoda melanoleuca,Fibrous,Elastin,-0.4820752441883087,11.953591346740723,Eukaryota,Real
220,F1R3W5,elna,X N H C A Y V V E K T V S F T V Q D G A A P F M K A M K C A W G Q K C P T T K Y R M Y Y K P M Y K V A Y K T V T E L E W K C C P G Y T G V,Elastin microfibril interfacer 3a Fragment,Danio rerio,Fibrous,Elastin,3.592517614364624,10.530187606811523,Eukaryota,Real
221,A0A1A8GL53,ELNB,L G L A G A V K G L G D S L S K Y D Q D M Q K L N S T C C Q A D P S S H G G P S Q V N W A S A D S T S H Q L N E L K N M F D S L S R Q L S S,Elastin microfibril interfacer 2a Fragment,Nothobranchius korthausae,Fibrous,Elastin,-20.32268714904785,16.55998992919922,Eukaryota,Real
222,A0A2R4FXP2,elastin,G V A G G A G T V P G A G G V P L A G T G T G L A P G A G V G G Y P G G V K P P K T G A G I A G I G I A A P G A T P G G T G I V V P G V P G G T G,Elastin a Fragment,Danio rerio,Fibrous,Elastin,-0.14464689791202545,-25.768178939819336,Eukaryota,Real
223,A0A1A8MXW8,ELNB,T G F G P G G Q T L G K Q K P S K S G Y G G T G Y G T G G V G G G T G P G D T G T R P G S F G P G G Y G P G G A G T G P S G G F G Q G G V G P G G,Elastin b Fragment,Nothobranchius pienaari,Fibrous,Elastin,-1.4109265804290771,-26.480722427368164,Eukaryota,Real
224,Q28100,ELNA,V G I P A A A A A K A A A K A A Q F G L G P G V G V A P G V G V V P G V G V V P G V G V A P G N G L G P G G V I G A G V P A A A K S A A K A A A K A Q F,Elastin Fragment,Bos taurus,Fibrous,Elastin,3.8926312923431396,-22.254770278930664,Eukaryota,Real
225,A0A1A7ZHH9,EMILIN2A,G A G G T S Q T V G G V A G L P V L I P P A G G A G P G Y G G V A G G V Y P G Y A G T G Q K S K A Q K A A K Y A A M Q A F L G G Y R G A G C Q G N Y C G R R R K,Elastin b Fragment,Nothobranchius furzeri,Fibrous,Elastin,-2.021139621734619,0.1255437433719635,Eukaryota,Real
226,A0A1A8ESK3,ELNB,R F T T Q M A P A I T L H F T A R Q K F C L L E T I I K N L L S G C S P E L I S S R L F L D A I L K H D L K W H D K N N M H V R A K R Y H K L R L E N M F I R S S,Elastin a Fragment,Nothobranchius korthausae,Fibrous,Elastin,-15.453968048095703,20.2885684967041,Eukaryota,Real
227,A0A1A8QNN2,ELNB,A K Q G P H I E A V L S V S N R S I H R L R S S S G P G D C Q Q K A S A G G T C C S G G T V S F S L I L P L R K G D R V S L W R I K G Q L A T T E S G E I L S T Y N,Elastin microfibril interfacer 2a Fragment,Nothobranchius pienaari,Fibrous,Elastin,-6.236860752105713,12.526670455932617,Eukaryota,Real
228,A0A1A7ZGA9,elna,G G A G V G P G G T G L G P G G A G V G P G G A G F G P G G G G I N P G G A G F G P G G T G L R P S G A E V G P G G T G F G P G G A G I G P G R A G F G P G G I G L G L,Elastin b Fragment,Nothobranchius furzeri,Fibrous,Elastin,-3.513716459274292,-15.159187316894531,Eukaryota,Real
229,A0A1A7ZFU8,LOC107849223,G V Q D L D Q E K Q E L V L V E A V Q C C H R L V Q L V E D L E E R V V V K H Q C K F Q E L G C L D S I K V D L F Q V K V L E A V A F S Q E W L Q E M D L G L K L E P E Y L V,Elastin b Fragment,Nothobranchius furzeri,Fibrous,Elastin,-6.078720569610596,21.224809646606445,Eukaryota,Real
230,A0A2R4FXK2,ELN,G V P G G V P G G V P G G V P G G V P G G V A G G A G T V P G A G G V P L A G T G T G L A P G A G V G G Y P G G V K P P K T G A G I A G I G I A A P G A T P G G T G I V V P G V P G G T G,Elastin a Fragment,Danio rerio,Fibrous,Elastin,-0.13195271790027618,-26.21954345703125,Eukaryota,Real
231,A0A1U8EQ99,EMILIN1A,M G I A K D L V R G T H E H G G V G I G G I K G C F G I G G L A V V L V A L V V V V A I G G G F S V H R G G I S G V G D P G I G I G G I G I G V G N G V S G I G H V G G I S N V C G G C W,elastin like,Capsicum annuum,Fibrous,Elastin,1.1235133409500122,12.217077255249023,Eukaryota,Real
232,D3DXF3,LOC113207366,M S P V D R P A P L A G W V H P P S T W L T C H G R L C P A S T P I L H S P R A C G A V Q T G V P G I S S P P G V S P H A V L Y T P H P S L G P L N F R A V P I P A P P I F L C L A V I D Q,,Homo sapiens,Fibrous,Elastin,-12.39050006866455,12.545948028564453,Eukaryota,Real
233,A0A1A8D432,ELNA,A D H I H D T K N Q F G N V D K E I Q I I R N N Y A T E V R E C R R S R D G L D Q R I S K L E G V C V R M D S F S N S L E R I K E G L N R H V S G L W S C V N G I N A T V A S H G D L I E S I Q K,Elastin microfibril interfacer 1a Fragment,Nothobranchius kadleci,Fibrous,Elastin,-5.378057479858398,5.032142639160156,Eukaryota,Real
234,A0A0U5BCV2,ELN,G P S G A G V G G L P A A G G A G G A G G P A G T G Q G L G G G A G S L P A G G G R P G Y G G V A G G N Y P G Y T G A G Q K S K A Q K A A K Y A A M Q A F L G S G G Y R G A G C Q G R Y C G Q R R K,Elastin b Fragment,Gasterosteus aculeatus,Fibrous,Elastin,-1.530524730682373,-0.38058042526245117,Eukaryota,Real
235,A0A6J1SER2,EMILIN2A,M K C F V I L A C V L A V A V A Q Q Q A F T D C A A D P Q K C A S E C R K D P Q K C A A N F G G G S L P S G I P S I P N L P D G V P A V P A I P A V P S I P G F P A I P G A G S S S S T A A P S S S,elastin like,Frankliniella occidentalis,Fibrous,Elastin,8.425622940063477,-23.91001319885254,Eukaryota,Real
236,A0A1A7XDR0,ELN,S K Q N E H K W V S A L Q N P H L N K S S K P L K C N T K K S A A D G N S A R L V Q G G A R L S T R A Q E W S S G Q L L R C S I T G A H K T R G G K G A Q K S N N T N G H N N K K M H A F K R I I L N,Elastin a Fragment,Iconisemion striatum,Fibrous,Elastin,-12.401272773742676,17.47015953063965,Eukaryota,Real
237,P11547,EMILIN2,F G L G G V G G L G V G G L G V G G L G A V P G A V G L G G V S P A A A A K A A K F G A A G L G G V L G A G R P F P I G G G A G G L G V G G K P P K P F G G A L G A L G F P G G A C L G K S C G R K R K,Elastin Fragment,Ovis aries,Fibrous,Elastin,-2.651754856109619,1.1698570251464844,Eukaryota,Real
