,ID,Gene,Sequence,Description,Organism,Protein type,Class,x_coords,y_coords,Domain,Types
590,Q8LBX7,TED6,M A S T D S V Y R P T P T P D H D T T V V V V V F V S L G C V M F L A F L A F V I W F L I K K R S R K H R E R S E A V R V D E H F K M K E A I V E G P N G Q K S V V L S V E D D V K I E D A I K R E E K D L K K D G G V G S S V V S R S,Protein TRACHEARY ELEMENT DIFFERENTIATION RELATED 6,Arabidopsis thaliana,Membrane,None,-6.261984348297119,3.8723347187042236,Eukaryota,Real
591,Q9MAB9,MUB1,M A E V H N Q L E I K F R L T D G S D I G P K A F P D A T T V S A L K E T V I S E W P R E K E N G P K T V K E V K L I S A G K V L E N S K T V K D Y R S P V S N L A G A V T T M H V I I Q A P V T E K E K K P K G D P K M N K C V C S V M,Membrane anchored ubiquitin fold protein 1,Arabidopsis thaliana,Membrane,None,-10.72563648223877,10.582834243774414,Eukaryota,Real
592,Q9SW27,MUB3,M P E E E S I D I K F R L Y D G S D I G P F R Y S A A S T V D F L K Q R V V S D W P K G K T V V P K G I N E V K L I S S G K I L E N N K T V G Q C K T P F G D I A G G V I V M H V V V Q P S L A K S K T E K K V D K A P K A V I C T C T I L,Membrane anchored ubiquitin fold protein 3,Arabidopsis thaliana,Membrane,None,-22.65381622314453,9.446165084838867,Eukaryota,Real
593,Q8GWJ6,MUB6,M A G E E D W I E L K F R L A D G T D I G P S K Y N Q S M T V S S L K E K L I S Q W P K D K E N T P K T V N D M K L I N A G K I L E N N R T L A E S R L P V C E L P G M I I T M H I V L R L P T L D K K S E K L Q N D P P M K N R C V C T I L,Membrane anchored ubiquitin fold protein 6,Arabidopsis thaliana,Membrane,None,-12.394414901733398,10.477749824523926,Eukaryota,Real
594,A8MS09,DVL24,M C I I L H S C T A R L P Q A Q N L Q I E L K Q D Q V Q A S F K S N E K K N S I F I K L V S E K P M L I N R R V E S S N L L H S N M G G F L A K K T N S N S K I R N S F T S K C T S L M K Q Q H A R L C I I R L C A T M L L R S Y T D H D D Y,Small polypeptide DEVIL 24,Arabidopsis thaliana,Membrane,None,-24.1627254486084,12.144881248474121,Eukaryota,Real
595,Q9C9E1,SAUR78,M A K V G K L T K L K S A M K K W P S F A K N H H H S T S S A A V S D E L S E D N N L H V V Y V G Q T R R P Y M L R P D I I S H P L F Q E L V D R S S S R S I E Q D R E I V V A C E V V L F E H L L W M L K S G Q E G G S V E E L A E F Y T Y,Auxin responsive protein SAUR78,Arabidopsis thaliana,Membrane,None,4.004565715789795,-34.57923126220703,Eukaryota,Real
596,Q9LSD8,MUB4,M P E E D L V E L K F R L Y D G S D V G P F Q Y S P T A T V S M L K E R I V S E W P K D K K I V P K S A S D I K L I N A G K I L E N G K T V A Q C K A P F D D L P K S V I T M H V V V Q L S P T K A R P E K K I E K E E A P Q R S F C S C T I M,Membrane anchored ubiquitin fold protein 4,Arabidopsis thaliana,Membrane,None,-11.562763214111328,9.010272026062012,Eukaryota,Real
597,Q9SH14,MUB5,M G D E D L I E L K F R L A D G T D I G P S K Y S Q F M T V A S L K E K I I A Q W P K D K E N A P K M I N E V K L I N G G K I L E N N K T L S E A R S L I T I G E L P G I V T T M H V V L R P P L F E K K K E K L Q N D P P R K S H C V C C I L,Membrane anchored ubiquitin fold protein 5,Arabidopsis thaliana,Membrane,None,-12.064655303955078,11.288847923278809,Eukaryota,Real
598,Q8LCS8,MUB2,M A E V K D Q L E I K F R L N D G S D I G P K L F P D A T T V A T L K E T V V A Q W P R D K E N G P K T V K D V K L I S A G R I L E N N K T V G D C R S P V G N F S G A V T T M H V I I Q H Q V T E K E K K K K K P K G D L K Q N K C V C L C F G A R C,Membrane anchored ubiquitin fold protein 2,Arabidopsis thaliana,Membrane,None,-12.845989227294922,8.549610137939453,Eukaryota,Real
599,Q9SQT9,AGP27,M A S S I L L T L I T F I F L S S L S L S S P T T N T I P S S Q T I S P S E E K I S P E I A P L L P S P A V S S T Q T I P S S S T L P E P E N D D V S A D P D P A F A P S A S P P A S S L A S L S S Q A P G V F I Y F V F A A V Y C F S L R L L A V S A I,Classical arabinogalactan protein 27,Arabidopsis thaliana,Membrane,None,-39.40821075439453,-9.414456367492676,Eukaryota,Real
600,Q6NQH4,TAF13,M S N T P A A A A S S S S K S K A A G T S Q P Q E K R K T L F Q K E L Q H M M Y G F G D E Q N P L P E S V A L V E D I V V E Y V T D L T H K A Q E I G S K R G R L L V D D F L Y L I R K D L P K L N R C R E L L A M Q E E L K Q A R K A F D V D E K E L V D,Transcription initiation factor TFIID subunit 13,Arabidopsis thaliana,Membrane,None,10.182757377624512,-2.78178071975708,Eukaryota,Real
601,Q9M0S4,AGP10,M A S K S V V V L L F L A L I A S S A I A Q A P G P A P T R S P L P S P A Q P P R T A A P T P S I T P T P T P T P S A T P T A A P V S P P A G S P L P S S A S P P A P P T S L T P D G A P V A G P T G S T P V D N N N A A T L A A G S L A G F V F V A S L L L,Classical arabinogalactan protein 10,Arabidopsis thaliana,Membrane,None,-4.6379899978637695,-32.653053283691406,Eukaryota,Real
602,Q29PU2,SAUR76,M A K G G N K L M K L K S V L K K L N S F N T K P N Q P P A Q T N H S R S S A V S A F P S E D L Q T V Y V G R T R R T Y H V S S D V V S H P L F Q Q L A A V D G G C G S E D G S I S V S C E V V L F E H L L W M L E N A D A D E S R P E S V Y E L V E F Y A C,Auxin responsive protein SAUR76,Arabidopsis thaliana,Membrane,None,3.83964204788208,-34.40656661987305,Eukaryota,Real
603,Q1G3Y0,RIC9,M A T R F K G L Y N K S F K C F S D I F D V E E E E E M E I G Y P T D V R H V S H I G W D S S S S S A P S W L H E F K T S N N V L E P N S S W P F Q D L K S A M E A F G E V E S S K E M E R E S T K Q N L K K K L S S K A S L L C N S W S P R F S R S S K V L A,CRIB domain containing protein RIC9,Arabidopsis thaliana,Membrane,None,-40.659141540527344,-8.751797676086426,Eukaryota,Real
604,Q8LG54,AGP7,M N S K I I E A F F I V A L F T T S C L A Q A P A P S P T T T V T P P P V A T P P P A A T P A P T T T P P P A V S P A P T S S P P S S A P S P S S D A P T A S P P A P E G P G V S P G E L A P T P S D A S A P P P N A A L T N K A F V V G S L V A A I I Y A V V L A,Classical arabinogalactan protein 7,Arabidopsis thaliana,Membrane,None,-33.83047103881836,-11.320425987243652,Eukaryota,Real
605,Q9SJY7,AGP2,M N S K A M Q A L I F L G F L A T S C L A Q A P A P A P T T V T P P P T A L P P V T A E T P S P I A S P P V P V N E P T P A P T T S P T T S P V A S P P Q T D A P A P G P S A G L T P T S S P A P G P D G A A D A P S A A W A N K A F L V G T A V A G A L Y A V V L A,Classical arabinogalactan protein 2,Arabidopsis thaliana,Membrane,None,-5.318513870239258,-33.54273986816406,Eukaryota,Real
606,Q8LCN5,AGP1,M A F S K S L V F V L L A A L L I S S A V A Q S P A P A P S N V G G R R I S P A P S P K K M T A P A P A P E V S P S P S P A A A L T P E S S A S P P S P P L A D S P T A D S P A L S P S A I S D S P T E A P G P A Q G G A V S N K F A S F G S V A V M L T A A V L V I,Classical arabinogalactan protein 1,Arabidopsis thaliana,Membrane,None,-5.247565746307373,-34.31534194946289,Eukaryota,Real
607,Q9LQI6,SAUR77,M A I F G K L T K L K S A I K K W P S L T K N H H S T M C T A S T A V S E V S K C E D L H V V Y V G K S R R P Y M L S S H V I A H P L F Q E L L D R S S R F I E E R H D Q E T V L V A C E V V L F E H L L W M L K N S S S D H G D E D D R E R G S V E E L A E F Y T Y,Auxin responsive protein SAUR77,Arabidopsis thaliana,Membrane,None,3.468923330307007,-33.93764114379883,Eukaryota,Real
608,Q8LCE4,AGP5,M A S K S V V V F L F L A L V A S S V V A Q A P G P A P T I S P L P A T P T P S Q S P R A T A P A P S P S A N P P P S A P T T A P P V S Q P P T E S P P A P P T S T S P S G A P G T N V P S G E A G P A Q S P L S G S P N A A A V S R V S L V G T F A G V A V I A A L L L,Classical arabinogalactan protein 5,Arabidopsis thaliana,Membrane,None,-4.309125900268555,-34.939414978027344,Eukaryota,Real
609,Q42342,CYTB5-E,M S S D R K V L S F E E V S K H N K T K D C W L I I S G K V Y D V T P F M D D H P G G D E V L L S S T G K D A T N D F E D V G H S D T A R D M M D K Y F I G E I D S S S V P A T R T Y V A P Q Q P A Y N Q D K T P E F I I K I L Q F L V P I L I L G L A L V V R H Y T K K D,Cytochrome b5 isoform E,Arabidopsis thaliana,Membrane,None,14.564763069152832,9.416068077087402,Eukaryota,Real
610,Q94CD4,GILP,M A K E G T T V I G V P Y Y A G Q N P Y Q A G I V P P N A I Y G D P L G A P I Q Q T I Y R D T P A P F N C L Y C G N T G L T N L R S K P G V A A V V A C M M P F M L G F C F L C P S M D C L W N K Q H H C P Q C G N K V A D F E K S D P C L V M D P P Q W K Q P S F A L P A,GSH induced LITAF domain protein,Arabidopsis thaliana,Membrane,None,-31.192554473876953,-15.97464370727539,Eukaryota,Real
611,Q9ZT16,AGP4,M G S K I V Q V F L M L A L F A T S A L A Q A P A P T P T A T P P P A T P P P V A T P P P V A T P P P A A T P A P A T P P P A A T P A P A T T P P S V A P S P A D V P T A S P P A P E G P T V S P S S A P G P S D A S P A P S A A F S N K A F F A G T A F A A I M Y A A V L A,Classical arabinogalactan protein 4,Arabidopsis thaliana,Membrane,None,-6.05130672454834,-31.123584747314453,Eukaryota,Real
612,Q9C7Q1,SAUR66,M M N T K K L I K M F R K W Q Q R A A L H R K R I S F Q R P S T R S T T V E K G C F V V Y T A D N T R F A F P I S Y L S N S V F Q E I L E I S E E E F G L P T G G P I T L P F D S V F L E Y L I K L I K R R M D G D T E K A L L M S I S S A R C S L Q K Q E Q S T Q Q L L V F,Auxin responsive protein SAUR66,Arabidopsis thaliana,Membrane,None,-9.018881797790527,24.31254768371582,Eukaryota,Real
613,Q9FVE0,AGP11,M A R L F V V V A L L A L A V G T V F A A D A P S A A P T A S P T K S P T K A P A A A P K S S A A A P K A S S P V A E E P T P E D D Y S A A S P S D S A E A P T V S S P P A P T P E A D G P S S D G P S S D G P A A A E S P K S G A T T N V K L S I A G T V A A A G F F I F S L,Classical arabinogalactan protein 11,Arabidopsis thaliana,Membrane,None,-6.413325786590576,-33.255836486816406,Eukaryota,Real
614,Q94F57,AGP26,M S V S L F T A F T V L S L C L H T S T S E F Q L S T I S A A P S F L P E A P S S F S A S T P A M S P D T S P L F P T P G S S E M S P S P S E S S I M P T I P S S L S P P N P D A V T P D P L L E V S P V G S P L P A S S S V C L V S S Q L S S L L L V L L M L L L A F C S F F,Classical arabinogalactan protein 26,Arabidopsis thaliana,Membrane,None,-37.31792068481445,-11.802417755126953,Eukaryota,Real
615,Q9ZT17,AGP3,M A L K T L Q A L I F L G L F A A S C L A Q A P A P A P I T F L P P V E S P S P V V T P T A E P P A P V A S P P I P A N E P T P V P T T P P T V S P P T T S P T T S P V A S P P K P Y A L A P G P S G P T P A P A P A P R A D G P V A D S A L T N K A F L V S T V I A G A L Y A V L A,Classical arabinogalactan protein 3,Arabidopsis thaliana,Membrane,None,-5.842387676239014,-33.43853759765625,Eukaryota,Real
616,Q9C9Y6,TRX9,M G S C V S K G K G D D D S V H N V E F S G G N V H L I T T K E S W D D K L A E A D R D G K I V V A N F S A T W C G P C K I V A P F F I E L S E K H S S L M F L L V D V D E L S D F S S S W D I K A T P T F F F L K N G Q Q I G K L V G A N K P E L Q K K V T S I I D S V P E S P Q R P,Thioredoxin H9,Arabidopsis thaliana,Membrane,None,-2.9954397678375244,7.225160598754883,Eukaryota,Real
617,O49645,LTPG33,M A Y T N K V T I S A A V A T M M L F L A V T I V D A Q S M P P M P K F N P V C A L A D L P N I V Q L C Y F N L D L T P S E E C C N D L K S S S T I Q V N C L C D N F I A H P S N G N I S Q A R Y D L V N S A C G V A D K F A C K G G D A S G G S T N K I A A S M V L L G L V A S L F F,Non specific lipid transfer protein GPI anchored 33,Arabidopsis thaliana,Membrane,None,-7.164416790008545,-32.42517852783203,Eukaryota,Real
618,Q6NMM0,SAUR61,M M N T K K L L K M A K K W Q Q R A A L R R K R I S F H R S T D T T S S S T A A E K G C F V V Y T S D R I R F A F P I S Y L S N S V I Q E L L K I S E E E F G I P T E G P I T L P F D S V F L E Y L I R L V Q R R M D G D T E K A L I T S I S S T R C S L P C S F Q L Q E H S S T R L V F,Auxin responsive protein SAUR61,Arabidopsis thaliana,Membrane,None,-7.002203941345215,20.038022994995117,Eukaryota,Real
619,Q9C7Q8,SAUR62,M M I N A K K L M K L A K K W Q Q R A A L K R K R I S F Q R S S I T T S S Q T A V E K G C F V V Y T A D K I R F S F P L S Y L S N T I V Q E L L K I S E E E F G L P T E G P I T L P F D S A F L E Y L I N L I Q R R M D E D T E K A L L L S I S S A R S S F Q P Q Q H C S A T Q Q L L V F,Auxin responsive protein SAUR62,Arabidopsis thaliana,Membrane,None,-6.363490104675293,20.150001525878906,Eukaryota,Real
620,F4I1H5,SAUR63,M I N A K K L M K M A K K W Q Q R A A L H R K R I S F Q R S S V F T S S S S T V E K G C F V V Y T A D K I R F A F P I S Y L S N S V V Q E L L K I S E E D F G L P T E G P I T L P F D S A F L E Y L V K L I Q R R M D E D T E K A L L L S I S S A R C S F Q P Q E Q Q C S T T Q Q L L V F,Auxin responsive protein SAUR63,Arabidopsis thaliana,Membrane,None,-8.387382507324219,24.03565216064453,Eukaryota,Real
621,Q0V7Z5,SAUR64,M M N T K K L I K M A K K W Q Q R A A L H R K R I S F Q R S S S A T S S T A A E K G C F V V Y T T D S T R F A F P L S Y L S N S V F Q E L L K I S E E E F G L P T G G P I T S P F D S V F L E Y L I K L V Q R R M D A D T E K A L L M S I S S A R C S S Q C S L K L Q E R S T Q Q L L V F,Auxin responsive protein SAUR64,Arabidopsis thaliana,Membrane,None,-8.887125015258789,24.05379295349121,Eukaryota,Real
622,Q84WL9,AP17,M I R F I L L Q N R Q G K T R L A K Y Y V P L E E S E K H K V E Y E V H R L V V N R D A K F T N F V E F R T H K V I Y R R Y A G L F F S V C V D I T D N E L A Y L E S I H L F V E I L D H F F S N V C E L D L V F N F H K V Y L I L D E F I L A G E L Q E T S K R A I I E R M S E L E K L Q,AP 2 complex subunit sigma,Arabidopsis thaliana,Membrane,None,12.71706485748291,35.472877502441406,Eukaryota,Real
623,Q9SUV6,LTPG34,M A V A V T A V L F L A V V I A P Q W T E T K K P P R P S D T S D T S G T S G R D R R T M C P L S I P G I V Q N C Y A T L N A F P S K E C C K D L K T A S K R E V T C L C N N V I A H P D P L Y T N T N Q V N K A C G V L D K Y A C D A G N S N G G A T K K I V A S M G L F G V V A S L F F,Non specific lipid transfer protein GPI anchored 34,Arabidopsis thaliana,Membrane,None,-7.468005657196045,-29.352628707885742,Eukaryota,Real
624,F4I1I4,SAUR67,M M I N A K K L M K M A K K W Q Q R A A L H R K R I S F Q R S N V F T S S S S T V E K G C F V V Y T A D K I R F A F P I S Y L S N S I V Q E L L K I S E E E F G L P T E G P I T L P F D S V F L E Y L I K L I Q R R M D G D T E K A L L M S I S S A K C S L Q C S L L Q Q E Q S T Q Q L L V L,Auxin responsive protein SAUR67,Arabidopsis thaliana,Membrane,None,-8.013789176940918,23.574243545532227,Eukaryota,Real
625,Q6IM86,DVL15,M D V E K L W N H T K K D S I F Q T T H F S S S S K P F F T R S F S T K T S S S P S S K S H F T R S F S T K P S S S S S S S D L I F R R S F S A K P K T S K S L L L S R S C S T K S S A D L S S K S S S L S R I L S K K G A S V T G K C F K V A K E H K S R F Y I I K R C V L M L V C W H K H S,Small polypeptide DEVIL 15,Arabidopsis thaliana,Membrane,None,-44.11967468261719,-9.293999671936035,Eukaryota,Real
626,Q8LE84,DVL18,M D D E N L W K V V K K D S I F E T T H F S S K P V F T R S F S T K T S S S S S K P V F T R S F S T K P T S Y S S S E P I F R R S F S A K P T S S K S P F L S R S G S T K C P V D T S S T S K C S I S R S L S Q K G A S V T R K C R N M A K E H K S R F Y I M K R C V L M L V C W H K H A C D S,Small polypeptide DEVIL 18,Arabidopsis thaliana,Membrane,None,-43.66433334350586,-8.538784980773926,Eukaryota,Real
627,Q9LEZ1,SOB5,M E S A N I F G S D E D C R S C E S G W T M Y L A S Q S H D R D D D C Y Y G D D D E E E E D S D G G D S M D S D A S S G P M E A T S Y L K L A Q E I E E Q N S I K K K K K K T N E E M V L V E T T R V H N N I N H D D D D D D D E D D G D N H D Y D D G N D S Y S V V H S Y V G S V R Q K G L V,Protein SUPPRESSOR OF PHYTOCHROME B 5,Arabidopsis thaliana,Membrane,None,-13.575672149658203,9.726423263549805,Eukaryota,Real
628,Q1PFD8,LTPG9,M E I N K F L A V V V A V V V L Y S V E A T A Q G G N P Q L T A C L Q K L L P C Q P Y I H S L N P P P P P S C C G P M K E I V E K D A P C L C I A F N N P E V L K A L N L T K E N A L L L P K A C G V N P D V S L C S K I A T P S P I A S P G S T N G T S S A S T I S F N R F S F L S A F V A M I F F,Non specific lipid transfer protein GPI anchored 9,Arabidopsis thaliana,Membrane,None,-8.576301574707031,-31.61210060119629,Eukaryota,Real
629,Q0WPR6,SAUR65,M I N T K K L L K M A K K W Q Q R A A L K R K R I S F Q R S T T T T T T T T T T T S S S T A V E K G C F V V Y T V D K I R F A F P L S Y L N N S V F E E L L K I S E E E F G L R A G G P I T L P F D S V F L E Y L I K F I E R R M D G D T E K A L L M S I S S A R C S M Q P Q E Q Q S G Y T Q Q L L V F,Auxin responsive protein SAUR65,Arabidopsis thaliana,Membrane,None,-6.155266761779785,20.184162139892578,Eukaryota,Real
630,P59220,CAM7,M A D Q L T D D Q I S E F K E A F S L F D K D G D G C I T T K E L G T V M R S L G Q N P T E A E L Q D M I N E V D A D G N G T I D F P E F L N L M A R K M K D T D S E E E L K E A F R V F D K D Q N G F I S A A E L R H V M T N L G E K L T D E E V D E M I R E A D V D G D G Q I N Y E E F V K V M M A K,Calmodulin 7,Arabidopsis thaliana,Membrane,None,19.279325485229492,23.097042083740234,Eukaryota,Real
631,P0DH95,CAM1,M A D Q L T D E Q I S E F K E A F S L F D K D G D G C I T T K E L G T V M R S L G Q N P T E A E L Q D M I N E V D A D G N G T I D F P E F L N L M A K K M K D T D S E E E L K E A F R V F D K D Q N G F I S A A E L R H V M T N L G E K L T D E E V E E M I R E A D V D G D G Q I N Y E E F V K I M M A K,Calmodulin 1,Arabidopsis thaliana,Membrane,None,19.23396110534668,23.106483459472656,Eukaryota,Real
632,Q9LY91,AGP6,M A R Q F V V L V L L T L T I A T A F A A D A P S A S P K K S P S P T A A P T K A P T A T T K A P S A P T K A P A A A P K S S S A S S P K A S S P A A E G P V P E D D Y S A S S P S D S A E A P T V S S P P A P T P D S T S A A D G P S D G P T A E S P K S G A V T T A K F S V V G T V A T V G F F F F S F,Classical arabinogalactan protein 6,Arabidopsis thaliana,Membrane,None,-7.1499762535095215,-34.3576545715332,Eukaryota,Real
633,Q6NLF7,LTPG7,M T K T M M I F A A A M T V M A L L L V P T I E A Q T E C V S K L V P C F N D L N T T T T P V K E C C D S I K E A V E K E L T C L C T I Y T S P G L L A Q F N V T T E K A L G L S R R C N V T T D L S A C T A K G A P S P K A S L P P P A P A G N T K K D A G A G N K L A G Y G V T T V I L S L I S S I F F,Non specific lipid transfer protein GPI anchored 7,Arabidopsis thaliana,Membrane,None,-8.54251766204834,-31.906614303588867,Eukaryota,Real
634,Q9LQU2,PCR1,M E A Q L H A K P H A Q G E W S T G F C D C F S D C R N C C I T L C C P C I T F G Q V A E I V D R G S K S C C A A G A L Y M L I D L I T S C G R M Y A C F Y S G K M R A Q Y N I K G D G C T D C L K H F C C N L C A L T Q Q Y R E L K H R G F D M S L G W A G N A E K Q Q N Q G G V A M G A P A F Q G G M T R,Protein PLANT CADMIUM RESISTANCE 1,Arabidopsis thaliana,Membrane,None,9.941204071044922,3.514756917953491,Eukaryota,Real
635,Q9FFY3,LTPG30,M M M G M K F F S F Y V V L L L V A A S S G M R I N G Q S V S C L N Q L A P C L N Y L N G T K E V P Q V C C N P L K S V I R N N P E C L C R M I S N R W S S Q A E R A G I D V N D A Q M L P A R C G E H V N P I A C L T R S R G G S T N S D R S S S I G N T F S Q S Y W M T T L A I A A T V L S Y C H H I I S,Non specific lipid transfer protein GPI anchored 30,Arabidopsis thaliana,Membrane,None,-36.84302520751953,-10.549647331237793,Eukaryota,Real
636,Q66GI1,At4g37235,M V R T T A S F G T S S S F V L R L G Q T L F S S A S L L F M C F N D D E D F Y A Y T T F C Y L V T V M G L V T P W S V T L A L M E A Y S I L V K K L P M Q A T V I S V I V A G D F V L S F L S L G G A C S T A S V A V L L M D A G E K Q C D R Y K L S A T M A F L S S F L S F A S T F F N F C L L P S L M S H,CASP like protein 5C1,Arabidopsis thaliana,Membrane,None,-9.39436149597168,4.42070198059082,Eukaryota,Real
637,P83854,Gng13,G P Q Q E N M M E E,Putative G protein coupled receptor Fragment,Mus musculus,Membrane,None,-21.194520950317383,13.012235641479492,Eukaryota,Real
638,Q9JMF3,Gng5,M E E W D V P Q M K K E V E S L K Y Q L A F K R E M S S K T I P E L L K W I E D G I P K D P F L N P D L M K N N P W V E K A K C T I L,Guanine nucleotide binding protein G I G S G O subunit gamma 13,Mus musculus,Membrane,None,-6.319454669952393,12.07314395904541,Eukaryota,Real
639,Q80SZ7,Gng10,M S G S S S V A A M K K V V Q Q L R L E A G L N R V K V S Q A A A D L K Q F C L Q N A Q H D P L L T G V S S S T N P F R P Q K V C S F L,Guanine nucleotide binding protein G I G S G O subunit gamma 5,Mus musculus,Membrane,None,-1.716170072555542,13.249807357788086,Eukaryota,Real
640,Q9CXP8,Gng7,M S S G A S V S A L Q R L V E Q L K L E A G V E R I K V S Q A A A E L Q Q Y C I Q N A C K D A L L L G V P A G S N P F R E P R S C A L L,Guanine nucleotide binding protein G I G S G O subunit gamma 10,Mus musculus,Membrane,None,8.871654510498047,10.078792572021484,Eukaryota,Real
641,Q61016,Gngt2,M S G T N N V A Q A R K L V E Q L R I E A G I E R I K V S K A S S D L M G Y C E Q H A R N D P L L V G V P A S E N P F K D K K P C I I L,Guanine nucleotide binding protein G I G S G O subunit gamma 7,Mus musculus,Membrane,None,10.263508796691895,12.488676071166992,Eukaryota,Real
642,Q61017,Gng8,M A Q D L S E K E L L R M E V E Q L K K E V K N P R D L I S K T G K E I K D Y V E A Q A G T D P L L K G I P E D K N P F K E K G T C V L S,Guanine nucleotide binding protein G I G S G O subunit gamma T2,Mus musculus,Membrane,None,-8.6832857131958,9.055585861206055,Eukaryota,Real
643,P63078,Gng2,M S N N M A K I A E A R K T V E Q L K L E V N I D R M K V S Q A A A E L L A F C E T H A K D D P L V T P V P A A E N P F R D K R L F C T L L,Guanine nucleotide binding protein G I G S G O subunit gamma 8,Mus musculus,Membrane,None,-7.048681735992432,8.4636812210083,Eukaryota,Real
644,P63213,Gng12,M A S N N T A S I A Q A R K L V E Q L K M E A N I D R I K V S K A A A D L M A Y C E A H A K E D P L L T P V P A S E N P F R E K K F F C A I L,Guanine nucleotide binding protein G I G S G O subunit gamma 2,Mus musculus,Membrane,None,0.9049339890480042,11.646341323852539,Eukaryota,Real
645,Q9DAS9,Gng11,M S S K T A S T N S I A Q A R R T V Q Q L R L E A S I E R I K V S K A S A D L M S Y C E E H A R S D P L L M G I P T S E N P F K D K K T C I I L,Guanine nucleotide binding protein G I G S G O subunit gamma 12,Mus musculus,Membrane,None,-0.08549544960260391,15.034632682800293,Eukaryota,Real
646,P61953,Cd52,M P A L H I E D L P E K E K L K M E V E Q L R K E V K L Q R Q Q V S K C S E E I K N Y I E E R S G E D P L V K G I P E D K N P F K E K G S C V I S,Guanine nucleotide binding protein G I G S G O subunit gamma 11,Mus musculus,Membrane,None,2.8685712814331055,7.989753723144531,Eukaryota,Real
647,Q64389,Gngt1,M K S F L L F L T I I L L V V I Q I Q T G S L G Q A T T A A S G T N K N S T S T K K T P L K S G A S S I I D A G A C S F L F F A N T L M C L F Y L S,CAMPATH 1 antigen,Mus musculus,Membrane,None,-35.37429428100586,-10.90487003326416,Eukaryota,Real
648,Q61012,Gng3,M P V I N I E D L T E K D K L K M E V D Q L K K E V T L E R M M V S K C C E E V R D Y I E E R S G E D P L V K G I P E D K N P F K E L K G G C V I S,Guanine nucleotide binding protein G T subunit gamma T1,Mus musculus,Membrane,None,-2.0376689434051514,8.870260238647461,Eukaryota,Real
649,P63216,Gng4,M K G E T P V N S T M S I G Q A R K M V E Q L K I E A S L C R I K V S K A A A D L M T Y C D A H A C E D P L I T P V P T S E N P F R E K K F F C A L L,Guanine nucleotide binding protein G I G S G O subunit gamma 3,Mus musculus,Membrane,None,30.14212417602539,20.982892990112305,Eukaryota,Real
650,P50153,Cd24,M K E G M S N N S T T S I S Q A R K A V E Q L K M E A C M D R V K V S Q A A S D L L A Y C E A H V R E D P L I I P V P A S E N P F R E K K F F C T I L,Guanine nucleotide binding protein G I G S G O subunit gamma 4,Mus musculus,Membrane,None,0.5323560833930969,12.781810760498047,Eukaryota,Real
651,P24807,Svip,M G R A M V A R L G L G L L L L A L L L P T Q I Y C N Q T S V A P F P G N Q N I S A S P N P S N A T T R G G G S S L Q S T A G L L A L S L S L L H L Y C,Signal transducer CD24,Mus musculus,Membrane,None,-17.298980712890625,-29.834501266479492,Eukaryota,Real
652,Q3UZP4,Smim1,M G L C F P C P A E S A P P S P S P E E K R E K L A E A A E R R Q K E A A T R G I L D I Q S V E A K K K K K E Q L E K Q M A T S G P P T A G G L R W T V S,Small VCP p97 interacting protein,Mus musculus,Membrane,None,6.6233673095703125,7.234089374542236,Eukaryota,Real
653,P0C8K7,Cdc42se1,M Q S Q E S G V H Y S R W D S S S R D E V S M T A M S S S E E A S C Y R R I S Q K L C S G K L G I A M K V L G G V A L F W I I F I L G Y I T G Y Y V H K C K,Small integral membrane protein 1,Mus musculus,Membrane,None,-33.371864318847656,-1.775849461555481,Eukaryota,Real
654,Q8BHL7,Akap7,M S E F W H K L G C C V V E K P Q P K K K R R R I D R T M I G E P M N F V H L T H I G S G E M G A G D G L A M T G A V Q E Q M R S K G N H R D R P W S N S R A L,CDC42 small effector protein 1,Mus musculus,Membrane,None,-17.507802963256836,12.178462028503418,Eukaryota,Real
655,O55074,Cdc42se2,M G Q L C C F P F A R D E G K I C E K D R R E P E D A E L V R L S K R L V E N A V L K A V Q Q Y L E E T Q N K K Q P G E G N S T K A E E G D R N G D G S D N N R K,A kinase anchor protein 7 isoform alpha,Mus musculus,Membrane,None,-19.655609130859375,9.05807113647461,Eukaryota,Real
656,Q8BGH7,Mymx,M S E F W L C F N C C I A E Q P Q P K R R R R I D R S M I G E P T N F V H T A H V G S G D L F S G M N S V S S I Q N Q M Q S K G G Y G G G M P A N V Q M Q L V D T K A G,CDC42 small effector protein 2,Mus musculus,Membrane,None,-18.835805892944336,16.896446228027344,Eukaryota,Real
657,Q2Q5T5,Fcer1g,M P V P L L P M V L R S L L S R L L L P V A R L A R Q H L L P L L R R L A R R L S S Q D M R E A L L S C L L F V L S Q Q Q P P D S G E A S R V D H S Q R K E R L G P Q K,Protein myomixer,Mus musculus,Membrane,None,-22.20262908935547,6.4580230712890625,Eukaryota,Real
658,P20491,Fxyd3,M I S A V I L F L L L L V E Q A A A L G E P Q L C Y I L D A V L F L Y G I V L T L L Y C R L K I Q V R K A A I A S R E K A D A V Y T G L N T R S Q E T Y E T L K H E K P P Q,High affinity immunoglobulin epsilon receptor subunit gamma,Mus musculus,Membrane,None,14.506601333618164,6.896572589874268,Eukaryota,Real
