,ID,Gene,Sequence,Description,Organism,Protein type,Class,x_coords,y_coords,Domain,Types
695,P67816,None,V L S S K D K A N I K T A F G K I G G H A A D Y G A E A L E R M F L G F P T T K T Y F P H F D L S H G S A Q V K A H G K K V G D A L T K A A D H L D D L P S A L S A L S D L H A H K L R V D P V N F K L L S H C L L V T V A A H H P G D F T P A V H A S L D K F L A N V S T V L T S K Y R,Hemoglobin subunit alpha,Vicugna pacos,Globular,Hemoglobin,5.681058406829834,-42.73881912231445,None,Real
696,P10057,None,V L S A N D K S N V K G V F S K I S S H A E E Y G A E T L E R M F T T Y P Q T K T Y F P H F D L H H G S A Q V K A H G K K V A T A L M E A A N H I D D I A G A L S K L S D L H A Q K L R V D P V N F K L L G Q C F L V V M A I H H P S A L T P E V H A S L D K F L C A V G N V L T S K Y R,Hemoglobin subunit alpha,Eudyptes chrysocome,Globular,Hemoglobin,22.899728775024414,-43.02582931518555,None,Real
697,P07034,None,V L S A A D K A N V K G V F S K I G G H A D D Y G A E T L E R M F I A Y P Q T K T Y F P H F D L H H G S A Q I K A H G K K V A A A L V E A V N H I D D I T G A L S K L S D L H A Q K L R V D P V N F K F L G H C F L V V V A I H H P A A L T P E V H A S L D K F M C A V G A V L T A K Y R,Hemoglobin subunit alpha A,Chloephaga melanoptera,Globular,Hemoglobin,22.185386657714844,-43.939613342285156,None,Real
698,P11753,None,V L S P A D K T N V K A A W D K V G G N A G E Y G A E A L E R M F L S F P T T K T Y F P H F D L A H G S P Q V K G H G K K V G D A L T N A V S H I D D L P G A L S A L S D L H A Y K L R V D P V N F K L L S H C L L V T L A N H L P S D F T P A V H A S L D K F L A S V S T V L T S K Y R,Hemoglobin subunit alpha,Cynopterus sphinx,Globular,Hemoglobin,7.465386390686035,-55.1186637878418,None,Real
699,P41331,None,V L T E E D K A R V R V A W V P V S K N A E L Y G A E T L T R L F A A H P T T K T Y F P H F D L S P G S N D L K V H G K K V I D A L T E A V N N L D D V A G A L S K L S D L H A Q K L R V D P D N F Q F L G L C L E V T I A A H S G G P L K P E V L L S V D K F L G Q I S K V L A S R Y R,Hemoglobin subunit alpha,Hydrophis gracilis,Globular,Hemoglobin,9.946355819702148,-21.33649444580078,None,Real
0,O86229,HI_0870.1,M V L Y F Y N K I N R S F G L M I L L Y F F R S G G L A F R I S E L F L I F S I P L F A L L I N E L S G V N R V L M F F I L V Y Y I S I V F L R R I Y V H V V F G V N T F L P Y K P I F D S Y L,,Haemophilus influenzae (strain ATCC 51907 / DSM 11121 / KW20 / Rd),Membrane,None,-31.019601821899414,13.026845932006836,Archaea,Real
1,O05401,yrhK,M K G N E E H D I Q K E L K R Y E L F F K K R Y K V L Y T V N D F I I G A M F L V G S F F F F Y D R L M S A G I W L F A I G S L L L L I R P T I R L I H D F H Y R K H V E Q Q F K H Q S S T D D,Uncharacterized protein YrhK,Bacillus subtilis (strain 168),Membrane,None,16.55550765991211,-10.099452018737793,Archaea,Real
2,B0R610,cbiN,M N R W L A A G G I L L G A L V V F S F V S A G A W G G A D G V A G D T I T T I N P S Y E P W F Q S L W T P P S G E I E S L L F S I Q A A V G G I I I G Y Y L G R D R P R G Q S Q D M G S D L P,Cobalt transport protein CbiN,Halobacterium salinarum (strain ATCC 29341 / DSM 671 / R1),Membrane,None,-11.757893562316895,-10.762989044189453,Archaea,Real
3,Q9HPH5,cbiN,M N R W L A A G G I L L G A L V V F S F V S A G A W G G A D G V A G D T I T T I N P S Y E P W F Q S L W T P P S G E I E S L L F S I Q A A V G G I I I G Y Y L G R D R P R G Q S Q D M G S D L P,Cobalt transport protein CbiN,Halobacterium salinarum (strain ATCC 700922 / JCM 11081 / NRC-1),Membrane,None,-11.75786018371582,-10.762968063354492,Archaea,Real
4,O26484,ehaA,M I I H V T Y L S G Y L A A I I S S I I V S A I L G L P L T P E R P A R H S W T P S A I F P T P V I A L G L T A I S I K L G V T G I Y G A D L G A V A G V L S A I M T A Y F L E D I F P R P E D S,Probable NiFe hydrogenase type 3 Eha complex membrane subunit A,Methanothermobacter thermautotrophicus (strain ATCC 29096 / DSM 1053 / JCM 10044 / NBRC 100330 / Delta H),Membrane,None,-15.128569602966309,-6.24565315246582,Archaea,Real
5,A4FW42,cbiN,M E F K H V L M I L G V I I L I L A P L I M Y S G L G E D E G Y F G G A D G A A G D L I M E I S P N Y E P W F E P F W E P P S G E I E S L L F A L Q A A I G A I I I G Y F F G Y N K A K Y E D K N,Cobalt transport protein CbiN,Methanococcus maripaludis (strain C5 / ATCC BAA-1333),Membrane,None,-4.237799167633057,-8.507942199707031,Archaea,Real
6,A9A9I2,cbiN,M E F K H V L M I L G V I I L T L A P L I M Y S G L G E D E G Y F G G A D G A A G D L I M E I S P N Y E P W F E P F W E P P S G E I E S L L F A L Q A A I G A M I I G Y F F G Y N K A K Y D D K N,Cobalt transport protein CbiN,Methanococcus maripaludis (strain C6 / ATCC BAA-1332),Membrane,None,-4.549898147583008,-8.358044624328613,Archaea,Real
7,A6VH67,cbiN,M E F K H V L M I L G V I I L T L A P L I M Y S G L G E D E G Y F G G A D G A A G D L I M E I S P N Y E P W F E P F W E P P S G E I E S L L F A L Q A A I G A L I I G Y F F G Y N K A K Y D D Q N,Cobalt transport protein CbiN,Methanococcus maripaludis (strain C7 / ATCC BAA-1331),Membrane,None,-4.930158615112305,-8.733266830444336,Archaea,Real
8,Q8TY29,ehaA,M K D P G L V A V G V A A A V A F G T A L A L G L P P I Q R D K P R R K S W E V S A A F P T P V I A A G A T V L V I R V I G Y H P P I P L A I V G A V V G A L S A A F T A Y I E K V F P R P E A G,Probable NiFe hydrogenase type 3 Eha complex membrane subunit A,Methanopyrus kandleri (strain AV19 / DSM 6324 / JCM 9639 / NBRC 100938),Membrane,None,-14.289339065551758,-6.324440002441406,Archaea,Real
9,O30139,AF_0097,M A S Y V F I R V S K I R K G Y F P V L L A I G F A I T F A E G F I L F L V N F G A I P T N G P T I Q L V P Q I I M Q N P N P L I R F Y G T L I L L C F L N T I V L S I F Y A T I A K L L P K F S G,,Archaeoglobus fulgidus (strain ATCC 49558 / DSM 4304 / JCM 9628 / NBRC 100126 / VC-16),Membrane,None,-21.22659683227539,-6.221297740936279,Archaea,Real
10,Q6LX70,cbiN,M E F K H V L M I L G V I I L T L A P L I M Y S G L G E D E G Y F G G A D G A A G D L I M E I S P N Y E P W F E P F W E P P S G E I E S L L F A L Q A A I G A I I I G Y F F G Y N K A K Y D A K N Q,Cobalt transport protein CbiN,Methanococcus maripaludis (strain S2 / LL),Membrane,None,-5.600710391998291,-8.429976463317871,Archaea,Real
11,Q9UXQ8,ehaA,M I I H V T Y L S G Y I T G I I S S I I I S A I L G L P L A P E R P A R H S W T P S A I F P A P I I A M G L V A I C I K L G V T G M Y G G V D L G V V S G L L A A L M T A Y F L E D I F P R P E D L,Probable NiFe hydrogenase type 3 Eha complex membrane subunit A,Methanothermobacter marburgensis (strain ATCC BAA-927 / DSM 2133 / JCM 14651 / NBRC 100331 / OCM 82 / Marburg),Membrane,None,-18.60232162475586,-5.7212114334106445,Archaea,Real
12,Q57948,ehaA,M V Y N N S L L V R V M D I I I L Y L I A L I T S V I V A L V L K L P I I P K E K P I R F S F E T S I I F P T P I L A L G I E A I F R N L F G D Y I S L A F F A G L F G A L L S K Y A D K L F G E P,Probable NiFe hydrogenase type 3 Eha complex membrane subunit A,Methanocaldococcus jannaschii (strain ATCC 43067 / DSM 2661 / JAL-1 / JCM 10045 / NBRC 100440),Membrane,None,-23.315107345581055,-0.937955379486084,Archaea,Real
13,O28150,AF_2130,M D A T T N F F I S Y F L P L I S F L G L L N L L Y T L Y S R S R M D R L R F I S S S V V S I F T I L F G T M P Y A R Y N R L L G E S F C N L M V F V L P V S F F L V S L L L W L L R N K Y V S E L K,,Archaeoglobus fulgidus (strain ATCC 49558 / DSM 4304 / JCM 9628 / NBRC 100126 / VC-16),Membrane,None,-17.923490524291992,-8.63467788696289,Archaea,Real
14,Q58911,MJ1516,M M A M N E I E L M Q I K D F V K D M D K N Q R I V Y Y E Q K K K S V G I A V L L S F I I P G A G Q M Y L G R V G K G I I L L L T C W L I I P W I Y S I Y D A Y K S A K D Y N A Q L Y S I I F S K D D,Uncharacterized protein MJ1516,Methanocaldococcus jannaschii (strain ATCC 43067 / DSM 2661 / JAL-1 / JCM 10045 / NBRC 100440),Membrane,None,-25.05510902404785,-2.0626871585845947,Archaea,Real
15,A6UQC5,cbiN,M E L K H V L M I I G I I I L T I A P L V M Y S G L T E E D G Y F G G A D G A A S D L I M E L S P E Y E P W F E P F W E P P S G E I E S L L F A L Q A A I G A I I I G Y F F G Y N K A K Y D F E S K N,Cobalt transport protein CbiN,Methanococcus vannielii (strain ATCC 35089 / DSM 1224 / JCM 13029 / OCM 148 / SB),Membrane,None,-4.780618667602539,-7.60007381439209,Archaea,Real
16,O28985,AF_1283,M G E T S V T L I G L I V G L L F G L S G I A T L L S L M S D V V S D A Q A Q L S Q L G V A S T L V M L V I A L I L I I K V R V L S A L I V G A V I G A V L N L V L Q A N G V N I L E M L R A A V F G T,,Archaeoglobus fulgidus (strain ATCC 49558 / DSM 4304 / JCM 9628 / NBRC 100126 / VC-16),Membrane,None,-30.895633697509766,-14.893229484558105,Archaea,Real
17,Q58363,MJ0953,M R L L G V I G Y L A V L I K A I C E S W V D V V K R S I N G E I H P Q V I E I E S I I N N P T G L V L L S W S I T A T P G T L V I D L I P E E R K L K V A V I S P R S R E D I V P F E P Y I K K I F D,Uncharacterized protein MJ0953,Methanocaldococcus jannaschii (strain ATCC 43067 / DSM 2661 / JAL-1 / JCM 10045 / NBRC 100440),Membrane,None,14.446219444274902,-12.72900104522705,Archaea,Real
18,O27228,mtrB,M E M L P L V K I A P E Y N L T L D P S T G M I G A A L G R E V I I L S M D E I N E Q I A E L E A T A D D L I N S L D P T T T P L D S Y P G R E G V Y L T A G K L T N M V Y G F I L G L I I L F A L L L,Tetrahydromethanopterin S methyltransferase subunit B,Methanothermobacter thermautotrophicus (strain ATCC 29096 / DSM 1053 / JCM 10044 / NBRC 100330 / Delta H),Membrane,None,-24.228103637695312,-9.32525634765625,Archaea,Real
19,Q59584,mtrB,M E M L P L V K I A P E Y N L T L D P S T G M I G A A L G R E V I I L S M D E I N E Q I A A L E A T A D D L I N S L D P T T I P E G S Y P G R E G V Y L T A G K L T N I V Y G F I L G L I I L F A L L L,Tetrahydromethanopterin S methyltransferase subunit B,Methanothermobacter marburgensis (strain ATCC BAA-927 / DSM 2133 / JCM 14651 / NBRC 100331 / OCM 82 / Marburg),Membrane,None,-24.19317054748535,-9.554204940795898,Archaea,Real
20,D4GWC8,tatAt,M F E T I T P L F P G L P G G P E L L V V L L I V V L L F G A N K I P K L A R S S G Q A I G E F Q R G R E E I E D E L Q D M T G D D D E D D A T S E S S A D S V S T D S V S T E S S N,Sec independent protein translocase protein TatAt,Haloferax volcanii (strain ATCC 29605 / DSM 3757 / JCM 8879 / NBRC 14742 / NCIMB 2012 / VKM B-1768 / DS2),Membrane,None,15.994818687438965,-2.4707887172698975,Archaea,Real
21,Q58023,MJ0606,M D L E G K C C L I H A I G G I I F G Y L A N Y V Y T A G L G I F S G I A T L I F L F I G A V I F G H I S A K T F G E E S L T Q K Q W L G C G V L P F F L V A I V V W V L K F N G L I,Uncharacterized protein MJ0606,Methanocaldococcus jannaschii (strain ATCC 43067 / DSM 2661 / JAL-1 / JCM 10045 / NBRC 100440),Membrane,None,-32.43984603881836,19.893712997436523,Archaea,Real
22,Q57946,MJ0526,M E V L P L V S G I C C I L G G I G V I L H T N P I N K I I M L A L L E I G M I G L I V S C Y Y L D I A I V S S L C E P I C T V I L L L G Y L K Y L T T V K K K K R Y G R N L P I L S K,Uncharacterized protein MJ0526,Methanocaldococcus jannaschii (strain ATCC 43067 / DSM 2661 / JAL-1 / JCM 10045 / NBRC 100440),Membrane,None,-23.66413688659668,16.713769912719727,Archaea,Real
23,Q58620,MJ1223,M N I Y V W L F A I I A L S F S A L V G L R L S F K K G T A N V L V G E S I I T V V A G T L I V V I S Q K Y N L A F A D T I A L A I F I C G V V G A F A F C K V I G G D N E K A K Q P N,Uncharacterized protein MJ1223,Methanocaldococcus jannaschii (strain ATCC 43067 / DSM 2661 / JAL-1 / JCM 10045 / NBRC 100440),Membrane,None,-16.90231704711914,-3.4880082607269287,Archaea,Real
24,Q57574,MJ0110,M V I N M D F D I T V I G Y I A G T L T T F A S L P Q L I K S L K E K D M S N I S L A F V I T F T T G L T L W L I Y G I L R N D Y P I I V F N I L S L M F W I P I T Y L K I R D E M R K S,Uncharacterized protein MJ0110,Methanocaldococcus jannaschii (strain ATCC 43067 / DSM 2661 / JAL-1 / JCM 10045 / NBRC 100440),Membrane,None,-14.812087059020996,-8.931061744689941,Archaea,Real
25,Q59012,MJ1617,M I M K P I L I F L G I I L M F I G F F M I T L G M I L P S S Q E N Y E K P E T E K T E S S V E Y S G I V M I G P I P I V F G N S P G L M I L S V L I A I L M I I W M F L F A F G I R I K,Uncharacterized protein MJ1617,Methanocaldococcus jannaschii (strain ATCC 43067 / DSM 2661 / JAL-1 / JCM 10045 / NBRC 100440),Membrane,None,-27.19620704650879,-1.6864186525344849,Archaea,Real
26,Q57994,MJ0574,M W P C P I G F G M V G F P I F G F F F M G L F F V I G I A V F I I I I I T I V D I L K R D A L D T L E K I L W I L V V W F L G I I G A I I Y Y L L S K R N S K S K G D N N G K N I G S N,Uncharacterized protein MJ0574,Methanocaldococcus jannaschii (strain ATCC 43067 / DSM 2661 / JAL-1 / JCM 10045 / NBRC 100440),Membrane,None,-19.715269088745117,4.146893501281738,Archaea,Real
27,Q57740,MJ0292,M V M L M E Q F I G I V K D I L V L I A S F G I L L A S Y R L W I E K D R K N I I Y A R I H I L G V I D C A C F L I F I A L G E T L L A F V Y L I L A P F L A H A I A H A A Y N D N L S E,Uncharacterized protein MJ0292,Methanocaldococcus jannaschii (strain ATCC 43067 / DSM 2661 / JAL-1 / JCM 10045 / NBRC 100440),Membrane,None,-16.940242767333984,-5.484321594238281,Archaea,Real
28,Q57938,MJ0518,M G L F E L N L A I I L F I I G N F I G L E Y S Y R K Y S S P Y V E K G I D K F A L A I S V F G G I L I N S P L Y M L G C L L I G F P L G M R P G Y G R V E F V V G L A V A L F L Y F L R W,Uncharacterized protein MJ0518,Methanocaldococcus jannaschii (strain ATCC 43067 / DSM 2661 / JAL-1 / JCM 10045 / NBRC 100440),Membrane,None,-25.43687629699707,-7.03767728805542,Archaea,Real
29,O29522,AF_0736,M C Y T L G F V T G V L F L L F D R S P F V R F H A V Q S T L T F S T I T A L V I L L P V L P G G A L L S R V V M A F S I I L W A F C I V K A S R G E A F K L P I F G D I A E E Q L S L N Y T,,Archaeoglobus fulgidus (strain ATCC 49558 / DSM 4304 / JCM 9628 / NBRC 100126 / VC-16),Membrane,None,14.767361640930176,-12.3583345413208,Archaea,Real
30,Q58490,cbiN,M E T K H I I L L A I V A I I I A L P L I I Y A G K G E E E G Y F G G S D D Q G C E V V E E L G Y K P W F H P I W E P P S G E I E S L L F A L Q A A I G A I I I G Y Y I G Y Y N A K R Q V A A,Cobalt transport protein CbiN,Methanocaldococcus jannaschii (strain ATCC 43067 / DSM 2661 / JAL-1 / JCM 10045 / NBRC 100440),Membrane,None,-2.308934450149536,-9.978472709655762,Archaea,Real
31,O26234,cbiN,M D K R H I L M L L A V I I I S V A P L I I Y S G H G E D D G Y F G G A D D S A G D A I T E T G Y K P W F Q P L W E P P S G E I E S L L F A L Q A A I G A L I I G Y V F G Y Y R G R G E S S E,Cobalt transport protein CbiN,Methanothermobacter thermautotrophicus (strain ATCC 29096 / DSM 1053 / JCM 10044 / NBRC 100330 / Delta H),Membrane,None,-2.7797107696533203,-10.923027038574219,Archaea,Real
32,Q50799,cbiN,M D K R H T I M L I A V A V I A I A P L V I Y S G L G E D Q G Y F G G A D D S A S K A I S E T G Y K P W F Q P I W E P P S G E I E S L L F A L Q A A I G A L I I G Y V F G Y Y R G R G E S P E,Cobalt transport protein CbiN,Methanothermobacter marburgensis (strain ATCC BAA-927 / DSM 2133 / JCM 14651 / NBRC 100331 / OCM 82 / Marburg),Membrane,None,-2.790674924850464,-10.98676872253418,Archaea,Real
33,O29292,AF_0970,M L D L S Q T I E K V G E K M P W P P K V F W V G L V V Y Y G F V A L C W I G E A T A G I N H I P T A A F W Y A S F L G T F L I P L F M S I I Y F Y F P E K A E E A R G G S,,Archaeoglobus fulgidus (strain ATCC 49558 / DSM 4304 / JCM 9628 / NBRC 100126 / VC-16),Membrane,None,-23.480417251586914,0.5582301020622253,Archaea,Real
34,O27318,MTH_1250,M M D I L I I A E Y T L L A S L A V F S I A A V R I A T R R N I R M G L V G I S G L N I A I A T I L I L I N R M Y G I G F C R D I A Y A L V L L G P V G T I A F A R V L R G,,Methanothermobacter thermautotrophicus (strain ATCC 29096 / DSM 1053 / JCM 10044 / NBRC 100330 / Delta H),Membrane,None,-16.252742767333984,-13.723963737487793,Archaea,Real
35,O27225,mtrG,M S E E D K T T I P R V L V S A D E F N K A N E R L D D I E E K V E F T V G E Y S Q R I G Q Q I G R D I G I L Y G I V I G L I I L A V T N I L F A G L L K G L L K S L F G L,Tetrahydromethanopterin S methyltransferase subunit G,Methanothermobacter thermautotrophicus (strain ATCC 29096 / DSM 1053 / JCM 10044 / NBRC 100330 / Delta H),Membrane,None,-45.786224365234375,2.2999775409698486,Archaea,Real
36,Q50774,mtrG,M S E E E K T T I P R V L V S A D E F N K A N E K L D E I E E K V E F T V G E Y S Q R I G Q Q I G R D I G I L Y G I V I G L I I L A V T N I L F A G L L K G L L K S L F G L,Tetrahydromethanopterin S methyltransferase subunit G,Methanothermobacter marburgensis (strain ATCC BAA-927 / DSM 2133 / JCM 14651 / NBRC 100331 / OCM 82 / Marburg),Membrane,None,-45.78524398803711,2.301015615463257,Archaea,Real
37,O29529,cbiN,M K K L L L L L I L L I F A A K V T A E E W A G A D E K A E E V I K E L K P D Y E P W F S P I F E P P S G E I E S M L F S L Q A A I G S L I I G Y F L G Y Y R G L K H A R N A,Cobalt transport protein CbiN,Archaeoglobus fulgidus (strain ATCC 49558 / DSM 4304 / JCM 9628 / NBRC 100126 / VC-16),Membrane,None,-7.443017482757568,-8.447663307189941,Archaea,Real
38,Q6LXA4,ehaA,M V L L I N Y A V S L V S A I V V G A V L G M K L S F D M D S F E G S V L F P T P F V A I G L T A L I G Y L I T L D L V S S I I I G I F A S V F S K F T N K I F P G V N N D I N,Probable NiFe hydrogenase type 3 Eha complex membrane subunit A,Methanococcus maripaludis (strain S2 / LL),Membrane,None,-18.426372528076172,1.6316757202148438,Archaea,Real
39,P81301,MJ0323,M F L A L T S I A I P A A I V I P I S L I A N L P N C G I S L T F S M T I G F V G L I L T I A A S P V F K N C G F S S M T C P V L G S N F F N N S M N V H A T C A V C A W K T G V,Uncharacterized protein MJ0323,Methanocaldococcus jannaschii (strain ATCC 43067 / DSM 2661 / JAL-1 / JCM 10045 / NBRC 100440),Membrane,None,-28.89823341369629,13.39893627166748,Archaea,Real
40,Q58202,MJ0792,M K F L E K G V Y K I F G A V I L V S M I G A L V A E P I A L G D A G L Y Y Q Y Y V G D I D T A Q Q C Y L V A A D S A I T G A A I S A A L G P A G L A S G V F T V V F S T T V L A,Uncharacterized protein MJ0792,Methanocaldococcus jannaschii (strain ATCC 43067 / DSM 2661 / JAL-1 / JCM 10045 / NBRC 100440),Membrane,None,-30.698440551757812,-12.442357063293457,Archaea,Real
41,O29670,AF_0585,M G D Y F D I L T L I L T A I Y L L I G G G F I I Y I Y D T Y K R T K Q E F L I Y L S I G F F L L I I G A S L P V L T F V A Q V L D M S V V V V A I L M Q I A G L S S I F Y S I V R,,Archaeoglobus fulgidus (strain ATCC 49558 / DSM 4304 / JCM 9628 / NBRC 100126 / VC-16),Membrane,None,2.5699212551116943,-27.206222534179688,Archaea,Real
42,O28817,AF_1455,M L S L Y T R L L R R I N R I D L R D D L N L W G L R I A G G L M I G V G L L F G V F M A S V S A V F G E P F M L G I S I L I V G L V I P G A F A L F R S T R R Y P I V H I G F L K,,Archaeoglobus fulgidus (strain ATCC 49558 / DSM 4304 / JCM 9628 / NBRC 100126 / VC-16),Membrane,None,-20.326549530029297,-7.249107837677002,Archaea,Real
43,D4GVK4,tatAo,M L D S I P L F P G L P G G P E L L I V L L I V V L L F G A N K L P Q L A R S S G Q A M G E F R R G R E E I E E E L K K G A E G G D D E G E N G D E A E A D D A D A T E T E A E S R,Sec independent protein translocase protein TatAo,Haloferax volcanii (strain ATCC 29605 / DSM 3757 / JCM 8879 / NBRC 14742 / NCIMB 2012 / VKM B-1768 / DS2),Membrane,None,15.68294620513916,-2.8410277366638184,Archaea,Real
44,O30318,AF_2352,M T S T F F K Y S V L L L P A L I N L A A F L T N F Q T N T L P V E P I N L Y L S N F V H S D F Y H L T G N I V V Y I V S A F L S F I F F R N S D M K G F S G Y L L P S Y S F L Y H I,,Archaeoglobus fulgidus (strain ATCC 49558 / DSM 4304 / JCM 9628 / NBRC 100126 / VC-16),Membrane,None,-33.52400588989258,1.5264562368392944,Archaea,Real
45,O28748,AF_1524,M R E D R L F A R F V E Y S F F A V F A A L I V S Y A L D K L F G T S L S P L L V F L L T L I P A I G L I L I L P F S S R K T A I L T V A V L I E M A V A L Y L A F R,,Archaeoglobus fulgidus (strain ATCC 49558 / DSM 4304 / JCM 9628 / NBRC 100126 / VC-16),Membrane,None,-19.41070556640625,-14.093621253967285,Archaea,Real
46,O30088,AF_0149,M V F A Y V L V S G F M L V L G I K Y G R T K I Y S V W K A G L I I L A G F A V I F A A A W I A F T G T S A S Q E R I G L A K S L S V V M G L I A G V L S V Y V L S K S,,Archaeoglobus fulgidus (strain ATCC 49558 / DSM 4304 / JCM 9628 / NBRC 100126 / VC-16),Membrane,None,-20.53298568725586,-12.823773384094238,Archaea,Real
47,Q57939,MJ0519,M D K M K S Y I Y F F T I A C I I A V I Y C V L V N L L Q I N V I P V V L A F S L I L I L T I S T I N K K I A H K M E D I E V L F M L L V L A F F A Y A I Y K L Y I P V,Uncharacterized protein MJ0519,Methanocaldococcus jannaschii (strain ATCC 43067 / DSM 2661 / JAL-1 / JCM 10045 / NBRC 100440),Membrane,None,-31.83086585998535,19.216833114624023,Archaea,Real
48,Q58263,mtrG,M S E D E K L P Q V I M D P A D Y E A L K K R L D E L E K K V E N T N A E L F Q L A G K K V G R D I G I L Y G L V I G I I L S Y I L P A L I K I I Q I L S L K V L V Q Q,Tetrahydromethanopterin S methyltransferase subunit G,Methanocaldococcus jannaschii (strain ATCC 43067 / DSM 2661 / JAL-1 / JCM 10045 / NBRC 100440),Membrane,None,-26.1353816986084,-0.4354369044303894,Archaea,Real
49,O30089,AF_0148,M E A A R G W D E E V M K W L A V A I C L A M V G M A V M P A F Q P L N L A F E L Y Y G H H E S L P I T A A S A A Y E G I V I T A T L A A A A A T A E L V H L L L Q Q F L,,Archaeoglobus fulgidus (strain ATCC 49558 / DSM 4304 / JCM 9628 / NBRC 100126 / VC-16),Membrane,None,-37.645809173583984,-8.69597053527832,Archaea,Real
50,O28790,AF_1482,M D T S E L E R R A K I C L S V V T F S T S Y S L D A G V V V L A F L G I Q R F R R S S K G A K I P E F L W V T W Q S F I K V L S L L N G F V Q H Q K R Y I F I R V C I Y,,Archaeoglobus fulgidus (strain ATCC 49558 / DSM 4304 / JCM 9628 / NBRC 100126 / VC-16),Membrane,None,-27.73631477355957,7.3384599685668945,Archaea,Real
51,Q50830,mtrE,M D P T L I S L G A L A L A G A A A T V S G C A E D L E S D V G S Q S N P N S Q V Q L G P Q M G N I H R Y F N K A I S G E P V S Y G L Y V A V A G S V A W A L I N A G L N,Tetrahydromethanopterin S methyltransferase subunit E Fragment,Methanococcus vannielii,Membrane,None,-28.51418113708496,-7.827788829803467,Archaea,Real
52,Q58702,MJ1306,M L D A I L S N Y L Y Y P S I L A F L F G V L M G A K Y R H K I G N I F G Y L I L T V V I A Y F L K A F P Y Y D L L P L S C S Y L S A V I G I I I G N R L F G G K M I,Uncharacterized protein MJ1306,Methanocaldococcus jannaschii (strain ATCC 43067 / DSM 2661 / JAL-1 / JCM 10045 / NBRC 100440),Membrane,None,-21.089643478393555,-0.5285323262214661,Archaea,Real
53,O28694,AF_1578,M I F L I I S V P F G I Y S L V I Y N L T R R A P G K M R Y L I P P L L T A T L P A L Y L P L T G F K V S Y D L L P V V G Y L T Y S Q F L L L L L Q L Q R,,Archaeoglobus fulgidus (strain ATCC 49558 / DSM 4304 / JCM 9628 / NBRC 100126 / VC-16),Membrane,None,-19.578094482421875,-9.136431694030762,Archaea,Real
54,Q57643,MJ0184,M N I M I T K Q F D R H L K Y Y T T I V K V F A N G I I L I T A Y Y L V F E L P V G Y L I G L Y I I M F V V W L L V S M F F L G R L L D F M A K M D L K K,Uncharacterized protein MJ0184,Methanocaldococcus jannaschii (strain ATCC 43067 / DSM 2661 / JAL-1 / JCM 10045 / NBRC 100440),Membrane,None,-19.7362003326416,2.288264751434326,Archaea,Real
55,Q4JB68,cedA1,M T L V T F I E N L T S T V T E I G W S L F I L A W A I G W A L R G S P I P I F R I K R G G Q D L L E D A I I A A F F L A I G S T I F Y L I S Y I A S Q V S,DNA import protein CedA1,Sulfolobus acidocaldarius (strain ATCC 33909 / DSM 639 / JCM 8929 / NBRC 15157 / NCIMB 11770),Membrane,None,-26.1235294342041,-8.703442573547363,Archaea,Real
56,Q57879,MJ0437,M E I I H Y I V I I M T L L S S L A S L L Q R D L I K C I I L S G F A G L C M A Y L Y Y A L L A P D V A L T E A I L G G A I L P A L F A F T V R R T Q R I D E,Uncharacterized protein MJ0437,Methanocaldococcus jannaschii (strain ATCC 43067 / DSM 2661 / JAL-1 / JCM 10045 / NBRC 100440),Membrane,None,14.20447826385498,-10.01311206817627,Archaea,Real
57,P80654,mtrF,M A E E H E K G V P M V L A P Q M G A I D A T V E S I R Y R A Q L I A R N Q K L D S G V A A T G I I G F A A G F L F S L L M V I V L P V A V G L,Tetrahydromethanopterin S methyltransferase subunit F,Methanosarcina mazei (strain ATCC BAA-159 / DSM 3647 / Goe1 / Go1 / JCM 11833 / OCM 88),Membrane,None,-28.282817840576172,-13.507688522338867,Archaea,Real
58,Q9Y8K6,mtrG,M D G K A P A A F V E P G E F N E V M K R L D K I D E K I E F V N S E V A Q K I G K K V G R D I G I L Y G G F I G L L L F L I Y T V V S S M F M,Tetrahydromethanopterin S methyltransferase subunit G,Methanosarcina barkeri (strain Fusaro / DSM 804),Membrane,None,-30.275909423828125,-2.666206121444702,Archaea,Real
59,P80656,mtrG,M D G K A P A A F V E P G E F N E V M K R L D Q I D E K V E F V N S E V A Q R I G K K V G R D I G I L Y G G V I G L L L F L I Y V Q I S S M F M,Tetrahydromethanopterin S methyltransferase subunit G,Methanosarcina mazei (strain ATCC BAA-159 / DSM 3647 / Goe1 / Go1 / JCM 11833 / OCM 88),Membrane,None,-30.550256729125977,-2.6842761039733887,Archaea,Real
60,O28124,AF_2158,M E E G E T V R K I L L A I L F F A L V V S L V G L Y V S A N V M I D V W A G Q K Y S T V Y K V L M N A A M L L I V I Y L I Q R L I I Q P R N S D,,Archaeoglobus fulgidus (strain ATCC 49558 / DSM 4304 / JCM 9628 / NBRC 100126 / VC-16),Membrane,None,-17.082202911376953,-5.045297622680664,Archaea,Real
61,P81317,MJ1155.2,M I L D K T L F S S L T F S L T V L F L L L L I P N L K G F G K L S A I I G G F I A L I F Q Y F G Y P S L G I L F A G I L S P I I I L K I K S V K,Uncharacterized protein MJ1155 2,Methanocaldococcus jannaschii (strain ATCC 43067 / DSM 2661 / JAL-1 / JCM 10045 / NBRC 100440),Membrane,None,-20.729717254638672,0.5122477412223816,Archaea,Real
62,Q9Y8K5,mtrF,M K V A E E Y D K G V P M M L A P Q M G A I D A T V E S I R Y R A Q L I A R N Q K L D S G V A A T G M I G F A A G F L F S L L M V I V L P L L F W,Tetrahydromethanopterin S methyltransferase subunit F,Methanosarcina barkeri (strain Fusaro / DSM 804),Membrane,None,-24.47114372253418,-10.985533714294434,Archaea,Real
